[INFO] Scanning for projects...
[INFO] ------------------------------------------------------------------------
[INFO] Detecting the operating system and CPU architecture
[INFO] ------------------------------------------------------------------------
[INFO] os.detected.name: linux
[INFO] os.detected.arch: x86_64
[INFO] os.detected.version: 5.15
[INFO] os.detected.version.major: 5
[INFO] os.detected.version.minor: 15
[INFO] os.detected.release: ubuntu
[INFO] os.detected.release.version: 20.04
[INFO] os.detected.release.like.ubuntu: true
[INFO] os.detected.release.like.debian: true
[INFO] os.detected.classifier: linux-x86_64
[INFO] ------------------------------------------------------------------------
[INFO] Reactor Build Order:
[INFO] 
[INFO] Apache Ozone Integration Tests                                     [jar]
[INFO] Apache Ozone Mini Ozone Chaos Tests                                [jar]
[INFO] 
[INFO] --------------< org.apache.ozone:ozone-integration-test >---------------
[INFO] Building Apache Ozone Integration Tests 1.4.0-SNAPSHOT             [1/2]
[INFO] --------------------------------[ jar ]---------------------------------
[INFO] 
[INFO] --- maven-antrun-plugin:1.3:run (create-testdirs) @ ozone-integration-test ---
[INFO] Executing tasks
[INFO] Executed tasks
[INFO] 
[INFO] --- maven-enforcer-plugin:3.0.0-M1:enforce (depcheck) @ ozone-integration-test ---
[INFO] 
[INFO] --- jacoco-maven-plugin:0.8.5:prepare-agent (default-prepare-agent) @ ozone-integration-test ---
[INFO] argLine set to -javaagent:/home/runner/.m2/repository/org/jacoco/org.jacoco.agent/0.8.5/org.jacoco.agent-0.8.5-runtime.jar=destfile=/home/runner/work/ozone/ozone/hadoop-ozone/integration-test/target/jacoco.exec,includes=org.apache.hadoop.hdds.*:org.apache.hadoop.ozone.*:org.apache.hadoop.fs.ozone.*
[INFO] 
[INFO] --- maven-enforcer-plugin:3.0.0-M1:enforce (banned-rocksdb-imports) @ ozone-integration-test ---
[INFO] 
[INFO] --- maven-remote-resources-plugin:1.5:process (default) @ ozone-integration-test ---
[INFO] 
[INFO] --- maven-resources-plugin:3.1.0:resources (default-resources) @ ozone-integration-test ---
[INFO] Using 'UTF-8' encoding to copy filtered resources.
[INFO] skip non existing resourceDirectory /home/runner/work/ozone/ozone/hadoop-ozone/integration-test/src/main/resources
[INFO] Copying 2 resources
[INFO] 
[INFO] --- maven-compiler-plugin:3.1:compile (default-compile) @ ozone-integration-test ---
[INFO] No sources to compile
[INFO] 
[INFO] --- maven-resources-plugin:3.1.0:testResources (default-testResources) @ ozone-integration-test ---
[INFO] Using 'UTF-8' encoding to copy filtered resources.
[INFO] Copying 22 resources
[INFO] Copying 2 resources
[INFO] 
[INFO] --- maven-compiler-plugin:3.1:testCompile (default-testCompile) @ ozone-integration-test ---
[INFO] Compiling 12 source files to /home/runner/work/ozone/ozone/hadoop-ozone/integration-test/target/test-classes
[INFO] 
[INFO] --- maven-surefire-plugin:3.0.0-M5:test (default-test) @ ozone-integration-test ---
[INFO] 
[INFO] -------------------------------------------------------
[INFO]  T E S T S
[INFO] -------------------------------------------------------
[INFO] Running org.apache.hadoop.ozone.scm.pipeline.TestPipelineManagerMXBean
[INFO] Tests run: 1, Failures: 0, Errors: 0, Skipped: 0, Time elapsed: 24.815 s - in org.apache.hadoop.ozone.scm.pipeline.TestPipelineManagerMXBean
[INFO] Running org.apache.hadoop.ozone.scm.pipeline.TestSCMPipelineBytesWrittenMetrics
[INFO] Tests run: 1, Failures: 0, Errors: 0, Skipped: 0, Time elapsed: 36.775 s - in org.apache.hadoop.ozone.scm.pipeline.TestSCMPipelineBytesWrittenMetrics
[INFO] Running org.apache.hadoop.ozone.scm.pipeline.TestSCMPipelineMetrics
[INFO] Tests run: 3, Failures: 0, Errors: 0, Skipped: 0, Time elapsed: 68.269 s - in org.apache.hadoop.ozone.scm.pipeline.TestSCMPipelineMetrics
[INFO] Running org.apache.hadoop.ozone.scm.TestXceiverClientMetrics
[INFO] Tests run: 1, Failures: 0, Errors: 0, Skipped: 0, Time elapsed: 27.464 s - in org.apache.hadoop.ozone.scm.TestXceiverClientMetrics
[INFO] Running org.apache.hadoop.ozone.scm.TestSCMNodeManagerMXBean
[INFO] Tests run: 2, Failures: 0, Errors: 0, Skipped: 0, Time elapsed: 24.195 s - in org.apache.hadoop.ozone.scm.TestSCMNodeManagerMXBean
[INFO] Running org.apache.hadoop.ozone.scm.TestXceiverClientManager
[INFO] Tests run: 4, Failures: 0, Errors: 0, Skipped: 0, Time elapsed: 24.616 s - in org.apache.hadoop.ozone.scm.TestXceiverClientManager
[INFO] Running org.apache.hadoop.ozone.scm.TestSCMMXBean
[INFO] Tests run: 2, Failures: 0, Errors: 0, Skipped: 0, Time elapsed: 29.713 s - in org.apache.hadoop.ozone.scm.TestSCMMXBean
[INFO] Running org.apache.hadoop.ozone.scm.TestFailoverWithSCMHA
[INFO] Tests run: 3, Failures: 0, Errors: 0, Skipped: 0, Time elapsed: 116.678 s - in org.apache.hadoop.ozone.scm.TestFailoverWithSCMHA
[INFO] Running org.apache.hadoop.ozone.scm.TestGetCommittedBlockLengthAndPutKey
[INFO] Tests run: 3, Failures: 0, Errors: 0, Skipped: 0, Time elapsed: 30.815 s - in org.apache.hadoop.ozone.scm.TestGetCommittedBlockLengthAndPutKey
[INFO] Running org.apache.hadoop.ozone.scm.TestAllocateContainer
[INFO] Tests run: 2, Failures: 0, Errors: 0, Skipped: 0, Time elapsed: 25.324 s - in org.apache.hadoop.ozone.scm.TestAllocateContainer
[INFO] Running org.apache.hadoop.ozone.scm.TestContainerSmallFile
[INFO] Tests run: 4, Failures: 0, Errors: 0, Skipped: 0, Time elapsed: 24.843 s - in org.apache.hadoop.ozone.scm.TestContainerSmallFile
[INFO] Running org.apache.hadoop.ozone.scm.TestXceiverClientGrpc
[INFO] Tests run: 4, Failures: 0, Errors: 0, Skipped: 0, Time elapsed: 1.516 s - in org.apache.hadoop.ozone.scm.TestXceiverClientGrpc
[INFO] Running org.apache.hadoop.ozone.scm.TestStorageContainerManagerHA
[ERROR] Tests run: 8, Failures: 0, Errors: 1, Skipped: 0, Time elapsed: 891.513 s <<< FAILURE! - in org.apache.hadoop.ozone.scm.TestStorageContainerManagerHA
[ERROR] org.apache.hadoop.ozone.scm.TestStorageContainerManagerHA.testAllSCMAreRunning  Time elapsed: 616.077 s  <<< ERROR!
org.apache.hadoop.ipc.RemoteException(org.apache.hadoop.hdds.ratis.ServerNotLeaderException): Server:85baa01f-27c2-4c6b-9125-f8aa98866ecf is not the leader. Could not determine the leader node.
	at org.apache.hadoop.hdds.ratis.ServerNotLeaderException.convertToNotLeaderException(ServerNotLeaderException.java:109)
	at org.apache.hadoop.hdds.scm.ha.RatisUtil.checkRatisException(RatisUtil.java:246)
	at org.apache.hadoop.hdds.scm.protocol.ScmBlockLocationProtocolServerSideTranslatorPB.send(ScmBlockLocationProtocolServerSideTranslatorPB.java:109)
	at org.apache.hadoop.hdds.protocol.proto.ScmBlockLocationProtocolProtos$ScmBlockLocationProtocolService$2.callBlockingMethod(ScmBlockLocationProtocolProtos.java:14202)
	at org.apache.hadoop.ipc.ProtobufRpcEngine$Server.processCall(ProtobufRpcEngine.java:465)
	at org.apache.hadoop.ipc.ProtobufRpcEngine2$Server$ProtoBufRpcInvoker.call(ProtobufRpcEngine2.java:578)
	at org.apache.hadoop.ipc.ProtobufRpcEngine2$Server$ProtoBufRpcInvoker.call(ProtobufRpcEngine2.java:556)
	at org.apache.hadoop.ipc.RPC$Server.call(RPC.java:1093)
	at org.apache.hadoop.ipc.Server$RpcCall.run(Server.java:1043)
	at org.apache.hadoop.ipc.Server$RpcCall.run(Server.java:971)
	at java.security.AccessController.doPrivileged(Native Method)
	at javax.security.auth.Subject.doAs(Subject.java:422)
	at org.apache.hadoop.security.UserGroupInformation.doAs(UserGroupInformation.java:1878)
	at org.apache.hadoop.ipc.Server$Handler.run(Server.java:2976)

	at org.apache.hadoop.ipc.Client.getRpcResponse(Client.java:1612)
	at org.apache.hadoop.ipc.Client.call(Client.java:1558)
	at org.apache.hadoop.ipc.Client.call(Client.java:1455)
	at org.apache.hadoop.ipc.ProtobufRpcEngine$Invoker.invoke(ProtobufRpcEngine.java:235)
	at org.apache.hadoop.ipc.ProtobufRpcEngine$Invoker.invoke(ProtobufRpcEngine.java:122)
	at com.sun.proxy.$Proxy47.send(Unknown Source)
	at sun.reflect.GeneratedMethodAccessor55.invoke(Unknown Source)
	at sun.reflect.DelegatingMethodAccessorImpl.invoke(DelegatingMethodAccessorImpl.java:43)
	at java.lang.reflect.Method.invoke(Method.java:498)
	at org.apache.hadoop.io.retry.RetryInvocationHandler.invokeMethod(RetryInvocationHandler.java:422)
	at org.apache.hadoop.io.retry.RetryInvocationHandler$Call.invokeMethod(RetryInvocationHandler.java:165)
	at org.apache.hadoop.io.retry.RetryInvocationHandler$Call.invoke(RetryInvocationHandler.java:157)
	at org.apache.hadoop.io.retry.RetryInvocationHandler$Call.invokeOnce(RetryInvocationHandler.java:95)
	at org.apache.hadoop.io.retry.RetryInvocationHandler.invoke(RetryInvocationHandler.java:359)
	at com.sun.proxy.$Proxy47.send(Unknown Source)
	at org.apache.hadoop.hdds.scm.protocolPB.ScmBlockLocationProtocolClientSideTranslatorPB.submitRequest(ScmBlockLocationProtocolClientSideTranslatorPB.java:121)
	at org.apache.hadoop.hdds.scm.protocolPB.ScmBlockLocationProtocolClientSideTranslatorPB.getScmInfo(ScmBlockLocationProtocolClientSideTranslatorPB.java:266)
	at org.apache.hadoop.hdds.utils.HAUtils.getScmInfo(HAUtils.java:100)
	at org.apache.hadoop.hdds.scm.server.StorageContainerManager.scmBootstrap(StorageContainerManager.java:1115)
	at org.apache.hadoop.ozone.MiniOzoneHAClusterImpl$Builder.createSCMService(MiniOzoneHAClusterImpl.java:589)
	at org.apache.hadoop.ozone.MiniOzoneHAClusterImpl$Builder.build(MiniOzoneHAClusterImpl.java:425)
	at org.apache.hadoop.ozone.scm.TestStorageContainerManagerHA.init(TestStorageContainerManagerHA.java:111)
	at sun.reflect.NativeMethodAccessorImpl.invoke0(Native Method)
	at sun.reflect.NativeMethodAccessorImpl.invoke(NativeMethodAccessorImpl.java:62)
	at sun.reflect.DelegatingMethodAccessorImpl.invoke(DelegatingMethodAccessorImpl.java:43)
	at java.lang.reflect.Method.invoke(Method.java:498)
	at org.junit.platform.commons.util.ReflectionUtils.invokeMethod(ReflectionUtils.java:725)
	at org.junit.jupiter.engine.execution.MethodInvocation.proceed(MethodInvocation.java:60)
	at org.junit.jupiter.engine.execution.InvocationInterceptorChain$ValidatingInvocation.proceed(InvocationInterceptorChain.java:131)
	at org.junit.jupiter.engine.extension.TimeoutExtension.intercept(TimeoutExtension.java:149)
	at org.junit.jupiter.engine.extension.TimeoutExtension.interceptLifecycleMethod(TimeoutExtension.java:126)
	at org.junit.jupiter.engine.extension.TimeoutExtension.interceptBeforeEachMethod(TimeoutExtension.java:76)
	at org.junit.jupiter.engine.execution.ExecutableInvoker$ReflectiveInterceptorCall.lambda$ofVoidMethod$0(ExecutableInvoker.java:115)
	at org.junit.jupiter.engine.execution.ExecutableInvoker.lambda$invoke$0(ExecutableInvoker.java:105)
	at org.junit.jupiter.engine.execution.InvocationInterceptorChain$InterceptedInvocation.proceed(InvocationInterceptorChain.java:106)
	at org.junit.jupiter.engine.execution.InvocationInterceptorChain.proceed(InvocationInterceptorChain.java:64)
	at org.junit.jupiter.engine.execution.InvocationInterceptorChain.chainAndInvoke(InvocationInterceptorChain.java:45)
	at org.junit.jupiter.engine.execution.InvocationInterceptorChain.invoke(InvocationInterceptorChain.java:37)
	at org.junit.jupiter.engine.execution.ExecutableInvoker.invoke(ExecutableInvoker.java:104)
	at org.junit.jupiter.engine.execution.ExecutableInvoker.invoke(ExecutableInvoker.java:98)
	at org.junit.jupiter.engine.descriptor.ClassBasedTestDescriptor.invokeMethodInExtensionContext(ClassBasedTestDescriptor.java:506)
	at org.junit.jupiter.engine.descriptor.ClassBasedTestDescriptor.lambda$synthesizeBeforeEachMethodAdapter$21(ClassBasedTestDescriptor.java:491)
	at org.junit.jupiter.engine.descriptor.TestMethodTestDescriptor.lambda$invokeBeforeEachMethods$3(TestMethodTestDescriptor.java:171)
	at org.junit.jupiter.engine.descriptor.TestMethodTestDescriptor.lambda$invokeBeforeMethodsOrCallbacksUntilExceptionOccurs$6(TestMethodTestDescriptor.java:199)
	at org.junit.platform.engine.support.hierarchical.ThrowableCollector.execute(ThrowableCollector.java:73)
	at org.junit.jupiter.engine.descriptor.TestMethodTestDescriptor.invokeBeforeMethodsOrCallbacksUntilExceptionOccurs(TestMethodTestDescriptor.java:199)
	at org.junit.jupiter.engine.descriptor.TestMethodTestDescriptor.invokeBeforeEachMethods(TestMethodTestDescriptor.java:168)
	at org.junit.jupiter.engine.descriptor.TestMethodTestDescriptor.execute(TestMethodTestDescriptor.java:131)
	at org.junit.jupiter.engine.descriptor.TestMethodTestDescriptor.execute(TestMethodTestDescriptor.java:66)
	at org.junit.platform.engine.support.hierarchical.NodeTestTask.lambda$executeRecursively$6(NodeTestTask.java:151)
	at org.junit.platform.engine.support.hierarchical.ThrowableCollector.execute(ThrowableCollector.java:73)
	at org.junit.platform.engine.support.hierarchical.NodeTestTask.lambda$executeRecursively$8(NodeTestTask.java:141)
	at org.junit.platform.engine.support.hierarchical.Node.around(Node.java:137)
	at org.junit.platform.engine.support.hierarchical.NodeTestTask.lambda$executeRecursively$9(NodeTestTask.java:139)
	at org.junit.platform.engine.support.hierarchical.ThrowableCollector.execute(ThrowableCollector.java:73)
	at org.junit.platform.engine.support.hierarchical.NodeTestTask.executeRecursively(NodeTestTask.java:138)
	at org.junit.platform.engine.support.hierarchical.NodeTestTask.execute(NodeTestTask.java:95)
	at java.util.ArrayList.forEach(ArrayList.java:1259)
	at org.junit.platform.engine.support.hierarchical.SameThreadHierarchicalTestExecutorService.invokeAll(SameThreadHierarchicalTestExecutorService.java:41)
	at org.junit.platform.engine.support.hierarchical.NodeTestTask.lambda$executeRecursively$6(NodeTestTask.java:155)
	at org.junit.platform.engine.support.hierarchical.ThrowableCollector.execute(ThrowableCollector.java:73)
	at org.junit.platform.engine.support.hierarchical.NodeTestTask.lambda$executeRecursively$8(NodeTestTask.java:141)
	at org.junit.platform.engine.support.hierarchical.Node.around(Node.java:137)
	at org.junit.platform.engine.support.hierarchical.NodeTestTask.lambda$executeRecursively$9(NodeTestTask.java:139)
	at org.junit.platform.engine.support.hierarchical.ThrowableCollector.execute(ThrowableCollector.java:73)
	at org.junit.platform.engine.support.hierarchical.NodeTestTask.executeRecursively(NodeTestTask.java:138)
	at org.junit.platform.engine.support.hierarchical.NodeTestTask.execute(NodeTestTask.java:95)
	at java.util.ArrayList.forEach(ArrayList.java:1259)
	at org.junit.platform.engine.support.hierarchical.SameThreadHierarchicalTestExecutorService.invokeAll(SameThreadHierarchicalTestExecutorService.java:41)
	at org.junit.platform.engine.support.hierarchical.NodeTestTask.lambda$executeRecursively$6(NodeTestTask.java:155)
	at org.junit.platform.engine.support.hierarchical.ThrowableCollector.execute(ThrowableCollector.java:73)
	at org.junit.platform.engine.support.hierarchical.NodeTestTask.lambda$executeRecursively$8(NodeTestTask.java:141)
	at org.junit.platform.engine.support.hierarchical.Node.around(Node.java:137)
	at org.junit.platform.engine.support.hierarchical.NodeTestTask.lambda$executeRecursively$9(NodeTestTask.java:139)
	at org.junit.platform.engine.support.hierarchical.ThrowableCollector.execute(ThrowableCollector.java:73)
	at org.junit.platform.engine.support.hierarchical.NodeTestTask.executeRecursively(NodeTestTask.java:138)
	at org.junit.platform.engine.support.hierarchical.NodeTestTask.execute(NodeTestTask.java:95)
	at org.junit.platform.engine.support.hierarchical.SameThreadHierarchicalTestExecutorService.submit(SameThreadHierarchicalTestExecutorService.java:35)
	at org.junit.platform.engine.support.hierarchical.HierarchicalTestExecutor.execute(HierarchicalTestExecutor.java:57)
	at org.junit.platform.engine.support.hierarchical.HierarchicalTestEngine.execute(HierarchicalTestEngine.java:54)
	at org.junit.platform.launcher.core.EngineExecutionOrchestrator.execute(EngineExecutionOrchestrator.java:107)
	at org.junit.platform.launcher.core.EngineExecutionOrchestrator.execute(EngineExecutionOrchestrator.java:88)
	at org.junit.platform.launcher.core.EngineExecutionOrchestrator.lambda$execute$0(EngineExecutionOrchestrator.java:54)
	at org.junit.platform.launcher.core.EngineExecutionOrchestrator.withInterceptedStreams(EngineExecutionOrchestrator.java:67)
	at org.junit.platform.launcher.core.EngineExecutionOrchestrator.execute(EngineExecutionOrchestrator.java:52)
	at org.junit.platform.launcher.core.DefaultLauncher.execute(DefaultLauncher.java:114)
	at org.junit.platform.launcher.core.DefaultLauncher.execute(DefaultLauncher.java:86)
	at org.junit.platform.launcher.core.DefaultLauncherSession$DelegatingLauncher.execute(DefaultLauncherSession.java:86)
	at org.junit.platform.launcher.core.SessionPerRequestLauncher.execute(SessionPerRequestLauncher.java:53)
	at org.apache.maven.surefire.junitplatform.JUnitPlatformProvider.execute(JUnitPlatformProvider.java:188)
	at org.apache.maven.surefire.junitplatform.JUnitPlatformProvider.invokeAllTests(JUnitPlatformProvider.java:154)
	at org.apache.maven.surefire.junitplatform.JUnitPlatformProvider.invoke(JUnitPlatformProvider.java:124)
	at org.apache.maven.surefire.booter.ForkedBooter.runSuitesInProcess(ForkedBooter.java:428)
	at org.apache.maven.surefire.booter.ForkedBooter.execute(ForkedBooter.java:162)
	at org.apache.maven.surefire.booter.ForkedBooter.run(ForkedBooter.java:562)
	at org.apache.maven.surefire.booter.ForkedBooter.main(ForkedBooter.java:548)

[INFO] Running org.apache.hadoop.ozone.scm.TestCloseContainer
[INFO] Tests run: 1, Failures: 0, Errors: 0, Skipped: 0, Time elapsed: 342.054 s - in org.apache.hadoop.ozone.scm.TestCloseContainer
[INFO] 
[INFO] Results:
[INFO] 
[ERROR] Errors: 
[ERROR]   TestStorageContainerManagerHA.init:111 » Remote Server:85baa01f-27c2-4c6b-9125...
[INFO] 
[ERROR] Tests run: 39, Failures: 0, Errors: 1, Skipped: 0
[INFO] 
[INFO] 
[INFO] ------------------------------------------------------------------------
[INFO] Skipping Apache Ozone Mini Ozone Chaos Tests
[INFO] This project has been banned from the build due to previous failures.
[INFO] ------------------------------------------------------------------------
[INFO] ------------------------------------------------------------------------
[INFO] Reactor Summary for Apache Ozone Integration Tests 1.4.0-SNAPSHOT:
[INFO] 
[INFO] Apache Ozone Integration Tests ..................... FAILURE [28:14 min]
[INFO] Apache Ozone Mini Ozone Chaos Tests ................ SKIPPED
[INFO] ------------------------------------------------------------------------
[INFO] BUILD FAILURE
[INFO] ------------------------------------------------------------------------
[INFO] Total time:  28:15 min
[INFO] Finished at: 2023-02-02T10:15:38Z
[INFO] ------------------------------------------------------------------------
[ERROR] Failed to execute goal org.apache.maven.plugins:maven-surefire-plugin:3.0.0-M5:test (default-test) on project ozone-integration-test: There are test failures.
[ERROR] 
[ERROR] Please refer to /home/runner/work/ozone/ozone/hadoop-ozone/integration-test/target/surefire-reports for the individual test results.
[ERROR] Please refer to dump files (if any exist) [date].dump, [date]-jvmRun[N].dump and [date].dumpstream.
[ERROR] -> [Help 1]
[ERROR] 
[ERROR] To see the full stack trace of the errors, re-run Maven with the -e switch.
[ERROR] Re-run Maven using the -X switch to enable full debug logging.
[ERROR] 
[ERROR] For more information about the errors and possible solutions, please read the following articles:
[ERROR] [Help 1] http://cwiki.apache.org/confluence/display/MAVEN/MojoFailureException
