[INFO] Scanning for projects...
[INFO] ------------------------------------------------------------------------
[INFO] Detecting the operating system and CPU architecture
[INFO] ------------------------------------------------------------------------
[INFO] os.detected.name: linux
[INFO] os.detected.arch: x86_64
[INFO] os.detected.version: 5.15
[INFO] os.detected.version.major: 5
[INFO] os.detected.version.minor: 15
[INFO] os.detected.release: ubuntu
[INFO] os.detected.release.version: 20.04
[INFO] os.detected.release.like.ubuntu: true
[INFO] os.detected.release.like.debian: true
[INFO] os.detected.classifier: linux-x86_64
[INFO] ------------------------------------------------------------------------
[INFO] Reactor Build Order:
[INFO] 
[INFO] Apache Ozone Integration Tests                                     [jar]
[INFO] Apache Ozone Mini Ozone Chaos Tests                                [jar]
[INFO] 
[INFO] --------------< org.apache.ozone:ozone-integration-test >---------------
[INFO] Building Apache Ozone Integration Tests 1.5.0-SNAPSHOT             [1/2]
[INFO]   from pom.xml
[INFO] --------------------------------[ jar ]---------------------------------
[INFO] 
[INFO] --- maven-antrun-plugin:3.1.0:run (create-testdirs) @ ozone-integration-test ---
[INFO] Executing tasks
[INFO]     [mkdir] Created dir: /home/runner/work/ozone/ozone/hadoop-ozone/integration-test/target/test-dir
[INFO] Executed tasks
[INFO] 
[INFO] --- maven-enforcer-plugin:3.4.1:enforce (depcheck) @ ozone-integration-test ---
[INFO] Rule 0: org.apache.maven.enforcer.rules.dependency.DependencyConvergence passed
[INFO] Rule 1: org.apache.maven.enforcer.rules.version.RequireMavenVersion passed
[INFO] Rule 2: org.apache.maven.enforcer.rules.version.RequireJavaVersion passed
[INFO] 
[INFO] --- jacoco-maven-plugin:0.8.5:prepare-agent (default-prepare-agent) @ ozone-integration-test ---
[INFO] argLine set to -javaagent:/home/runner/.m2/repository/org/jacoco/org.jacoco.agent/0.8.5/org.jacoco.agent-0.8.5-runtime.jar=destfile=/home/runner/work/ozone/ozone/hadoop-ozone/integration-test/target/jacoco.exec,includes=org.apache.hadoop.hdds.*:org.apache.hadoop.ozone.*:org.apache.hadoop.fs.ozone.*
[INFO] 
[INFO] --- maven-enforcer-plugin:3.4.1:enforce (banned-rocksdb-imports) @ ozone-integration-test ---
[INFO] Rule 0: org.apache.maven.plugins.enforcer.RestrictImports passed
[INFO] Rule 1: org.apache.maven.plugins.enforcer.RestrictImports passed
[INFO] Rule 2: org.apache.maven.plugins.enforcer.RestrictImports passed
[INFO] 
[INFO] --- maven-enforcer-plugin:3.4.1:enforce (ban-junit4-imports) @ ozone-integration-test ---
[INFO] Skipping Rule Enforcement.
[INFO] 
[INFO] --- maven-remote-resources-plugin:1.5:process (default) @ ozone-integration-test ---
[INFO] 
[INFO] --- maven-resources-plugin:3.1.0:resources (default-resources) @ ozone-integration-test ---
[INFO] Using 'UTF-8' encoding to copy filtered resources.
[INFO] skip non existing resourceDirectory /home/runner/work/ozone/ozone/hadoop-ozone/integration-test/src/main/resources
[INFO] Copying 2 resources
[INFO] 
[INFO] --- maven-compiler-plugin:3.9.0:compile (default-compile) @ ozone-integration-test ---
[INFO] No sources to compile
[INFO] 
[INFO] --- maven-resources-plugin:3.1.0:testResources (default-testResources) @ ozone-integration-test ---
[INFO] Using 'UTF-8' encoding to copy filtered resources.
[INFO] Copying 22 resources
[INFO] Copying 2 resources
[INFO] 
[INFO] --- maven-compiler-plugin:3.9.0:testCompile (default-testCompile) @ ozone-integration-test ---
[INFO] Compiling 307 source files to /home/runner/work/ozone/ozone/hadoop-ozone/integration-test/target/test-classes
[INFO] /home/runner/work/ozone/ozone/hadoop-ozone/integration-test/src/test/java/org/apache/hadoop/ozone/TestBlockTokens.java: Some input files use or override a deprecated API.
[INFO] /home/runner/work/ozone/ozone/hadoop-ozone/integration-test/src/test/java/org/apache/hadoop/ozone/TestBlockTokens.java: Recompile with -Xlint:deprecation for details.
[INFO] /home/runner/work/ozone/ozone/hadoop-ozone/integration-test/src/test/java/org/apache/hadoop/ozone/om/ratis/TestOzoneManagerRatisRequest.java: Some input files use unchecked or unsafe operations.
[INFO] /home/runner/work/ozone/ozone/hadoop-ozone/integration-test/src/test/java/org/apache/hadoop/ozone/om/ratis/TestOzoneManagerRatisRequest.java: Recompile with -Xlint:unchecked for details.
[INFO] 
[INFO] --- maven-surefire-plugin:3.2.2:test (default-test) @ ozone-integration-test ---
[INFO] Using auto detected provider org.apache.maven.surefire.junitplatform.JUnitPlatformProvider
[INFO] Using auto detected provider org.apache.maven.surefire.junitplatform.JUnitPlatformProvider
[INFO] 
[INFO] -------------------------------------------------------
[INFO]  T E S T S
[INFO] -------------------------------------------------------
[INFO] Running org.apache.hadoop.ozone.om.TestOmSnapshotFileSystemFso
[INFO] Tests run: 8, Failures: 0, Errors: 0, Skipped: 0, Time elapsed: 42.46 s -- in org.apache.hadoop.ozone.om.TestOmSnapshotFileSystemFso
[INFO] Running org.apache.hadoop.ozone.om.TestOmConf
[INFO] Tests run: 1, Failures: 0, Errors: 0, Skipped: 0, Time elapsed: 0.379 s -- in org.apache.hadoop.ozone.om.TestOmConf
[INFO] Running org.apache.hadoop.ozone.om.TestOMEpochForNonRatis
[INFO] Tests run: 2, Failures: 0, Errors: 0, Skipped: 0, Time elapsed: 27.73 s -- in org.apache.hadoop.ozone.om.TestOMEpochForNonRatis
[INFO] Running org.apache.hadoop.ozone.om.TestListKeys
[INFO] Tests run: 15, Failures: 0, Errors: 0, Skipped: 0, Time elapsed: 24.73 s -- in org.apache.hadoop.ozone.om.TestListKeys
[INFO] Running org.apache.hadoop.ozone.om.TestOmInit
[INFO] Tests run: 1, Failures: 0, Errors: 0, Skipped: 0, Time elapsed: 21.98 s -- in org.apache.hadoop.ozone.om.TestOmInit
[INFO] Running org.apache.hadoop.ozone.om.TestOmAcls
[INFO] Tests run: 7, Failures: 0, Errors: 0, Skipped: 0, Time elapsed: 24.13 s -- in org.apache.hadoop.ozone.om.TestOmAcls
[INFO] Running org.apache.hadoop.ozone.om.TestOzoneManagerConfiguration
[INFO] Tests run: 9, Failures: 0, Errors: 0, Skipped: 0, Time elapsed: 35.13 s -- in org.apache.hadoop.ozone.om.TestOzoneManagerConfiguration
[INFO] Running org.apache.hadoop.ozone.om.TestOMRatisSnapshots
[ERROR] Tests run: 7, Failures: 0, Errors: 1, Skipped: 0, Time elapsed: 312.4 s <<< FAILURE! -- in org.apache.hadoop.ozone.om.TestOMRatisSnapshots
[ERROR] org.apache.hadoop.ozone.om.TestOMRatisSnapshots.testInstallSnapshot(int, Path)[1] -- Time elapsed: 82.81 s <<< ERROR!
java.nio.file.NoSuchFileException: /home/runner/work/ozone/ozone/hadoop-ozone/integration-test/target/test-dir/MiniOzoneClusterImpl-0889518e-e242-4cfd-8a44-f44f84c7e812/omNode-3/om.db/000788.sst
	at sun.nio.fs.UnixException.translateToIOException(UnixException.java:86)
	at sun.nio.fs.UnixException.rethrowAsIOException(UnixException.java:102)
	at sun.nio.fs.UnixException.rethrowAsIOException(UnixException.java:107)
	at sun.nio.fs.UnixFileAttributeViews$Basic.readAttributes(UnixFileAttributeViews.java:55)
	at sun.nio.fs.UnixFileSystemProvider.readAttributes(UnixFileSystemProvider.java:144)
	at sun.nio.fs.LinuxFileSystemProvider.readAttributes(LinuxFileSystemProvider.java:99)
	at java.nio.file.Files.readAttributes(Files.java:1737)
	at org.apache.hadoop.ozone.om.snapshot.OmSnapshotUtils.getINode(OmSnapshotUtils.java:67)
	at org.apache.hadoop.ozone.om.TestOMRatisSnapshots.checkSnapshot(TestOMRatisSnapshots.java:372)
	at org.apache.hadoop.ozone.om.TestOMRatisSnapshots.testInstallSnapshot(TestOMRatisSnapshots.java:311)
	at java.lang.reflect.Method.invoke(Method.java:498)
	at java.util.stream.ForEachOps$ForEachOp$OfRef.accept(ForEachOps.java:183)
	at java.util.stream.ReferencePipeline$3$1.accept(ReferencePipeline.java:193)
	at java.util.stream.ReferencePipeline$2$1.accept(ReferencePipeline.java:175)
	at java.util.stream.ReferencePipeline$3$1.accept(ReferencePipeline.java:193)
	at java.util.stream.ForEachOps$ForEachOp$OfRef.accept(ForEachOps.java:183)
	at java.util.stream.ReferencePipeline$3$1.accept(ReferencePipeline.java:193)
	at java.util.stream.ReferencePipeline$3$1.accept(ReferencePipeline.java:193)
	at java.util.stream.ReferencePipeline$3$1.accept(ReferencePipeline.java:193)
	at java.util.stream.ForEachOps$ForEachOp$OfRef.accept(ForEachOps.java:183)
	at java.util.stream.ReferencePipeline$3$1.accept(ReferencePipeline.java:193)
	at java.util.Spliterators$ArraySpliterator.forEachRemaining(Spliterators.java:948)
	at java.util.stream.AbstractPipeline.copyInto(AbstractPipeline.java:482)
	at java.util.stream.AbstractPipeline.wrapAndCopyInto(AbstractPipeline.java:472)
	at java.util.stream.ForEachOps$ForEachOp.evaluateSequential(ForEachOps.java:150)
	at java.util.stream.ForEachOps$ForEachOp$OfRef.evaluateSequential(ForEachOps.java:173)
	at java.util.stream.AbstractPipeline.evaluate(AbstractPipeline.java:234)
	at java.util.stream.ReferencePipeline.forEach(ReferencePipeline.java:485)
	at java.util.stream.ReferencePipeline$7$1.accept(ReferencePipeline.java:272)
	at java.util.stream.ReferencePipeline$3$1.accept(ReferencePipeline.java:193)
	at java.util.stream.ReferencePipeline$3$1.accept(ReferencePipeline.java:193)
	at java.util.stream.ReferencePipeline$3$1.accept(ReferencePipeline.java:193)
	at java.util.ArrayList$ArrayListSpliterator.forEachRemaining(ArrayList.java:1384)
	at java.util.stream.AbstractPipeline.copyInto(AbstractPipeline.java:482)
	at java.util.stream.AbstractPipeline.wrapAndCopyInto(AbstractPipeline.java:472)
	at java.util.stream.ForEachOps$ForEachOp.evaluateSequential(ForEachOps.java:150)
	at java.util.stream.ForEachOps$ForEachOp$OfRef.evaluateSequential(ForEachOps.java:173)
	at java.util.stream.AbstractPipeline.evaluate(AbstractPipeline.java:234)
	at java.util.stream.ReferencePipeline.forEach(ReferencePipeline.java:485)
	at java.util.stream.ReferencePipeline$7$1.accept(ReferencePipeline.java:272)
	at java.util.ArrayList$ArrayListSpliterator.forEachRemaining(ArrayList.java:1384)
	at java.util.stream.AbstractPipeline.copyInto(AbstractPipeline.java:482)
	at java.util.stream.AbstractPipeline.wrapAndCopyInto(AbstractPipeline.java:472)
	at java.util.stream.ForEachOps$ForEachOp.evaluateSequential(ForEachOps.java:150)
	at java.util.stream.ForEachOps$ForEachOp$OfRef.evaluateSequential(ForEachOps.java:173)
	at java.util.stream.AbstractPipeline.evaluate(AbstractPipeline.java:234)
	at java.util.stream.ReferencePipeline.forEach(ReferencePipeline.java:485)
	at java.util.ArrayList.forEach(ArrayList.java:1259)
	at java.util.ArrayList.forEach(ArrayList.java:1259)

[INFO] Running org.apache.hadoop.ozone.om.multitenant.TestMultiTenantVolume
[INFO] Tests run: 5, Failures: 0, Errors: 0, Skipped: 0, Time elapsed: 9.021 s -- in org.apache.hadoop.ozone.om.multitenant.TestMultiTenantVolume
[INFO] Running org.apache.hadoop.ozone.om.TestKeyManagerImpl
[INFO] Tests run: 24, Failures: 0, Errors: 0, Skipped: 0, Time elapsed: 17.22 s -- in org.apache.hadoop.ozone.om.TestKeyManagerImpl
[INFO] Running org.apache.hadoop.ozone.om.TestOzoneManagerRocksDBLogging
[INFO] Tests run: 1, Failures: 0, Errors: 0, Skipped: 0, Time elapsed: 46.72 s -- in org.apache.hadoop.ozone.om.TestOzoneManagerRocksDBLogging
[INFO] Running org.apache.hadoop.ozone.om.TestOzoneManagerRestInterface
[INFO] Tests run: 1, Failures: 0, Errors: 0, Skipped: 0, Time elapsed: 23.51 s -- in org.apache.hadoop.ozone.om.TestOzoneManagerRestInterface
[INFO] Running org.apache.hadoop.ozone.om.TestOMStartupWithBucketLayout
[INFO] Tests run: 2, Failures: 0, Errors: 0, Skipped: 0, Time elapsed: 42.38 s -- in org.apache.hadoop.ozone.om.TestOMStartupWithBucketLayout
[INFO] Running org.apache.hadoop.ozone.om.TestListKeysWithFSO
[INFO] Tests run: 5, Failures: 0, Errors: 0, Skipped: 0, Time elapsed: 26.49 s -- in org.apache.hadoop.ozone.om.TestListKeysWithFSO
[INFO] Running org.apache.hadoop.ozone.om.TestOzoneManagerRestart
[INFO] Tests run: 3, Failures: 0, Errors: 0, Skipped: 0, Time elapsed: 50.58 s -- in org.apache.hadoop.ozone.om.TestOzoneManagerRestart
[INFO] Running org.apache.hadoop.ozone.om.TestKeyPurging
[INFO] Tests run: 1, Failures: 0, Errors: 0, Skipped: 0, Time elapsed: 24.37 s -- in org.apache.hadoop.ozone.om.TestKeyPurging
[INFO] Running org.apache.hadoop.ozone.om.TestOMUpgradeFinalization
[INFO] Tests run: 1, Failures: 0, Errors: 0, Skipped: 0, Time elapsed: 32.98 s -- in org.apache.hadoop.ozone.om.TestOMUpgradeFinalization
[INFO] Running org.apache.hadoop.ozone.om.TestObjectStore
[INFO] Tests run: 4, Failures: 0, Errors: 0, Skipped: 0, Time elapsed: 22.86 s -- in org.apache.hadoop.ozone.om.TestObjectStore
[INFO] Running org.apache.hadoop.ozone.om.TestOzoneManagerHASnapshot
[INFO] Tests run: 4, Failures: 0, Errors: 0, Skipped: 0, Time elapsed: 43.28 s -- in org.apache.hadoop.ozone.om.TestOzoneManagerHASnapshot
[INFO] Running org.apache.hadoop.ozone.om.TestOzoneManagerListVolumes
[INFO] Tests run: 6, Failures: 0, Errors: 0, Skipped: 0, Time elapsed: 28.65 s -- in org.apache.hadoop.ozone.om.TestOzoneManagerListVolumes
[INFO] Running org.apache.hadoop.ozone.om.TestOmSnapshotDisabled
[INFO] Tests run: 1, Failures: 0, Errors: 0, Skipped: 0, Time elapsed: 26.58 s -- in org.apache.hadoop.ozone.om.TestOmSnapshotDisabled
[INFO] Running org.apache.hadoop.ozone.om.TestObjectStoreWithFSO
[INFO] Tests run: 9, Failures: 0, Errors: 0, Skipped: 0, Time elapsed: 25.26 s -- in org.apache.hadoop.ozone.om.TestObjectStoreWithFSO
[INFO] Running org.apache.hadoop.ozone.om.TestBucketOwner
[INFO] Tests run: 3, Failures: 0, Errors: 0, Skipped: 0, Time elapsed: 23.99 s -- in org.apache.hadoop.ozone.om.TestBucketOwner
[INFO] Running org.apache.hadoop.ozone.om.TestOMDbCheckpointServlet
[INFO] Tests run: 11, Failures: 0, Errors: 0, Skipped: 0, Time elapsed: 191.4 s -- in org.apache.hadoop.ozone.om.TestOMDbCheckpointServlet
[INFO] Running org.apache.hadoop.ozone.om.TestBucketLayoutWithOlderClient
[INFO] Tests run: 1, Failures: 0, Errors: 0, Skipped: 0, Time elapsed: 23.18 s -- in org.apache.hadoop.ozone.om.TestBucketLayoutWithOlderClient
[INFO] Running org.apache.hadoop.ozone.om.TestOzoneManagerListVolumesSecure
[INFO] Tests run: 6, Failures: 0, Errors: 0, Skipped: 0, Time elapsed: 59.08 s -- in org.apache.hadoop.ozone.om.TestOzoneManagerListVolumesSecure
[INFO] Running org.apache.hadoop.ozone.om.ratis.TestOzoneManagerRatisRequest
[INFO] Tests run: 2, Failures: 0, Errors: 0, Skipped: 0, Time elapsed: 5.049 s -- in org.apache.hadoop.ozone.om.ratis.TestOzoneManagerRatisRequest
[INFO] Running org.apache.hadoop.ozone.om.TestOmStartupSlvLessThanMlv
[INFO] Tests run: 1, Failures: 0, Errors: 0, Skipped: 0, Time elapsed: 3.121 s -- in org.apache.hadoop.ozone.om.TestOmStartupSlvLessThanMlv
[INFO] Running org.apache.hadoop.ozone.om.TestAddRemoveOzoneManager
[INFO] Tests run: 3, Failures: 0, Errors: 0, Skipped: 0, Time elapsed: 138.4 s -- in org.apache.hadoop.ozone.om.TestAddRemoveOzoneManager
[INFO] Running org.apache.hadoop.ozone.om.TestOmBlockVersioning
[INFO] Tests run: 2, Failures: 0, Errors: 0, Skipped: 0, Time elapsed: 23.82 s -- in org.apache.hadoop.ozone.om.TestOmBlockVersioning
[INFO] Running org.apache.hadoop.ozone.om.TestOzoneManagerHAWithStoppedNodes
[INFO] Tests run: 12, Failures: 0, Errors: 0, Skipped: 0, Time elapsed: 219.5 s -- in org.apache.hadoop.ozone.om.TestOzoneManagerHAWithStoppedNodes
[INFO] Running org.apache.hadoop.ozone.om.TestRecursiveAclWithFSO
[INFO] Tests run: 1, Failures: 0, Errors: 0, Skipped: 0, Time elapsed: 24.34 s -- in org.apache.hadoop.ozone.om.TestRecursiveAclWithFSO
[INFO] Running org.apache.hadoop.ozone.om.TestOMBucketLayoutUpgrade
[INFO] Tests run: 8, Failures: 0, Errors: 0, Skipped: 0, Time elapsed: 21.87 s -- in org.apache.hadoop.ozone.om.TestOMBucketLayoutUpgrade
[INFO] Running org.apache.hadoop.ozone.om.TestSnapshotDeletingService
[INFO] Tests run: 1, Failures: 0, Errors: 0, Skipped: 0, Time elapsed: 70.75 s -- in org.apache.hadoop.ozone.om.TestSnapshotDeletingService
[INFO] Running org.apache.hadoop.ozone.om.TestSecureOzoneManager
[INFO] Tests run: 2, Failures: 0, Errors: 0, Skipped: 0, Time elapsed: 1.889 s -- in org.apache.hadoop.ozone.om.TestSecureOzoneManager
[INFO] Running org.apache.hadoop.ozone.om.TestOmMetrics
[INFO] Tests run: 6, Failures: 0, Errors: 0, Skipped: 0, Time elapsed: 78.22 s -- in org.apache.hadoop.ozone.om.TestOmMetrics
[INFO] Running org.apache.hadoop.ozone.om.snapshot.TestOmSnapshotFsoWithNativeLib
[INFO] Tests run: 42, Failures: 0, Errors: 0, Skipped: 0, Time elapsed: 193.7 s -- in org.apache.hadoop.ozone.om.snapshot.TestOmSnapshotFsoWithNativeLib
[INFO] Running org.apache.hadoop.ozone.om.snapshot.TestOzoneManagerSnapshotProvider
[INFO] Tests run: 1, Failures: 0, Errors: 0, Skipped: 0, Time elapsed: 28.06 s -- in org.apache.hadoop.ozone.om.snapshot.TestOzoneManagerSnapshotProvider
[INFO] Running org.apache.hadoop.ozone.om.snapshot.TestOzoneManagerSnapshotAcl
[INFO] Tests run: 50, Failures: 0, Errors: 0, Skipped: 0, Time elapsed: 36.83 s -- in org.apache.hadoop.ozone.om.snapshot.TestOzoneManagerSnapshotAcl
[INFO] Running org.apache.hadoop.ozone.om.snapshot.TestOzoneSnapshotRestore
[INFO] Tests run: 8, Failures: 0, Errors: 0, Skipped: 0, Time elapsed: 63.10 s -- in org.apache.hadoop.ozone.om.snapshot.TestOzoneSnapshotRestore
[INFO] Running org.apache.hadoop.ozone.om.snapshot.TestOmSnapshotObjectStore
[WARNING] Tests run: 42, Failures: 0, Errors: 0, Skipped: 5, Time elapsed: 186.3 s -- in org.apache.hadoop.ozone.om.snapshot.TestOmSnapshotObjectStore
[INFO] Running org.apache.hadoop.ozone.om.snapshot.TestOmSnapshotFsoWithoutNativeLib
[INFO] Tests run: 42, Failures: 0, Errors: 0, Skipped: 0, Time elapsed: 203.3 s -- in org.apache.hadoop.ozone.om.snapshot.TestOmSnapshotFsoWithoutNativeLib
[INFO] Running org.apache.hadoop.ozone.om.snapshot.TestOmSnapshotLegacy
[WARNING] Tests run: 42, Failures: 0, Errors: 0, Skipped: 5, Time elapsed: 178.1 s -- in org.apache.hadoop.ozone.om.snapshot.TestOmSnapshotLegacy
[INFO] Running org.apache.hadoop.ozone.om.TestObjectStoreWithLegacyFS
[INFO] Tests run: 2, Failures: 0, Errors: 0, Skipped: 0, Time elapsed: 23.92 s -- in org.apache.hadoop.ozone.om.TestObjectStoreWithLegacyFS
[INFO] Running org.apache.hadoop.ozone.om.TestOmContainerLocationCache
[INFO] Tests run: 14, Failures: 0, Errors: 0, Skipped: 0, Time elapsed: 15.05 s -- in org.apache.hadoop.ozone.om.TestOmContainerLocationCache
[INFO] Running org.apache.hadoop.ozone.om.TestListStatus
[INFO] Tests run: 1, Failures: 0, Errors: 0, Skipped: 0, Time elapsed: 23.55 s -- in org.apache.hadoop.ozone.om.TestListStatus
[INFO] Running org.apache.hadoop.ozone.om.TestOzoneManagerHAWithAllRunning
[INFO] Tests run: 27, Failures: 0, Errors: 0, Skipped: 0, Time elapsed: 67.48 s -- in org.apache.hadoop.ozone.om.TestOzoneManagerHAWithAllRunning
[INFO] Running org.apache.hadoop.ozone.om.TestSnapshotDirectoryCleaningService
[INFO] Tests run: 1, Failures: 0, Errors: 0, Skipped: 0, Time elapsed: 31.93 s -- in org.apache.hadoop.ozone.om.TestSnapshotDirectoryCleaningService
[INFO] Running org.apache.hadoop.ozone.om.TestOmSnapshotFileSystemLegacy
[INFO] Tests run: 8, Failures: 0, Errors: 0, Skipped: 0, Time elapsed: 45.20 s -- in org.apache.hadoop.ozone.om.TestOmSnapshotFileSystemLegacy
[INFO] 
[INFO] Results:
[INFO] 
[ERROR] Errors: 
[ERROR]   TestOMRatisSnapshots.testInstallSnapshot:311->checkSnapshot:372 » NoSuchFile /home/runner/work/ozone/ozone/hadoop-ozone/integration-test/target/test-dir/MiniOzoneClusterImpl-0889518e-e242-4cfd-8a44-f44f84c7e812/omNode-3/om.db/000788.sst
[INFO] 
[ERROR] Tests run: 456, Failures: 0, Errors: 1, Skipped: 10
[INFO] 
[INFO] 
[INFO] ------------------------------------------------------------------------
[INFO] Skipping Apache Ozone Mini Ozone Chaos Tests
[INFO] This project has been banned from the build due to previous failures.
[INFO] ------------------------------------------------------------------------
[INFO] ------------------------------------------------------------------------
[INFO] Reactor Summary for Apache Ozone Integration Tests 1.5.0-SNAPSHOT:
[INFO] 
[INFO] Apache Ozone Integration Tests ..................... FAILURE [49:37 min]
[INFO] Apache Ozone Mini Ozone Chaos Tests ................ SKIPPED
[INFO] ------------------------------------------------------------------------
[INFO] BUILD FAILURE
[INFO] ------------------------------------------------------------------------
[INFO] Total time:  49:38 min
[INFO] Finished at: 2024-01-07T12:41:33Z
[INFO] ------------------------------------------------------------------------
[INFO] 11 goals, 11 executed
[INFO] 
[INFO] Publishing build scan...
[INFO] https://ge.apache.org/s/bi7lkct3sy2ay
[INFO] 
[ERROR] Failed to execute goal org.apache.maven.plugins:maven-surefire-plugin:3.2.2:test (default-test) on project ozone-integration-test: 
[ERROR] 
[ERROR] Please refer to /home/runner/work/ozone/ozone/hadoop-ozone/integration-test/target/surefire-reports for the individual test results.
[ERROR] Please refer to dump files (if any exist) [date].dump, [date]-jvmRun[N].dump and [date].dumpstream.
[ERROR] -> [Help 1]
[ERROR] 
[ERROR] To see the full stack trace of the errors, re-run Maven with the -e switch.
[ERROR] Re-run Maven using the -X switch to enable full debug logging.
[ERROR] 
[ERROR] For more information about the errors and possible solutions, please read the following articles:
[ERROR] [Help 1] http://cwiki.apache.org/confluence/display/MAVEN/MojoFailureException
