[INFO] Scanning for projects...
[INFO] ------------------------------------------------------------------------
[INFO] Detecting the operating system and CPU architecture
[INFO] ------------------------------------------------------------------------
[INFO] os.detected.name: linux
[INFO] os.detected.arch: x86_64
[INFO] os.detected.version: 5.15
[INFO] os.detected.version.major: 5
[INFO] os.detected.version.minor: 15
[INFO] os.detected.release: ubuntu
[INFO] os.detected.release.version: 20.04
[INFO] os.detected.release.like.ubuntu: true
[INFO] os.detected.release.like.debian: true
[INFO] os.detected.classifier: linux-x86_64
[INFO] ------------------------------------------------------------------------
[INFO] Reactor Build Order:
[INFO] 
[INFO] Apache Ozone Integration Tests                                     [jar]
[INFO] Apache Ozone Mini Ozone Chaos Tests                                [jar]
[INFO] 
[INFO] --------------< org.apache.ozone:ozone-integration-test >---------------
[INFO] Building Apache Ozone Integration Tests 1.3.0-SNAPSHOT             [1/2]
[INFO] --------------------------------[ jar ]---------------------------------
[INFO] 
[INFO] --- maven-antrun-plugin:1.3:run (create-testdirs) @ ozone-integration-test ---
[INFO] Executing tasks
[INFO] Executed tasks
[INFO] 
[INFO] --- jacoco-maven-plugin:0.8.5:prepare-agent (default-prepare-agent) @ ozone-integration-test ---
[INFO] argLine set to -javaagent:/home/runner/.m2/repository/org/jacoco/org.jacoco.agent/0.8.5/org.jacoco.agent-0.8.5-runtime.jar=destfile=/home/runner/work/ozone/ozone/hadoop-ozone/integration-test/target/jacoco.exec,includes=org.apache.hadoop.hdds.*:org.apache.hadoop.ozone.*:org.apache.hadoop.fs.ozone.*
[INFO] 
[INFO] --- maven-enforcer-plugin:3.0.0-M1:enforce (banned-rocksdb-imports) @ ozone-integration-test ---
[INFO] 
[INFO] --- maven-remote-resources-plugin:1.5:process (default) @ ozone-integration-test ---
[INFO] 
[INFO] --- maven-resources-plugin:3.1.0:resources (default-resources) @ ozone-integration-test ---
[INFO] Using 'UTF-8' encoding to copy filtered resources.
[INFO] skip non existing resourceDirectory /home/runner/work/ozone/ozone/hadoop-ozone/integration-test/src/main/resources
[INFO] Copying 2 resources
[INFO] 
[INFO] --- maven-compiler-plugin:3.1:compile (default-compile) @ ozone-integration-test ---
[INFO] No sources to compile
[INFO] 
[INFO] --- maven-resources-plugin:3.1.0:testResources (default-testResources) @ ozone-integration-test ---
[INFO] Using 'UTF-8' encoding to copy filtered resources.
[INFO] Copying 22 resources
[INFO] Copying 2 resources
[INFO] 
[INFO] --- maven-compiler-plugin:3.1:testCompile (default-testCompile) @ ozone-integration-test ---
[INFO] Compiling 12 source files to /home/runner/work/ozone/ozone/hadoop-ozone/integration-test/target/test-classes
[INFO] 
[INFO] --- maven-surefire-plugin:3.0.0-M5:test (default-test) @ ozone-integration-test ---
[INFO] 
[INFO] -------------------------------------------------------
[INFO]  T E S T S
[INFO] -------------------------------------------------------
[INFO] Running org.apache.hadoop.ozone.om.TestOzoneManagerRestart
[INFO] Tests run: 3, Failures: 0, Errors: 0, Skipped: 0, Time elapsed: 43.586 s - in org.apache.hadoop.ozone.om.TestOzoneManagerRestart
[INFO] Running org.apache.hadoop.ozone.om.TestKeyPurging
[INFO] Tests run: 1, Failures: 0, Errors: 0, Skipped: 0, Time elapsed: 29.002 s - in org.apache.hadoop.ozone.om.TestKeyPurging
[INFO] Running org.apache.hadoop.ozone.om.TestOmBlockVersioning
[INFO] Tests run: 2, Failures: 0, Errors: 0, Skipped: 0, Time elapsed: 27.989 s - in org.apache.hadoop.ozone.om.TestOmBlockVersioning
[INFO] Running org.apache.hadoop.ozone.om.TestRecursiveAclWithFSO
[INFO] Tests run: 1, Failures: 0, Errors: 0, Skipped: 0, Time elapsed: 33.215 s - in org.apache.hadoop.ozone.om.TestRecursiveAclWithFSO
[INFO] Running org.apache.hadoop.ozone.om.TestAddRemoveOzoneManager
[INFO] Tests run: 3, Failures: 0, Errors: 0, Skipped: 0, Time elapsed: 151.228 s - in org.apache.hadoop.ozone.om.TestAddRemoveOzoneManager
[INFO] Running org.apache.hadoop.ozone.om.TestOMEpochForNonRatis
[INFO] Tests run: 2, Failures: 0, Errors: 0, Skipped: 0, Time elapsed: 31.207 s - in org.apache.hadoop.ozone.om.TestOMEpochForNonRatis
[INFO] Running org.apache.hadoop.ozone.om.TestListStatus
[INFO] Tests run: 1, Failures: 0, Errors: 0, Skipped: 0, Time elapsed: 36.692 s - in org.apache.hadoop.ozone.om.TestListStatus
[INFO] Running org.apache.hadoop.ozone.om.TestOmAcls
[INFO] Tests run: 3, Failures: 0, Errors: 0, Skipped: 0, Time elapsed: 26.256 s - in org.apache.hadoop.ozone.om.TestOmAcls
[INFO] Running org.apache.hadoop.ozone.om.snapshot.TestOzoneManagerSnapshotProvider
[INFO] Tests run: 1, Failures: 0, Errors: 0, Skipped: 0, Time elapsed: 40.121 s - in org.apache.hadoop.ozone.om.snapshot.TestOzoneManagerSnapshotProvider
[INFO] Running org.apache.hadoop.ozone.om.TestListKeysWithFSO
[INFO] Tests run: 3, Failures: 0, Errors: 0, Skipped: 0, Time elapsed: 38.055 s - in org.apache.hadoop.ozone.om.TestListKeysWithFSO
[INFO] Running org.apache.hadoop.ozone.om.TestOmInit
[INFO] Tests run: 1, Failures: 0, Errors: 0, Skipped: 0, Time elapsed: 25.575 s - in org.apache.hadoop.ozone.om.TestOmInit
[INFO] Running org.apache.hadoop.ozone.om.TestOMRatisSnapshots
[INFO] Tests run: 4, Failures: 0, Errors: 0, Skipped: 0, Time elapsed: 136.323 s - in org.apache.hadoop.ozone.om.TestOMRatisSnapshots
[INFO] Running org.apache.hadoop.ozone.om.TestOzoneManagerListVolumes
[INFO] Tests run: 6, Failures: 0, Errors: 0, Skipped: 0, Time elapsed: 26.136 s - in org.apache.hadoop.ozone.om.TestOzoneManagerListVolumes
[INFO] Running org.apache.hadoop.ozone.om.TestOMBucketLayoutUpgrade
[INFO] Tests run: 1, Failures: 0, Errors: 0, Skipped: 0, Time elapsed: 21.558 s - in org.apache.hadoop.ozone.om.TestOMBucketLayoutUpgrade
[INFO] Running org.apache.hadoop.ozone.om.TestOMUpgradeFinalization
[INFO] Tests run: 2, Failures: 0, Errors: 0, Skipped: 0, Time elapsed: 108.784 s - in org.apache.hadoop.ozone.om.TestOMUpgradeFinalization
[INFO] Running org.apache.hadoop.ozone.om.TestContainerReportWithKeys
[INFO] Tests run: 1, Failures: 0, Errors: 0, Skipped: 0, Time elapsed: 32.312 s - in org.apache.hadoop.ozone.om.TestContainerReportWithKeys
[INFO] Running org.apache.hadoop.ozone.om.TestOzoneManagerHAWithFailover
[INFO] Tests run: 1, Failures: 0, Errors: 0, Skipped: 0, Time elapsed: 46.217 s - in org.apache.hadoop.ozone.om.TestOzoneManagerHAWithFailover
[INFO] Running org.apache.hadoop.ozone.om.TestOzoneManagerHAWithData
[ERROR] Tests run: 5, Failures: 0, Errors: 1, Skipped: 0, Time elapsed: 111.709 s <<< FAILURE! - in org.apache.hadoop.ozone.om.TestOzoneManagerHAWithData
[ERROR] org.apache.hadoop.ozone.om.TestOzoneManagerHAWithData.testTwoOMNodesDown  Time elapsed: 15.326 s  <<< ERROR!
java.io.IOException: java.lang.IllegalStateException: gap between start index 59 and first entry to append 146
	at org.apache.ratis.util.IOUtils.asIOException(IOUtils.java:56)
	at org.apache.ratis.util.IOUtils.toIOException(IOUtils.java:61)
	at org.apache.ratis.util.IOUtils.getFromFuture(IOUtils.java:71)
	at org.apache.ratis.server.impl.RaftServerProxy.getImpls(RaftServerProxy.java:362)
	at org.apache.ratis.server.impl.RaftServerProxy.start(RaftServerProxy.java:379)
	at org.apache.hadoop.ozone.om.ratis.OzoneManagerRatisServer.start(OzoneManagerRatisServer.java:557)
	at org.apache.hadoop.ozone.om.OzoneManager.restart(OzoneManager.java:1606)
	at org.apache.hadoop.ozone.MiniOzoneHAClusterImpl.restartOzoneManager(MiniOzoneHAClusterImpl.java:229)
	at org.apache.hadoop.ozone.om.TestOzoneManagerHA.resetCluster(TestOzoneManagerHA.java:188)
	at sun.reflect.NativeMethodAccessorImpl.invoke0(Native Method)
	at sun.reflect.NativeMethodAccessorImpl.invoke(NativeMethodAccessorImpl.java:62)
	at sun.reflect.DelegatingMethodAccessorImpl.invoke(DelegatingMethodAccessorImpl.java:43)
	at java.lang.reflect.Method.invoke(Method.java:498)
	at org.junit.platform.commons.util.ReflectionUtils.invokeMethod(ReflectionUtils.java:725)
	at org.junit.jupiter.engine.execution.MethodInvocation.proceed(MethodInvocation.java:60)
	at org.junit.jupiter.engine.execution.InvocationInterceptorChain$ValidatingInvocation.proceed(InvocationInterceptorChain.java:131)
	at org.junit.jupiter.engine.extension.TimeoutExtension.intercept(TimeoutExtension.java:149)
	at org.junit.jupiter.engine.extension.TimeoutExtension.interceptLifecycleMethod(TimeoutExtension.java:126)
	at org.junit.jupiter.engine.extension.TimeoutExtension.interceptAfterEachMethod(TimeoutExtension.java:108)
	at org.junit.jupiter.engine.execution.ExecutableInvoker$ReflectiveInterceptorCall.lambda$ofVoidMethod$0(ExecutableInvoker.java:115)
	at org.junit.jupiter.engine.execution.ExecutableInvoker.lambda$invoke$0(ExecutableInvoker.java:105)
	at org.junit.jupiter.engine.execution.InvocationInterceptorChain$InterceptedInvocation.proceed(InvocationInterceptorChain.java:106)
	at org.junit.jupiter.engine.execution.InvocationInterceptorChain.proceed(InvocationInterceptorChain.java:64)
	at org.junit.jupiter.engine.execution.InvocationInterceptorChain.chainAndInvoke(InvocationInterceptorChain.java:45)
	at org.junit.jupiter.engine.execution.InvocationInterceptorChain.invoke(InvocationInterceptorChain.java:37)
	at org.junit.jupiter.engine.execution.ExecutableInvoker.invoke(ExecutableInvoker.java:104)
	at org.junit.jupiter.engine.execution.ExecutableInvoker.invoke(ExecutableInvoker.java:98)
	at org.junit.jupiter.engine.descriptor.ClassBasedTestDescriptor.invokeMethodInExtensionContext(ClassBasedTestDescriptor.java:506)
	at org.junit.jupiter.engine.descriptor.ClassBasedTestDescriptor.lambda$synthesizeAfterEachMethodAdapter$22(ClassBasedTestDescriptor.java:496)
	at org.junit.jupiter.engine.descriptor.TestMethodTestDescriptor.lambda$invokeAfterEachMethods$10(TestMethodTestDescriptor.java:240)
	at org.junit.jupiter.engine.descriptor.TestMethodTestDescriptor.lambda$invokeAllAfterMethodsOrCallbacks$13(TestMethodTestDescriptor.java:273)
	at org.junit.platform.engine.support.hierarchical.ThrowableCollector.execute(ThrowableCollector.java:73)
	at org.junit.jupiter.engine.descriptor.TestMethodTestDescriptor.lambda$invokeAllAfterMethodsOrCallbacks$14(TestMethodTestDescriptor.java:273)
	at java.util.ArrayList.forEach(ArrayList.java:1259)
	at org.junit.jupiter.engine.descriptor.TestMethodTestDescriptor.invokeAllAfterMethodsOrCallbacks(TestMethodTestDescriptor.java:272)
	at org.junit.jupiter.engine.descriptor.TestMethodTestDescriptor.invokeAfterEachMethods(TestMethodTestDescriptor.java:238)
	at org.junit.jupiter.engine.descriptor.TestMethodTestDescriptor.execute(TestMethodTestDescriptor.java:139)
	at org.junit.jupiter.engine.descriptor.TestMethodTestDescriptor.execute(TestMethodTestDescriptor.java:66)
	at org.junit.platform.engine.support.hierarchical.NodeTestTask.lambda$executeRecursively$6(NodeTestTask.java:151)
	at org.junit.platform.engine.support.hierarchical.ThrowableCollector.execute(ThrowableCollector.java:73)
	at org.junit.platform.engine.support.hierarchical.NodeTestTask.lambda$executeRecursively$8(NodeTestTask.java:141)
	at org.junit.platform.engine.support.hierarchical.Node.around(Node.java:137)
	at org.junit.platform.engine.support.hierarchical.NodeTestTask.lambda$executeRecursively$9(NodeTestTask.java:139)
	at org.junit.platform.engine.support.hierarchical.ThrowableCollector.execute(ThrowableCollector.java:73)
	at org.junit.platform.engine.support.hierarchical.NodeTestTask.executeRecursively(NodeTestTask.java:138)
	at org.junit.platform.engine.support.hierarchical.NodeTestTask.execute(NodeTestTask.java:95)
	at java.util.ArrayList.forEach(ArrayList.java:1259)
	at org.junit.platform.engine.support.hierarchical.SameThreadHierarchicalTestExecutorService.invokeAll(SameThreadHierarchicalTestExecutorService.java:41)
	at org.junit.platform.engine.support.hierarchical.NodeTestTask.lambda$executeRecursively$6(NodeTestTask.java:155)
	at org.junit.platform.engine.support.hierarchical.ThrowableCollector.execute(ThrowableCollector.java:73)
	at org.junit.platform.engine.support.hierarchical.NodeTestTask.lambda$executeRecursively$8(NodeTestTask.java:141)
	at org.junit.platform.engine.support.hierarchical.Node.around(Node.java:137)
	at org.junit.platform.engine.support.hierarchical.NodeTestTask.lambda$executeRecursively$9(NodeTestTask.java:139)
	at org.junit.platform.engine.support.hierarchical.ThrowableCollector.execute(ThrowableCollector.java:73)
	at org.junit.platform.engine.support.hierarchical.NodeTestTask.executeRecursively(NodeTestTask.java:138)
	at org.junit.platform.engine.support.hierarchical.NodeTestTask.execute(NodeTestTask.java:95)
	at java.util.ArrayList.forEach(ArrayList.java:1259)
	at org.junit.platform.engine.support.hierarchical.SameThreadHierarchicalTestExecutorService.invokeAll(SameThreadHierarchicalTestExecutorService.java:41)
	at org.junit.platform.engine.support.hierarchical.NodeTestTask.lambda$executeRecursively$6(NodeTestTask.java:155)
	at org.junit.platform.engine.support.hierarchical.ThrowableCollector.execute(ThrowableCollector.java:73)
	at org.junit.platform.engine.support.hierarchical.NodeTestTask.lambda$executeRecursively$8(NodeTestTask.java:141)
	at org.junit.platform.engine.support.hierarchical.Node.around(Node.java:137)
	at org.junit.platform.engine.support.hierarchical.NodeTestTask.lambda$executeRecursively$9(NodeTestTask.java:139)
	at org.junit.platform.engine.support.hierarchical.ThrowableCollector.execute(ThrowableCollector.java:73)
	at org.junit.platform.engine.support.hierarchical.NodeTestTask.executeRecursively(NodeTestTask.java:138)
	at org.junit.platform.engine.support.hierarchical.NodeTestTask.execute(NodeTestTask.java:95)
	at org.junit.platform.engine.support.hierarchical.SameThreadHierarchicalTestExecutorService.submit(SameThreadHierarchicalTestExecutorService.java:35)
	at org.junit.platform.engine.support.hierarchical.HierarchicalTestExecutor.execute(HierarchicalTestExecutor.java:57)
	at org.junit.platform.engine.support.hierarchical.HierarchicalTestEngine.execute(HierarchicalTestEngine.java:54)
	at org.junit.platform.launcher.core.EngineExecutionOrchestrator.execute(EngineExecutionOrchestrator.java:107)
	at org.junit.platform.launcher.core.EngineExecutionOrchestrator.execute(EngineExecutionOrchestrator.java:88)
	at org.junit.platform.launcher.core.EngineExecutionOrchestrator.lambda$execute$0(EngineExecutionOrchestrator.java:54)
	at org.junit.platform.launcher.core.EngineExecutionOrchestrator.withInterceptedStreams(EngineExecutionOrchestrator.java:67)
	at org.junit.platform.launcher.core.EngineExecutionOrchestrator.execute(EngineExecutionOrchestrator.java:52)
	at org.junit.platform.launcher.core.DefaultLauncher.execute(DefaultLauncher.java:114)
	at org.junit.platform.launcher.core.DefaultLauncher.execute(DefaultLauncher.java:86)
	at org.junit.platform.launcher.core.DefaultLauncherSession$DelegatingLauncher.execute(DefaultLauncherSession.java:86)
	at org.junit.platform.launcher.core.SessionPerRequestLauncher.execute(SessionPerRequestLauncher.java:53)
	at org.apache.maven.surefire.junitplatform.JUnitPlatformProvider.execute(JUnitPlatformProvider.java:188)
	at org.apache.maven.surefire.junitplatform.JUnitPlatformProvider.invokeAllTests(JUnitPlatformProvider.java:154)
	at org.apache.maven.surefire.junitplatform.JUnitPlatformProvider.invoke(JUnitPlatformProvider.java:124)
	at org.apache.maven.surefire.booter.ForkedBooter.runSuitesInProcess(ForkedBooter.java:428)
	at org.apache.maven.surefire.booter.ForkedBooter.execute(ForkedBooter.java:162)
	at org.apache.maven.surefire.booter.ForkedBooter.run(ForkedBooter.java:562)
	at org.apache.maven.surefire.booter.ForkedBooter.main(ForkedBooter.java:548)
Caused by: java.lang.IllegalStateException: gap between start index 59 and first entry to append 146
	at org.apache.ratis.util.Preconditions.assertTrue(Preconditions.java:60)
	at org.apache.ratis.server.raftlog.segmented.LogSegment.append(LogSegment.java:312)
	at org.apache.ratis.server.raftlog.segmented.LogSegment.lambda$loadSegment$2(LogSegment.java:168)
	at org.apache.ratis.server.raftlog.segmented.LogSegment.readSegmentFile(LogSegment.java:141)
	at org.apache.ratis.server.raftlog.segmented.LogSegment.readSegmentFile(LogSegment.java:125)
	at org.apache.ratis.server.raftlog.segmented.LogSegment.loadSegment(LogSegment.java:167)
	at org.apache.ratis.server.raftlog.segmented.SegmentedRaftLogCache.loadSegment(SegmentedRaftLogCache.java:387)
	at org.apache.ratis.server.raftlog.segmented.SegmentedRaftLog.loadLogSegments(SegmentedRaftLog.java:241)
	at org.apache.ratis.server.raftlog.segmented.SegmentedRaftLog.openImpl(SegmentedRaftLog.java:214)
	at org.apache.ratis.server.raftlog.RaftLogBase.open(RaftLogBase.java:249)
	at org.apache.ratis.server.impl.ServerState.initRaftLog(ServerState.java:210)
	at org.apache.ratis.server.impl.ServerState.<init>(ServerState.java:152)
	at org.apache.ratis.server.impl.RaftServerImpl.<init>(RaftServerImpl.java:201)
	at org.apache.ratis.server.impl.RaftServerProxy.lambda$newRaftServerImpl$5(RaftServerProxy.java:274)
	at java.util.concurrent.CompletableFuture$AsyncSupply.run(CompletableFuture.java:1604)
	at java.util.concurrent.ThreadPoolExecutor.runWorker(ThreadPoolExecutor.java:1149)
	at java.util.concurrent.ThreadPoolExecutor$Worker.run(ThreadPoolExecutor.java:624)
	at java.lang.Thread.run(Thread.java:750)

[INFO] Running org.apache.hadoop.ozone.om.TestOzoneManagerHAWithACL
[INFO] Tests run: 1, Failures: 0, Errors: 0, Skipped: 0, Time elapsed: 43.966 s - in org.apache.hadoop.ozone.om.TestOzoneManagerHAWithACL
[INFO] Running org.apache.hadoop.ozone.om.TestObjectStore
[INFO] Tests run: 4, Failures: 0, Errors: 0, Skipped: 0, Time elapsed: 31.487 s - in org.apache.hadoop.ozone.om.TestObjectStore
[INFO] Running org.apache.hadoop.ozone.om.TestOzoneManagerRestInterface
[INFO] Tests run: 1, Failures: 0, Errors: 0, Skipped: 0, Time elapsed: 31.006 s - in org.apache.hadoop.ozone.om.TestOzoneManagerRestInterface
[INFO] Running org.apache.hadoop.ozone.om.TestOmMetrics
[INFO] Tests run: 5, Failures: 0, Errors: 0, Skipped: 0, Time elapsed: 78.301 s - in org.apache.hadoop.ozone.om.TestOmMetrics
[INFO] Running org.apache.hadoop.ozone.om.TestOzoneManagerConfiguration
[INFO] Tests run: 9, Failures: 0, Errors: 0, Skipped: 0, Time elapsed: 67.106 s - in org.apache.hadoop.ozone.om.TestOzoneManagerConfiguration
[INFO] Running org.apache.hadoop.ozone.om.TestObjectStoreWithFSO
[INFO] Tests run: 9, Failures: 0, Errors: 0, Skipped: 0, Time elapsed: 30.173 s - in org.apache.hadoop.ozone.om.TestObjectStoreWithFSO
[INFO] Running org.apache.hadoop.ozone.om.TestBucketLayoutWithOlderClient
[INFO] Tests run: 1, Failures: 0, Errors: 0, Skipped: 0, Time elapsed: 41.348 s - in org.apache.hadoop.ozone.om.TestBucketLayoutWithOlderClient
[INFO] Running org.apache.hadoop.ozone.om.TestBucketOwner
[INFO] Tests run: 3, Failures: 0, Errors: 0, Skipped: 0, Time elapsed: 32.382 s - in org.apache.hadoop.ozone.om.TestBucketOwner
[INFO] Running org.apache.hadoop.ozone.om.TestOMDbCheckpointServlet
[INFO] Tests run: 3, Failures: 0, Errors: 0, Skipped: 0, Time elapsed: 33.486 s - in org.apache.hadoop.ozone.om.TestOMDbCheckpointServlet
[INFO] Running org.apache.hadoop.ozone.om.TestOzoneManagerHAKeyDeletion
[INFO] Tests run: 1, Failures: 0, Errors: 0, Skipped: 0, Time elapsed: 53.442 s - in org.apache.hadoop.ozone.om.TestOzoneManagerHAKeyDeletion
[INFO] Running org.apache.hadoop.ozone.om.TestLDBCli
[INFO] Tests run: 3, Failures: 0, Errors: 0, Skipped: 0, Time elapsed: 1.505 s - in org.apache.hadoop.ozone.om.TestLDBCli
[INFO] Running org.apache.hadoop.ozone.om.TestOMStartupWithBucketLayout
[INFO] Tests run: 2, Failures: 0, Errors: 0, Skipped: 0, Time elapsed: 26.222 s - in org.apache.hadoop.ozone.om.TestOMStartupWithBucketLayout
[INFO] Running org.apache.hadoop.ozone.om.TestKeyManagerImpl
[INFO] Tests run: 20, Failures: 0, Errors: 0, Skipped: 0, Time elapsed: 19.373 s - in org.apache.hadoop.ozone.om.TestKeyManagerImpl
[INFO] Running org.apache.hadoop.ozone.om.TestOmStartupSlvLessThanMlv
[INFO] Tests run: 1, Failures: 0, Errors: 0, Skipped: 0, Time elapsed: 4.259 s - in org.apache.hadoop.ozone.om.TestOmStartupSlvLessThanMlv
[INFO] Running org.apache.hadoop.ozone.om.TestObjectStoreWithLegacyFS
[ERROR] Tests run: 2, Failures: 1, Errors: 0, Skipped: 0, Time elapsed: 26.839 s <<< FAILURE! - in org.apache.hadoop.ozone.om.TestObjectStoreWithLegacyFS
[ERROR] org.apache.hadoop.ozone.om.TestObjectStoreWithLegacyFS.testFlatKeyStructureWithOBS  Time elapsed: 0.083 s  <<< FAILURE!
java.lang.AssertionError
	at org.junit.Assert.fail(Assert.java:87)
	at org.junit.Assert.assertTrue(Assert.java:42)
	at org.junit.Assert.assertTrue(Assert.java:53)
	at org.apache.hadoop.ozone.om.TestObjectStoreWithLegacyFS.assertKeyCount(TestObjectStoreWithLegacyFS.java:160)
	at org.apache.hadoop.ozone.om.TestObjectStoreWithLegacyFS.lambda$testFlatKeyStructureWithOBS$1(TestObjectStoreWithLegacyFS.java:141)
	at org.apache.ozone.test.GenericTestUtils.waitFor(GenericTestUtils.java:214)
	at org.apache.hadoop.ozone.om.TestObjectStoreWithLegacyFS.testFlatKeyStructureWithOBS(TestObjectStoreWithLegacyFS.java:141)
	at sun.reflect.NativeMethodAccessorImpl.invoke0(Native Method)
	at sun.reflect.NativeMethodAccessorImpl.invoke(NativeMethodAccessorImpl.java:62)
	at sun.reflect.DelegatingMethodAccessorImpl.invoke(DelegatingMethodAccessorImpl.java:43)
	at java.lang.reflect.Method.invoke(Method.java:498)
	at org.junit.runners.model.FrameworkMethod$1.runReflectiveCall(FrameworkMethod.java:59)
	at org.junit.internal.runners.model.ReflectiveCallable.run(ReflectiveCallable.java:12)
	at org.junit.runners.model.FrameworkMethod.invokeExplosively(FrameworkMethod.java:56)
	at org.junit.internal.runners.statements.InvokeMethod.evaluate(InvokeMethod.java:17)
	at org.junit.internal.runners.statements.RunBefores.evaluate(RunBefores.java:26)
	at org.junit.internal.runners.statements.FailOnTimeout$CallableStatement.call(FailOnTimeout.java:288)
	at org.junit.internal.runners.statements.FailOnTimeout$CallableStatement.call(FailOnTimeout.java:282)
	at java.util.concurrent.FutureTask.run(FutureTask.java:266)
	at java.lang.Thread.run(Thread.java:750)

[INFO] Running org.apache.hadoop.ozone.om.TestOzoneManagerRocksDBLogging
[INFO] Tests run: 1, Failures: 0, Errors: 0, Skipped: 0, Time elapsed: 44.466 s - in org.apache.hadoop.ozone.om.TestOzoneManagerRocksDBLogging
[INFO] Running org.apache.hadoop.ozone.om.multitenant.TestMultiTenantVolume
[INFO] Tests run: 4, Failures: 0, Errors: 0, Skipped: 0, Time elapsed: 10.657 s - in org.apache.hadoop.ozone.om.multitenant.TestMultiTenantVolume
[INFO] Running org.apache.hadoop.ozone.om.ratis.TestOzoneManagerRatisRequest
[INFO] Tests run: 1, Failures: 0, Errors: 0, Skipped: 0, Time elapsed: 4.303 s - in org.apache.hadoop.ozone.om.ratis.TestOzoneManagerRatisRequest
[INFO] Running org.apache.hadoop.ozone.om.TestSecureOzoneManager
[INFO] Tests run: 2, Failures: 0, Errors: 0, Skipped: 0, Time elapsed: 2.979 s - in org.apache.hadoop.ozone.om.TestSecureOzoneManager
[INFO] Running org.apache.hadoop.ozone.om.TestOzoneManagerHAMetadataOnly
[INFO] Tests run: 8, Failures: 0, Errors: 0, Skipped: 0, Time elapsed: 109.309 s - in org.apache.hadoop.ozone.om.TestOzoneManagerHAMetadataOnly
[INFO] 
[INFO] Results:
[INFO] 
[ERROR] Failures: 
[ERROR]   TestObjectStoreWithLegacyFS.testFlatKeyStructureWithOBS:141->lambda$testFlatKeyStructureWithOBS$1:141->assertKeyCount:160
[ERROR] Errors: 
[ERROR]   TestOzoneManagerHAWithData>TestOzoneManagerHA.resetCluster:188 » IO java.lang....
[INFO] 
[ERROR] Tests run: 122, Failures: 1, Errors: 1, Skipped: 0
[INFO] 
[INFO] 
[INFO] ------------------------------------------------------------------------
[INFO] Skipping Apache Ozone Mini Ozone Chaos Tests
[INFO] This project has been banned from the build due to previous failures.
[INFO] ------------------------------------------------------------------------
[INFO] ------------------------------------------------------------------------
[INFO] Reactor Summary for Apache Ozone Integration Tests 1.3.0-SNAPSHOT:
[INFO] 
[INFO] Apache Ozone Integration Tests ..................... FAILURE [28:50 min]
[INFO] Apache Ozone Mini Ozone Chaos Tests ................ SKIPPED
[INFO] ------------------------------------------------------------------------
[INFO] BUILD FAILURE
[INFO] ------------------------------------------------------------------------
[INFO] Total time:  28:51 min
[INFO] Finished at: 2022-10-18T04:07:13Z
[INFO] ------------------------------------------------------------------------
[ERROR] Failed to execute goal org.apache.maven.plugins:maven-surefire-plugin:3.0.0-M5:test (default-test) on project ozone-integration-test: There are test failures.
[ERROR] 
[ERROR] Please refer to /home/runner/work/ozone/ozone/hadoop-ozone/integration-test/target/surefire-reports for the individual test results.
[ERROR] Please refer to dump files (if any exist) [date].dump, [date]-jvmRun[N].dump and [date].dumpstream.
[ERROR] -> [Help 1]
[ERROR] 
[ERROR] To see the full stack trace of the errors, re-run Maven with the -e switch.
[ERROR] Re-run Maven using the -X switch to enable full debug logging.
[ERROR] 
[ERROR] For more information about the errors and possible solutions, please read the following articles:
[ERROR] [Help 1] http://cwiki.apache.org/confluence/display/MAVEN/MojoFailureException
