[INFO] Scanning for projects...
[INFO] ------------------------------------------------------------------------
[INFO] Detecting the operating system and CPU architecture
[INFO] ------------------------------------------------------------------------
[INFO] os.detected.name: linux
[INFO] os.detected.arch: x86_64
[INFO] os.detected.version: 5.15
[INFO] os.detected.version.major: 5
[INFO] os.detected.version.minor: 15
[INFO] os.detected.release: ubuntu
[INFO] os.detected.release.version: 20.04
[INFO] os.detected.release.like.ubuntu: true
[INFO] os.detected.release.like.debian: true
[INFO] os.detected.classifier: linux-x86_64
[INFO] ------------------------------------------------------------------------
[INFO] Reactor Build Order:
[INFO] 
[INFO] Apache Ozone Integration Tests                                     [jar]
[INFO] Apache Ozone Mini Ozone Chaos Tests                                [jar]
[INFO] 
[INFO] --------------< org.apache.ozone:ozone-integration-test >---------------
[INFO] Building Apache Ozone Integration Tests 1.4.0-SNAPSHOT             [1/2]
[INFO]   from pom.xml
[INFO] --------------------------------[ jar ]---------------------------------
[INFO] 
[INFO] --- maven-antrun-plugin:3.1.0:run (create-testdirs) @ ozone-integration-test ---
[INFO] Executing tasks
[INFO]     [mkdir] Created dir: /home/runner/work/ozone/ozone/hadoop-ozone/integration-test/target/test-dir
[INFO] Executed tasks
[INFO] 
[INFO] --- maven-enforcer-plugin:3.2.1:enforce (depcheck) @ ozone-integration-test ---
[INFO] Rule 0: org.apache.maven.enforcer.rules.dependency.DependencyConvergence passed
[INFO] Rule 1: org.apache.maven.enforcer.rules.version.RequireMavenVersion passed
[INFO] Rule 2: org.apache.maven.enforcer.rules.version.RequireJavaVersion passed
[INFO] 
[INFO] --- jacoco-maven-plugin:0.8.5:prepare-agent (default-prepare-agent) @ ozone-integration-test ---
[INFO] argLine set to -javaagent:/home/runner/.m2/repository/org/jacoco/org.jacoco.agent/0.8.5/org.jacoco.agent-0.8.5-runtime.jar=destfile=/home/runner/work/ozone/ozone/hadoop-ozone/integration-test/target/jacoco.exec,includes=org.apache.hadoop.hdds.*:org.apache.hadoop.ozone.*:org.apache.hadoop.fs.ozone.*
[INFO] 
[INFO] --- maven-enforcer-plugin:3.2.1:enforce (banned-rocksdb-imports) @ ozone-integration-test ---
[INFO] Rule 0: org.apache.maven.plugins.enforcer.RestrictImports passed
[INFO] Rule 1: org.apache.maven.plugins.enforcer.RestrictImports passed
[INFO] Rule 2: org.apache.maven.plugins.enforcer.RestrictImports passed
[INFO] 
[INFO] --- maven-enforcer-plugin:3.2.1:enforce (ban-junit4-imports) @ ozone-integration-test ---
[INFO] Skipping Rule Enforcement.
[INFO] 
[INFO] --- maven-remote-resources-plugin:1.5:process (default) @ ozone-integration-test ---
[INFO] 
[INFO] --- maven-resources-plugin:3.1.0:resources (default-resources) @ ozone-integration-test ---
[INFO] Using 'UTF-8' encoding to copy filtered resources.
[INFO] skip non existing resourceDirectory /home/runner/work/ozone/ozone/hadoop-ozone/integration-test/src/main/resources
[INFO] Copying 2 resources
[INFO] 
[INFO] --- maven-compiler-plugin:3.1:compile (default-compile) @ ozone-integration-test ---
[INFO] No sources to compile
[INFO] 
[INFO] --- maven-resources-plugin:3.1.0:testResources (default-testResources) @ ozone-integration-test ---
[INFO] Using 'UTF-8' encoding to copy filtered resources.
[INFO] Copying 22 resources
[INFO] Copying 2 resources
[INFO] 
[INFO] --- maven-compiler-plugin:3.1:testCompile (default-testCompile) @ ozone-integration-test ---
[INFO] Compiling 292 source files to /home/runner/work/ozone/ozone/hadoop-ozone/integration-test/target/test-classes
[WARNING] /home/runner/work/ozone/ozone/hadoop-ozone/integration-test/src/test/java/org/apache/hadoop/ozone/TestBlockTokens.java: Some input files use or override a deprecated API.
[WARNING] /home/runner/work/ozone/ozone/hadoop-ozone/integration-test/src/test/java/org/apache/hadoop/ozone/TestBlockTokens.java: Recompile with -Xlint:deprecation for details.
[WARNING] /home/runner/work/ozone/ozone/hadoop-ozone/integration-test/src/test/java/org/apache/hadoop/ozone/om/ratis/TestOzoneManagerRatisRequest.java: Some input files use unchecked or unsafe operations.
[WARNING] /home/runner/work/ozone/ozone/hadoop-ozone/integration-test/src/test/java/org/apache/hadoop/ozone/om/ratis/TestOzoneManagerRatisRequest.java: Recompile with -Xlint:unchecked for details.
[INFO] 
[INFO] --- maven-surefire-plugin:3.2.2:test (default-test) @ ozone-integration-test ---
[INFO] Using auto detected provider org.apache.maven.surefire.junitplatform.JUnitPlatformProvider
[INFO] Using auto detected provider org.apache.maven.surefire.junitplatform.JUnitPlatformProvider
[INFO] 
[INFO] -------------------------------------------------------
[INFO]  T E S T S
[INFO] -------------------------------------------------------
[INFO] Running org.apache.hadoop.fs.ozone.contract.ITestOzoneContractDistCp
[INFO] Tests run: 13, Failures: 0, Errors: 0, Skipped: 0, Time elapsed: 53.96 s -- in org.apache.hadoop.fs.ozone.contract.ITestOzoneContractDistCp
[INFO] Running org.apache.hadoop.fs.ozone.contract.ITestOzoneContractGetFileStatus
[INFO] Tests run: 40, Failures: 0, Errors: 0, Skipped: 0, Time elapsed: 45.73 s -- in org.apache.hadoop.fs.ozone.contract.ITestOzoneContractGetFileStatus
[INFO] Running org.apache.hadoop.fs.ozone.contract.ITestOzoneContractDistCpWithFSO
[INFO] Tests run: 13, Failures: 0, Errors: 0, Skipped: 0, Time elapsed: 49.00 s -- in org.apache.hadoop.fs.ozone.contract.ITestOzoneContractDistCpWithFSO
[INFO] Running org.apache.hadoop.fs.ozone.contract.ITestOzoneContractRootDir
[INFO] Tests run: 18, Failures: 0, Errors: 0, Skipped: 0, Time elapsed: 42.06 s -- in org.apache.hadoop.fs.ozone.contract.ITestOzoneContractRootDir
[INFO] Running org.apache.hadoop.fs.ozone.contract.ITestOzoneContractOpen
[INFO] Tests run: 38, Failures: 0, Errors: 0, Skipped: 0, Time elapsed: 45.68 s -- in org.apache.hadoop.fs.ozone.contract.ITestOzoneContractOpen
[INFO] Running org.apache.hadoop.fs.ozone.contract.ITestOzoneContractMkdir
[INFO] Tests run: 16, Failures: 0, Errors: 0, Skipped: 0, Time elapsed: 43.08 s -- in org.apache.hadoop.fs.ozone.contract.ITestOzoneContractMkdir
[INFO] Running org.apache.hadoop.fs.ozone.contract.ITestOzoneContractCreate
[ERROR] Tests run: 32, Failures: 0, Errors: 1, Skipped: 4, Time elapsed: 45.04 s <<< FAILURE! -- in org.apache.hadoop.fs.ozone.contract.ITestOzoneContractCreate
[ERROR] org.apache.hadoop.fs.ozone.contract.ITestOzoneContractCreate.testSyncable[1] -- Time elapsed: 0.152 s <<< ERROR!
java.io.IOException: Inconsistent read for blockID=conID: 6 locID: 111677748019200007 bcsId: 0 length=2 position=1 numBytesToRead=1 numBytesRead=-1
	at org.apache.hadoop.ozone.client.io.KeyInputStream.checkPartBytesRead(KeyInputStream.java:183)
	at org.apache.hadoop.hdds.scm.storage.MultipartInputStream.readWithStrategy(MultipartInputStream.java:97)
	at org.apache.hadoop.hdds.scm.storage.ExtendedInputStream.read(ExtendedInputStream.java:56)
	at org.apache.hadoop.hdds.scm.storage.ExtendedInputStream.read(ExtendedInputStream.java:43)
	at org.apache.hadoop.fs.ozone.OzoneFSInputStream.read(OzoneFSInputStream.java:55)
	at java.io.FilterInputStream.read(FilterInputStream.java:83)
	at org.apache.hadoop.fs.contract.AbstractContractCreateTest.validateSyncableSemantics(AbstractContractCreateTest.java:548)
	at org.apache.hadoop.fs.contract.AbstractContractCreateTest.testSyncable(AbstractContractCreateTest.java:459)
	at java.lang.reflect.Method.invoke(Method.java:498)
	at java.util.concurrent.FutureTask.run(FutureTask.java:266)
	at java.lang.Thread.run(Thread.java:750)

[INFO] Running org.apache.hadoop.fs.ozone.contract.ITestOzoneContractSeek
[INFO] Tests run: 18, Failures: 0, Errors: 0, Skipped: 0, Time elapsed: 28.59 s -- in org.apache.hadoop.fs.ozone.contract.ITestOzoneContractSeek
[INFO] Running org.apache.hadoop.fs.ozone.contract.ITestOzoneContractRename
[INFO] Tests run: 20, Failures: 0, Errors: 0, Skipped: 0, Time elapsed: 44.19 s -- in org.apache.hadoop.fs.ozone.contract.ITestOzoneContractRename
[INFO] Running org.apache.hadoop.fs.ozone.contract.rooted.ITestRootedOzoneContractRootDir
[INFO] Tests run: 9, Failures: 0, Errors: 0, Skipped: 0, Time elapsed: 24.39 s -- in org.apache.hadoop.fs.ozone.contract.rooted.ITestRootedOzoneContractRootDir
[INFO] Running org.apache.hadoop.fs.ozone.contract.rooted.ITestRootedOzoneContractSeek
[INFO] Tests run: 18, Failures: 0, Errors: 0, Skipped: 0, Time elapsed: 26.08 s -- in org.apache.hadoop.fs.ozone.contract.rooted.ITestRootedOzoneContractSeek
[INFO] Running org.apache.hadoop.fs.ozone.contract.rooted.ITestRootedOzoneContractCreate
[WARNING] Tests run: 16, Failures: 0, Errors: 0, Skipped: 2, Time elapsed: 25.30 s -- in org.apache.hadoop.fs.ozone.contract.rooted.ITestRootedOzoneContractCreate
[INFO] Running org.apache.hadoop.fs.ozone.contract.rooted.ITestRootedOzoneContractDelete
[INFO] Tests run: 8, Failures: 0, Errors: 0, Skipped: 0, Time elapsed: 24.34 s -- in org.apache.hadoop.fs.ozone.contract.rooted.ITestRootedOzoneContractDelete
[INFO] Running org.apache.hadoop.fs.ozone.contract.rooted.ITestRootedOzoneContractUnbuffer
[INFO] Tests run: 6, Failures: 0, Errors: 0, Skipped: 0, Time elapsed: 24.47 s -- in org.apache.hadoop.fs.ozone.contract.rooted.ITestRootedOzoneContractUnbuffer
[INFO] Running org.apache.hadoop.fs.ozone.contract.rooted.ITestRootedOzoneContractOpen
[INFO] Tests run: 19, Failures: 0, Errors: 0, Skipped: 0, Time elapsed: 25.10 s -- in org.apache.hadoop.fs.ozone.contract.rooted.ITestRootedOzoneContractOpen
[INFO] Running org.apache.hadoop.fs.ozone.contract.rooted.ITestRootedOzoneContractMkdir
[INFO] Tests run: 8, Failures: 0, Errors: 0, Skipped: 0, Time elapsed: 24.84 s -- in org.apache.hadoop.fs.ozone.contract.rooted.ITestRootedOzoneContractMkdir
[INFO] Running org.apache.hadoop.fs.ozone.contract.rooted.ITestRootedOzoneContractRename
[INFO] Tests run: 10, Failures: 0, Errors: 0, Skipped: 0, Time elapsed: 25.00 s -- in org.apache.hadoop.fs.ozone.contract.rooted.ITestRootedOzoneContractRename
[INFO] Running org.apache.hadoop.fs.ozone.contract.rooted.ITestRootedOzoneContractGetFileStatus
[INFO] Tests run: 20, Failures: 0, Errors: 0, Skipped: 0, Time elapsed: 26.22 s -- in org.apache.hadoop.fs.ozone.contract.rooted.ITestRootedOzoneContractGetFileStatus
[INFO] Running org.apache.hadoop.fs.ozone.contract.rooted.ITestRootedOzoneContractDistCp
[INFO] Tests run: 13, Failures: 0, Errors: 0, Skipped: 0, Time elapsed: 48.13 s -- in org.apache.hadoop.fs.ozone.contract.rooted.ITestRootedOzoneContractDistCp
[INFO] Running org.apache.hadoop.fs.ozone.contract.ITestOzoneContractDelete
[INFO] Tests run: 16, Failures: 0, Errors: 0, Skipped: 0, Time elapsed: 42.69 s -- in org.apache.hadoop.fs.ozone.contract.ITestOzoneContractDelete
[INFO] Running org.apache.hadoop.fs.ozone.contract.ITestOzoneContractUnbuffer
[INFO] Tests run: 6, Failures: 0, Errors: 0, Skipped: 0, Time elapsed: 24.76 s -- in org.apache.hadoop.fs.ozone.contract.ITestOzoneContractUnbuffer
[INFO] 
[INFO] Results:
[INFO] 
[ERROR] Errors: 
[ERROR]   ITestOzoneContractCreate>AbstractContractCreateTest.testSyncable:459->AbstractContractCreateTest.validateSyncableSemantics:548 » IO Inconsistent read for blockID=conID: 6 locID: 111677748019200007 bcsId: 0 length=2 position=1 numBytesToRead=1 numBytesRead=-1
[INFO] 
[ERROR] Tests run: 357, Failures: 0, Errors: 1, Skipped: 6
[INFO] 
[INFO] 
[INFO] ------------------------------------------------------------------------
[INFO] Skipping Apache Ozone Mini Ozone Chaos Tests
[INFO] This project has been banned from the build due to previous failures.
[INFO] ------------------------------------------------------------------------
[INFO] ------------------------------------------------------------------------
[INFO] Reactor Summary for Apache Ozone Integration Tests 1.4.0-SNAPSHOT:
[INFO] 
[INFO] Apache Ozone Integration Tests ..................... FAILURE [13:14 min]
[INFO] Apache Ozone Mini Ozone Chaos Tests ................ SKIPPED
[INFO] ------------------------------------------------------------------------
[INFO] BUILD FAILURE
[INFO] ------------------------------------------------------------------------
[INFO] Total time:  13:15 min
[INFO] Finished at: 2023-12-14T17:21:32Z
[INFO] ------------------------------------------------------------------------
[INFO] 11 goals, 11 executed
[INFO] 
[INFO] Publishing build scan...
[INFO] https://ge.apache.org/s/pw3khxaf5zzge
[INFO] 
[ERROR] Failed to execute goal org.apache.maven.plugins:maven-surefire-plugin:3.2.2:test (default-test) on project ozone-integration-test: 
[ERROR] 
[ERROR] Please refer to /home/runner/work/ozone/ozone/hadoop-ozone/integration-test/target/surefire-reports for the individual test results.
[ERROR] Please refer to dump files (if any exist) [date].dump, [date]-jvmRun[N].dump and [date].dumpstream.
[ERROR] -> [Help 1]
[ERROR] 
[ERROR] To see the full stack trace of the errors, re-run Maven with the -e switch.
[ERROR] Re-run Maven using the -X switch to enable full debug logging.
[ERROR] 
[ERROR] For more information about the errors and possible solutions, please read the following articles:
[ERROR] [Help 1] http://cwiki.apache.org/confluence/display/MAVEN/MojoFailureException
