[INFO] Scanning for projects...
[INFO] ------------------------------------------------------------------------
[INFO] Detecting the operating system and CPU architecture
[INFO] ------------------------------------------------------------------------
[INFO] os.detected.name: linux
[INFO] os.detected.arch: x86_64
[INFO] os.detected.version: 5.15
[INFO] os.detected.version.major: 5
[INFO] os.detected.version.minor: 15
[INFO] os.detected.release: ubuntu
[INFO] os.detected.release.version: 20.04
[INFO] os.detected.release.like.ubuntu: true
[INFO] os.detected.release.like.debian: true
[INFO] os.detected.classifier: linux-x86_64
[INFO] ------------------------------------------------------------------------
[INFO] Reactor Build Order:
[INFO] 
[INFO] Apache Ozone Integration Tests                                     [jar]
[INFO] Apache Ozone Mini Ozone Chaos Tests                                [jar]
[INFO] 
[INFO] --------------< org.apache.ozone:ozone-integration-test >---------------
[INFO] Building Apache Ozone Integration Tests 1.5.0-SNAPSHOT             [1/2]
[INFO]   from pom.xml
[INFO] --------------------------------[ jar ]---------------------------------
[INFO] 
[INFO] --- maven-antrun-plugin:3.1.0:run (create-testdirs) @ ozone-integration-test ---
[INFO] Executing tasks
[INFO]     [mkdir] Created dir: /home/runner/work/ozone/ozone/hadoop-ozone/integration-test/target/test-dir
[INFO] Executed tasks
[INFO] 
[INFO] --- maven-enforcer-plugin:3.4.1:enforce (depcheck) @ ozone-integration-test ---
[INFO] Rule 0: org.apache.maven.enforcer.rules.dependency.DependencyConvergence passed
[INFO] Rule 1: org.apache.maven.enforcer.rules.version.RequireMavenVersion passed
[INFO] Rule 2: org.apache.maven.enforcer.rules.version.RequireJavaVersion passed
[INFO] 
[INFO] --- jacoco-maven-plugin:0.8.5:prepare-agent (default-prepare-agent) @ ozone-integration-test ---
[INFO] argLine set to -javaagent:/home/runner/.m2/repository/org/jacoco/org.jacoco.agent/0.8.5/org.jacoco.agent-0.8.5-runtime.jar=destfile=/home/runner/work/ozone/ozone/hadoop-ozone/integration-test/target/jacoco.exec,includes=org.apache.hadoop.hdds.*:org.apache.hadoop.ozone.*:org.apache.hadoop.fs.ozone.*
[INFO] 
[INFO] --- maven-enforcer-plugin:3.4.1:enforce (banned-rocksdb-imports) @ ozone-integration-test ---
[INFO] Rule 0: org.apache.maven.plugins.enforcer.RestrictImports passed
[INFO] Rule 1: org.apache.maven.plugins.enforcer.RestrictImports passed
[INFO] Rule 2: org.apache.maven.plugins.enforcer.RestrictImports passed
[INFO] 
[INFO] --- maven-enforcer-plugin:3.4.1:enforce (ban-junit4-imports) @ ozone-integration-test ---
[INFO] Skipping Rule Enforcement.
[INFO] 
[INFO] --- maven-remote-resources-plugin:1.5:process (default) @ ozone-integration-test ---
[INFO] 
[INFO] --- maven-resources-plugin:3.1.0:resources (default-resources) @ ozone-integration-test ---
[INFO] Using 'UTF-8' encoding to copy filtered resources.
[INFO] skip non existing resourceDirectory /home/runner/work/ozone/ozone/hadoop-ozone/integration-test/src/main/resources
[INFO] Copying 2 resources
[INFO] 
[INFO] --- maven-compiler-plugin:3.9.0:compile (default-compile) @ ozone-integration-test ---
[INFO] No sources to compile
[INFO] 
[INFO] --- maven-resources-plugin:3.1.0:testResources (default-testResources) @ ozone-integration-test ---
[INFO] Using 'UTF-8' encoding to copy filtered resources.
[INFO] Copying 22 resources
[INFO] Copying 2 resources
[INFO] 
[INFO] --- maven-compiler-plugin:3.9.0:testCompile (default-testCompile) @ ozone-integration-test ---
[INFO] Compiling 305 source files to /home/runner/work/ozone/ozone/hadoop-ozone/integration-test/target/test-classes
[INFO] /home/runner/work/ozone/ozone/hadoop-ozone/integration-test/src/test/java/org/apache/hadoop/ozone/TestBlockTokens.java: Some input files use or override a deprecated API.
[INFO] /home/runner/work/ozone/ozone/hadoop-ozone/integration-test/src/test/java/org/apache/hadoop/ozone/TestBlockTokens.java: Recompile with -Xlint:deprecation for details.
[INFO] /home/runner/work/ozone/ozone/hadoop-ozone/integration-test/src/test/java/org/apache/hadoop/ozone/om/ratis/TestOzoneManagerRatisRequest.java: Some input files use unchecked or unsafe operations.
[INFO] /home/runner/work/ozone/ozone/hadoop-ozone/integration-test/src/test/java/org/apache/hadoop/ozone/om/ratis/TestOzoneManagerRatisRequest.java: Recompile with -Xlint:unchecked for details.
[INFO] 
[INFO] --- maven-surefire-plugin:3.2.2:test (default-test) @ ozone-integration-test ---
[INFO] Using auto detected provider org.apache.maven.surefire.junitplatform.JUnitPlatformProvider
[INFO] Using auto detected provider org.apache.maven.surefire.junitplatform.JUnitPlatformProvider
[INFO] 
[INFO] -------------------------------------------------------
[INFO]  T E S T S
[INFO] -------------------------------------------------------
[INFO] Running org.apache.hadoop.hdds.upgrade.TestScmHAFinalization
[INFO] Tests run: 4, Failures: 0, Errors: 0, Skipped: 0, Time elapsed: 247.9 s -- in org.apache.hadoop.hdds.upgrade.TestScmHAFinalization
[INFO] Running org.apache.hadoop.hdds.scm.TestSCMSnapshot
[INFO] Tests run: 1, Failures: 0, Errors: 0, Skipped: 0, Time elapsed: 35.73 s -- in org.apache.hadoop.hdds.scm.TestSCMSnapshot
[INFO] Running org.apache.hadoop.hdds.scm.container.TestContainerStateManagerIntegration
[INFO] Tests run: 6, Failures: 0, Errors: 0, Skipped: 0, Time elapsed: 108.2 s -- in org.apache.hadoop.hdds.scm.container.TestContainerStateManagerIntegration
[INFO] Running org.apache.hadoop.hdds.scm.container.metrics.TestSCMContainerManagerMetrics
[INFO] Tests run: 2, Failures: 0, Errors: 0, Skipped: 0, Time elapsed: 39.66 s -- in org.apache.hadoop.hdds.scm.container.metrics.TestSCMContainerManagerMetrics
[INFO] Running org.apache.hadoop.hdds.scm.container.TestScmApplyTransactionFailure
[INFO] Tests run: 2, Failures: 0, Errors: 0, Skipped: 0, Time elapsed: 36.81 s -- in org.apache.hadoop.hdds.scm.container.TestScmApplyTransactionFailure
[INFO] Running org.apache.hadoop.hdds.scm.TestSCMDatanodeProtocolServer
[INFO] Tests run: 1, Failures: 0, Errors: 0, Skipped: 0, Time elapsed: 1.444 s -- in org.apache.hadoop.hdds.scm.TestSCMDatanodeProtocolServer
[INFO] Running org.apache.hadoop.hdds.scm.TestSCMInstallSnapshot
[INFO] Tests run: 1, Failures: 0, Errors: 0, Skipped: 0, Time elapsed: 35.29 s -- in org.apache.hadoop.hdds.scm.TestSCMInstallSnapshot
[INFO] Running org.apache.hadoop.hdds.scm.TestSCMDbCheckpointServlet
[INFO] Tests run: 3, Failures: 0, Errors: 0, Skipped: 0, Time elapsed: 58.64 s -- in org.apache.hadoop.hdds.scm.TestSCMDbCheckpointServlet
[INFO] Running org.apache.hadoop.hdds.scm.pipeline.TestPipelineClose
[INFO] Tests run: 4, Failures: 0, Errors: 0, Skipped: 0, Time elapsed: 78.85 s -- in org.apache.hadoop.hdds.scm.pipeline.TestPipelineClose
[INFO] Running org.apache.hadoop.hdds.scm.pipeline.TestMultiRaftSetup
[INFO] Tests run: 3, Failures: 0, Errors: 0, Skipped: 0, Time elapsed: 57.11 s -- in org.apache.hadoop.hdds.scm.pipeline.TestMultiRaftSetup
[INFO] Running org.apache.hadoop.hdds.scm.pipeline.TestSCMRestart
[INFO] Tests run: 1, Failures: 0, Errors: 0, Skipped: 0, Time elapsed: 25.98 s -- in org.apache.hadoop.hdds.scm.pipeline.TestSCMRestart
[INFO] Running org.apache.hadoop.hdds.scm.pipeline.TestNodeFailure
[INFO] Tests run: 1, Failures: 0, Errors: 0, Skipped: 0, Time elapsed: 53.06 s -- in org.apache.hadoop.hdds.scm.pipeline.TestNodeFailure
[INFO] Running org.apache.hadoop.hdds.scm.pipeline.TestNode2PipelineMap
[INFO] Tests run: 1, Failures: 0, Errors: 0, Skipped: 0, Time elapsed: 22.47 s -- in org.apache.hadoop.hdds.scm.pipeline.TestNode2PipelineMap
[INFO] Running org.apache.hadoop.hdds.scm.pipeline.TestRatisPipelineCreateAndDestroy
[INFO] Tests run: 3, Failures: 0, Errors: 0, Skipped: 0, Time elapsed: 74.93 s -- in org.apache.hadoop.hdds.scm.pipeline.TestRatisPipelineCreateAndDestroy
[INFO] Running org.apache.hadoop.hdds.scm.safemode.TestSCMSafeModeWithPipelineRules
[INFO] Tests run: 1, Failures: 0, Errors: 0, Skipped: 0, Time elapsed: 37.68 s -- in org.apache.hadoop.hdds.scm.safemode.TestSCMSafeModeWithPipelineRules
[INFO] Running org.apache.hadoop.hdds.scm.storage.TestContainerCommandsEC
[INFO] Tests run: 16, Failures: 0, Errors: 0, Skipped: 0, Time elapsed: 173.6 s -- in org.apache.hadoop.hdds.scm.storage.TestContainerCommandsEC
[INFO] Running org.apache.hadoop.hdds.scm.storage.TestCommitWatcher
[ERROR] Tests run: 2, Failures: 0, Errors: 1, Skipped: 0, Time elapsed: 54.15 s <<< FAILURE! -- in org.apache.hadoop.hdds.scm.storage.TestCommitWatcher
[ERROR] org.apache.hadoop.hdds.scm.storage.TestCommitWatcher.testReleaseBuffersOnException -- Time elapsed: 31.78 s <<< ERROR!
java.util.concurrent.ExecutionException: org.apache.ratis.protocol.exceptions.StateMachineException: org.apache.hadoop.hdds.scm.container.common.helpers.ContainerNotOpenException from Server 33965879-fb88-4d42-80f4-a055c9c34edb@group-4943112BD1ED: Container 1 in CLOSING state
	at java.util.concurrent.CompletableFuture.reportGet(CompletableFuture.java:357)
	at java.util.concurrent.CompletableFuture.get(CompletableFuture.java:1908)
	at org.apache.hadoop.hdds.scm.storage.TestCommitWatcher.testReleaseBuffersOnException(TestCommitWatcher.java:297)
	at java.lang.reflect.Method.invoke(Method.java:498)
	at java.util.ArrayList.forEach(ArrayList.java:1259)
	at java.util.ArrayList.forEach(ArrayList.java:1259)
Caused by: org.apache.ratis.protocol.exceptions.StateMachineException: org.apache.hadoop.hdds.scm.container.common.helpers.ContainerNotOpenException from Server 33965879-fb88-4d42-80f4-a055c9c34edb@group-4943112BD1ED: Container 1 in CLOSING state
	at org.apache.hadoop.ozone.container.common.impl.HddsDispatcher.validateContainerCommand(HddsDispatcher.java:534)
	at org.apache.hadoop.ozone.container.common.transport.server.ratis.ContainerStateMachine.startTransaction(ContainerStateMachine.java:415)
	at org.apache.ratis.server.impl.RaftServerImpl.writeAsync(RaftServerImpl.java:941)
	at org.apache.ratis.server.impl.RaftServerImpl.replyFuture(RaftServerImpl.java:919)
	at org.apache.ratis.server.impl.RaftServerImpl.submitClientRequestAsync(RaftServerImpl.java:896)
	at org.apache.ratis.server.impl.RaftServerImpl.lambda$null$11(RaftServerImpl.java:885)
	at org.apache.ratis.util.JavaUtils.callAsUnchecked(JavaUtils.java:117)
	at org.apache.ratis.server.impl.RaftServerImpl.lambda$executeSubmitClientRequestAsync$12(RaftServerImpl.java:885)
	at java.util.concurrent.CompletableFuture$AsyncSupply.run(CompletableFuture.java:1604)
	at java.util.concurrent.ThreadPoolExecutor.runWorker(ThreadPoolExecutor.java:1149)
	at java.util.concurrent.ThreadPoolExecutor$Worker.run(ThreadPoolExecutor.java:624)
	at java.lang.Thread.run(Thread.java:750)
Caused by: org.apache.hadoop.hdds.scm.container.common.helpers.ContainerNotOpenException: Container 1 in CLOSING state
	at java.lang.reflect.Constructor.newInstance(Constructor.java:423)
	at org.apache.ratis.util.ReflectionUtils.instantiateException(ReflectionUtils.java:259)
	at org.apache.ratis.client.impl.ClientProtoUtils.toStateMachineException(ClientProtoUtils.java:449)
	at org.apache.ratis.client.impl.ClientProtoUtils.toStateMachineException(ClientProtoUtils.java:435)
	at org.apache.ratis.client.impl.ClientProtoUtils.toRaftClientReply(ClientProtoUtils.java:402)
	at org.apache.ratis.grpc.client.GrpcClientProtocolClient$AsyncStreamObservers$1.onNext(GrpcClientProtocolClient.java:310)
	at org.apache.ratis.grpc.client.GrpcClientProtocolClient$AsyncStreamObservers$1.onNext(GrpcClientProtocolClient.java:305)
	at org.apache.ratis.thirdparty.io.grpc.stub.ClientCalls$StreamObserverToCallListenerAdapter.onMessage(ClientCalls.java:468)
	at org.apache.ratis.thirdparty.io.grpc.ForwardingClientCallListener.onMessage(ForwardingClientCallListener.java:33)
	at org.apache.ratis.thirdparty.io.grpc.internal.DelayedClientCall$DelayedListener.onMessage(DelayedClientCall.java:473)
	at org.apache.ratis.thirdparty.io.grpc.internal.ClientCallImpl$ClientStreamListenerImpl$1MessagesAvailable.runInternal(ClientCallImpl.java:660)
	at org.apache.ratis.thirdparty.io.grpc.internal.ClientCallImpl$ClientStreamListenerImpl$1MessagesAvailable.runInContext(ClientCallImpl.java:647)
	at org.apache.ratis.thirdparty.io.grpc.internal.ContextRunnable.run(ContextRunnable.java:37)
	at org.apache.ratis.thirdparty.io.grpc.internal.SerializingExecutor.run(SerializingExecutor.java:133)
	... 3 more

[INFO] Running org.apache.hadoop.hdds.scm.TestRatisPipelineLeader
[INFO] Tests run: 2, Failures: 0, Errors: 0, Skipped: 0, Time elapsed: 45.58 s -- in org.apache.hadoop.hdds.scm.TestRatisPipelineLeader
[INFO] 
[INFO] Results:
[INFO] 
[ERROR] Errors: 
[ERROR]   TestCommitWatcher.testReleaseBuffersOnException:297 » Execution org.apache.ratis.protocol.exceptions.StateMachineException: org.apache.hadoop.hdds.scm.container.common.helpers.ContainerNotOpenException from Server 33965879-fb88-4d42-80f4-a055c9c34edb@group-4943112BD1ED: Container 1 in CLOSING state
[INFO] 
[ERROR] Tests run: 54, Failures: 0, Errors: 1, Skipped: 0
[INFO] 
[INFO] 
[INFO] ------------------------------------------------------------------------
[INFO] Skipping Apache Ozone Mini Ozone Chaos Tests
[INFO] This project has been banned from the build due to previous failures.
[INFO] ------------------------------------------------------------------------
[INFO] ------------------------------------------------------------------------
[INFO] Reactor Summary for Apache Ozone Integration Tests 1.5.0-SNAPSHOT:
[INFO] 
[INFO] Apache Ozone Integration Tests ..................... FAILURE [20:34 min]
[INFO] Apache Ozone Mini Ozone Chaos Tests ................ SKIPPED
[INFO] ------------------------------------------------------------------------
[INFO] BUILD FAILURE
[INFO] ------------------------------------------------------------------------
[INFO] Total time:  20:35 min
[INFO] Finished at: 2024-01-01T16:03:06Z
[INFO] ------------------------------------------------------------------------
[INFO] 11 goals, 11 executed
[INFO] 
[INFO] Publishing build scan...
[INFO] https://ge.apache.org/s/kaq4qel73uvgo
[INFO] 
[ERROR] Failed to execute goal org.apache.maven.plugins:maven-surefire-plugin:3.2.2:test (default-test) on project ozone-integration-test: 
[ERROR] 
[ERROR] Please refer to /home/runner/work/ozone/ozone/hadoop-ozone/integration-test/target/surefire-reports for the individual test results.
[ERROR] Please refer to dump files (if any exist) [date].dump, [date]-jvmRun[N].dump and [date].dumpstream.
[ERROR] -> [Help 1]
[ERROR] 
[ERROR] To see the full stack trace of the errors, re-run Maven with the -e switch.
[ERROR] Re-run Maven using the -X switch to enable full debug logging.
[ERROR] 
[ERROR] For more information about the errors and possible solutions, please read the following articles:
[ERROR] [Help 1] http://cwiki.apache.org/confluence/display/MAVEN/MojoFailureException
