[INFO] Scanning for projects...
[INFO] ------------------------------------------------------------------------
[INFO] Detecting the operating system and CPU architecture
[INFO] ------------------------------------------------------------------------
[INFO] os.detected.name: linux
[INFO] os.detected.arch: x86_64
[INFO] os.detected.version: 5.15
[INFO] os.detected.version.major: 5
[INFO] os.detected.version.minor: 15
[INFO] os.detected.release: ubuntu
[INFO] os.detected.release.version: 20.04
[INFO] os.detected.release.like.ubuntu: true
[INFO] os.detected.release.like.debian: true
[INFO] os.detected.classifier: linux-x86_64
[INFO] ------------------------------------------------------------------------
[INFO] Reactor Build Order:
[INFO] 
[INFO] Apache Ozone Integration Tests                                     [jar]
[INFO] Apache Ozone Mini Ozone Chaos Tests                                [jar]
[INFO] 
[INFO] --------------< org.apache.ozone:ozone-integration-test >---------------
[INFO] Building Apache Ozone Integration Tests 1.4.0-SNAPSHOT             [1/2]
[INFO]   from pom.xml
[INFO] --------------------------------[ jar ]---------------------------------
[INFO] 
[INFO] --- maven-antrun-plugin:3.1.0:run (create-testdirs) @ ozone-integration-test ---
[INFO] Executing tasks
[INFO]     [mkdir] Created dir: /home/runner/work/ozone/ozone/hadoop-ozone/integration-test/target/test-dir
[INFO] Executed tasks
[INFO] 
[INFO] --- maven-enforcer-plugin:3.2.1:enforce (depcheck) @ ozone-integration-test ---
[INFO] Rule 0: org.apache.maven.enforcer.rules.dependency.DependencyConvergence passed
[INFO] Rule 1: org.apache.maven.enforcer.rules.version.RequireMavenVersion passed
[INFO] Rule 2: org.apache.maven.enforcer.rules.version.RequireJavaVersion passed
[INFO] 
[INFO] --- jacoco-maven-plugin:0.8.5:prepare-agent (default-prepare-agent) @ ozone-integration-test ---
[INFO] argLine set to -javaagent:/home/runner/.m2/repository/org/jacoco/org.jacoco.agent/0.8.5/org.jacoco.agent-0.8.5-runtime.jar=destfile=/home/runner/work/ozone/ozone/hadoop-ozone/integration-test/target/jacoco.exec,includes=org.apache.hadoop.hdds.*:org.apache.hadoop.ozone.*:org.apache.hadoop.fs.ozone.*
[INFO] 
[INFO] --- maven-enforcer-plugin:3.2.1:enforce (banned-rocksdb-imports) @ ozone-integration-test ---
[INFO] Rule 0: org.apache.maven.plugins.enforcer.RestrictImports passed
[INFO] Rule 1: org.apache.maven.plugins.enforcer.RestrictImports passed
[INFO] Rule 2: org.apache.maven.plugins.enforcer.RestrictImports passed
[INFO] 
[INFO] --- maven-enforcer-plugin:3.2.1:enforce (ban-junit4-imports) @ ozone-integration-test ---
[INFO] Skipping Rule Enforcement.
[INFO] 
[INFO] --- maven-remote-resources-plugin:1.5:process (default) @ ozone-integration-test ---
[INFO] 
[INFO] --- maven-resources-plugin:3.1.0:resources (default-resources) @ ozone-integration-test ---
[INFO] Using 'UTF-8' encoding to copy filtered resources.
[INFO] skip non existing resourceDirectory /home/runner/work/ozone/ozone/hadoop-ozone/integration-test/src/main/resources
[INFO] Copying 2 resources
[INFO] 
[INFO] --- maven-compiler-plugin:3.1:compile (default-compile) @ ozone-integration-test ---
[INFO] No sources to compile
[INFO] 
[INFO] --- maven-resources-plugin:3.1.0:testResources (default-testResources) @ ozone-integration-test ---
[INFO] Using 'UTF-8' encoding to copy filtered resources.
[INFO] Copying 22 resources
[INFO] Copying 2 resources
[INFO] 
[INFO] --- maven-compiler-plugin:3.1:testCompile (default-testCompile) @ ozone-integration-test ---
[INFO] Compiling 292 source files to /home/runner/work/ozone/ozone/hadoop-ozone/integration-test/target/test-classes
[WARNING] /home/runner/work/ozone/ozone/hadoop-ozone/integration-test/src/test/java/org/apache/hadoop/ozone/TestBlockTokens.java: Some input files use or override a deprecated API.
[WARNING] /home/runner/work/ozone/ozone/hadoop-ozone/integration-test/src/test/java/org/apache/hadoop/ozone/TestBlockTokens.java: Recompile with -Xlint:deprecation for details.
[WARNING] /home/runner/work/ozone/ozone/hadoop-ozone/integration-test/src/test/java/org/apache/hadoop/ozone/om/ratis/TestOzoneManagerRatisRequest.java: Some input files use unchecked or unsafe operations.
[WARNING] /home/runner/work/ozone/ozone/hadoop-ozone/integration-test/src/test/java/org/apache/hadoop/ozone/om/ratis/TestOzoneManagerRatisRequest.java: Recompile with -Xlint:unchecked for details.
[INFO] 
[INFO] --- maven-surefire-plugin:3.2.2:test (default-test) @ ozone-integration-test ---
[INFO] Using auto detected provider org.apache.maven.surefire.junitplatform.JUnitPlatformProvider
[INFO] Using auto detected provider org.apache.maven.surefire.junitplatform.JUnitPlatformProvider
[INFO] 
[INFO] -------------------------------------------------------
[INFO]  T E S T S
[INFO] -------------------------------------------------------
[INFO] Running org.apache.hadoop.ozone.om.TestSnapshotDeletingService
[INFO] Tests run: 1, Failures: 0, Errors: 0, Skipped: 0, Time elapsed: 69.77 s -- in org.apache.hadoop.ozone.om.TestSnapshotDeletingService
[INFO] Running org.apache.hadoop.ozone.om.TestOmInit
[INFO] Tests run: 1, Failures: 0, Errors: 0, Skipped: 0, Time elapsed: 22.17 s -- in org.apache.hadoop.ozone.om.TestOmInit
[INFO] Running org.apache.hadoop.ozone.om.TestOmSnapshotFileSystemFso
[INFO] Tests run: 8, Failures: 0, Errors: 0, Skipped: 0, Time elapsed: 44.33 s -- in org.apache.hadoop.ozone.om.TestOmSnapshotFileSystemFso
[INFO] Running org.apache.hadoop.ozone.om.ratis.TestOzoneManagerRatisRequest
[INFO] Tests run: 2, Failures: 0, Errors: 0, Skipped: 0, Time elapsed: 4.685 s -- in org.apache.hadoop.ozone.om.ratis.TestOzoneManagerRatisRequest
[INFO] Running org.apache.hadoop.ozone.om.TestOMEpochForNonRatis
[INFO] Tests run: 2, Failures: 0, Errors: 0, Skipped: 0, Time elapsed: 27.70 s -- in org.apache.hadoop.ozone.om.TestOMEpochForNonRatis
[INFO] Running org.apache.hadoop.ozone.om.TestOzoneManagerHAWithStoppedNodes
[INFO] Tests run: 12, Failures: 0, Errors: 0, Skipped: 0, Time elapsed: 215.6 s -- in org.apache.hadoop.ozone.om.TestOzoneManagerHAWithStoppedNodes
[INFO] Running org.apache.hadoop.ozone.om.multitenant.TestMultiTenantVolume
[INFO] Tests run: 5, Failures: 0, Errors: 0, Skipped: 0, Time elapsed: 9.172 s -- in org.apache.hadoop.ozone.om.multitenant.TestMultiTenantVolume
[INFO] Running org.apache.hadoop.ozone.om.TestOzoneManagerRocksDBLogging
[INFO] Tests run: 1, Failures: 0, Errors: 0, Skipped: 0, Time elapsed: 45.91 s -- in org.apache.hadoop.ozone.om.TestOzoneManagerRocksDBLogging
[INFO] Running org.apache.hadoop.ozone.om.TestOzoneManagerRestInterface
[INFO] Tests run: 1, Failures: 0, Errors: 0, Skipped: 0, Time elapsed: 23.32 s -- in org.apache.hadoop.ozone.om.TestOzoneManagerRestInterface
[INFO] Running org.apache.hadoop.ozone.om.TestOMStartupWithBucketLayout
[INFO] Tests run: 2, Failures: 0, Errors: 0, Skipped: 0, Time elapsed: 43.04 s -- in org.apache.hadoop.ozone.om.TestOMStartupWithBucketLayout
[INFO] Running org.apache.hadoop.ozone.om.TestBucketLayoutWithOlderClient
[INFO] Tests run: 1, Failures: 0, Errors: 0, Skipped: 0, Time elapsed: 23.87 s -- in org.apache.hadoop.ozone.om.TestBucketLayoutWithOlderClient
[INFO] Running org.apache.hadoop.ozone.om.TestOmBlockVersioning
[INFO] Tests run: 2, Failures: 0, Errors: 0, Skipped: 0, Time elapsed: 23.35 s -- in org.apache.hadoop.ozone.om.TestOmBlockVersioning
[INFO] Running org.apache.hadoop.ozone.om.TestListKeys
[INFO] Tests run: 15, Failures: 0, Errors: 0, Skipped: 0, Time elapsed: 24.96 s -- in org.apache.hadoop.ozone.om.TestListKeys
[INFO] Running org.apache.hadoop.ozone.om.TestOmConf
[INFO] Tests run: 1, Failures: 0, Errors: 0, Skipped: 0, Time elapsed: 0.371 s -- in org.apache.hadoop.ozone.om.TestOmConf
[INFO] Running org.apache.hadoop.ozone.om.TestOmContainerLocationCache
[INFO] Tests run: 14, Failures: 0, Errors: 0, Skipped: 0, Time elapsed: 14.73 s -- in org.apache.hadoop.ozone.om.TestOmContainerLocationCache
[INFO] Running org.apache.hadoop.ozone.om.TestOMBucketLayoutUpgrade
[INFO] Tests run: 8, Failures: 0, Errors: 0, Skipped: 0, Time elapsed: 21.62 s -- in org.apache.hadoop.ozone.om.TestOMBucketLayoutUpgrade
[INFO] Running org.apache.hadoop.ozone.om.TestOzoneManagerRestart
[INFO] Tests run: 3, Failures: 0, Errors: 0, Skipped: 0, Time elapsed: 50.34 s -- in org.apache.hadoop.ozone.om.TestOzoneManagerRestart
[INFO] Running org.apache.hadoop.ozone.om.TestKeyManagerImpl
[INFO] Tests run: 24, Failures: 0, Errors: 0, Skipped: 0, Time elapsed: 16.60 s -- in org.apache.hadoop.ozone.om.TestKeyManagerImpl
[INFO] Running org.apache.hadoop.ozone.om.TestRecursiveAclWithFSO
[INFO] Tests run: 1, Failures: 0, Errors: 0, Skipped: 0, Time elapsed: 23.57 s -- in org.apache.hadoop.ozone.om.TestRecursiveAclWithFSO
[INFO] Running org.apache.hadoop.ozone.om.TestSecureOzoneManager
[INFO] Tests run: 2, Failures: 0, Errors: 0, Skipped: 0, Time elapsed: 1.897 s -- in org.apache.hadoop.ozone.om.TestSecureOzoneManager
[INFO] Running org.apache.hadoop.ozone.om.TestOmSnapshotDisabled
[INFO] Tests run: 1, Failures: 0, Errors: 0, Skipped: 0, Time elapsed: 26.88 s -- in org.apache.hadoop.ozone.om.TestOmSnapshotDisabled
[INFO] Running org.apache.hadoop.ozone.om.TestOzoneManagerListVolumes
[INFO] Tests run: 6, Failures: 0, Errors: 0, Skipped: 0, Time elapsed: 28.04 s -- in org.apache.hadoop.ozone.om.TestOzoneManagerListVolumes
[INFO] Running org.apache.hadoop.ozone.om.TestOmAcls
[INFO] Tests run: 7, Failures: 0, Errors: 0, Skipped: 0, Time elapsed: 24.17 s -- in org.apache.hadoop.ozone.om.TestOmAcls
[INFO] Running org.apache.hadoop.ozone.om.TestOzoneManagerHASnapshot
[INFO] Tests run: 4, Failures: 0, Errors: 0, Skipped: 0, Time elapsed: 52.76 s -- in org.apache.hadoop.ozone.om.TestOzoneManagerHASnapshot
[INFO] Running org.apache.hadoop.ozone.om.TestOmSnapshotFileSystemLegacy
[INFO] Tests run: 8, Failures: 0, Errors: 0, Skipped: 0, Time elapsed: 45.28 s -- in org.apache.hadoop.ozone.om.TestOmSnapshotFileSystemLegacy
[INFO] Running org.apache.hadoop.ozone.om.TestOMUpgradeFinalization
[INFO] Tests run: 1, Failures: 0, Errors: 0, Skipped: 0, Time elapsed: 38.82 s -- in org.apache.hadoop.ozone.om.TestOMUpgradeFinalization
[INFO] Running org.apache.hadoop.ozone.om.TestObjectStoreWithLegacyFS
[INFO] Tests run: 2, Failures: 0, Errors: 0, Skipped: 0, Time elapsed: 24.79 s -- in org.apache.hadoop.ozone.om.TestObjectStoreWithLegacyFS
[INFO] Running org.apache.hadoop.ozone.om.TestObjectStoreWithFSO
[INFO] Tests run: 9, Failures: 0, Errors: 0, Skipped: 0, Time elapsed: 25.74 s -- in org.apache.hadoop.ozone.om.TestObjectStoreWithFSO
[INFO] Running org.apache.hadoop.ozone.om.TestOzoneManagerListVolumesSecure
[INFO] Tests run: 6, Failures: 0, Errors: 0, Skipped: 0, Time elapsed: 58.69 s -- in org.apache.hadoop.ozone.om.TestOzoneManagerListVolumesSecure
[INFO] Running org.apache.hadoop.ozone.om.TestKeyPurging
[INFO] Tests run: 1, Failures: 0, Errors: 0, Skipped: 0, Time elapsed: 24.30 s -- in org.apache.hadoop.ozone.om.TestKeyPurging
[INFO] Running org.apache.hadoop.ozone.om.TestListKeysWithFSO
[INFO] Tests run: 5, Failures: 0, Errors: 0, Skipped: 0, Time elapsed: 27.66 s -- in org.apache.hadoop.ozone.om.TestListKeysWithFSO
[INFO] Running org.apache.hadoop.ozone.om.TestOzoneManagerConfiguration
[INFO] Tests run: 9, Failures: 0, Errors: 0, Skipped: 0, Time elapsed: 53.62 s -- in org.apache.hadoop.ozone.om.TestOzoneManagerConfiguration
[INFO] Running org.apache.hadoop.ozone.om.TestOmStartupSlvLessThanMlv
[INFO] Tests run: 1, Failures: 0, Errors: 0, Skipped: 0, Time elapsed: 3.221 s -- in org.apache.hadoop.ozone.om.TestOmStartupSlvLessThanMlv
[INFO] Running org.apache.hadoop.ozone.om.TestAddRemoveOzoneManager
[INFO] Tests run: 3, Failures: 0, Errors: 0, Skipped: 0, Time elapsed: 142.0 s -- in org.apache.hadoop.ozone.om.TestAddRemoveOzoneManager
[INFO] Running org.apache.hadoop.ozone.om.TestBucketOwner
[INFO] Tests run: 3, Failures: 0, Errors: 0, Skipped: 0, Time elapsed: 24.32 s -- in org.apache.hadoop.ozone.om.TestBucketOwner
[INFO] Running org.apache.hadoop.ozone.om.snapshot.TestOmSnapshotFsoWithoutNativeLib
[INFO] Tests run: 42, Failures: 0, Errors: 0, Skipped: 0, Time elapsed: 190.8 s -- in org.apache.hadoop.ozone.om.snapshot.TestOmSnapshotFsoWithoutNativeLib
[INFO] Running org.apache.hadoop.ozone.om.snapshot.TestOmSnapshotLegacy
[WARNING] Tests run: 42, Failures: 0, Errors: 0, Skipped: 5, Time elapsed: 173.8 s -- in org.apache.hadoop.ozone.om.snapshot.TestOmSnapshotLegacy
[INFO] Running org.apache.hadoop.ozone.om.snapshot.TestOzoneManagerSnapshotAcl
[INFO] Tests run: 50, Failures: 0, Errors: 0, Skipped: 0, Time elapsed: 34.21 s -- in org.apache.hadoop.ozone.om.snapshot.TestOzoneManagerSnapshotAcl
[INFO] Running org.apache.hadoop.ozone.om.snapshot.TestOzoneManagerSnapshotProvider
[INFO] Tests run: 1, Failures: 0, Errors: 0, Skipped: 0, Time elapsed: 27.15 s -- in org.apache.hadoop.ozone.om.snapshot.TestOzoneManagerSnapshotProvider
[INFO] Running org.apache.hadoop.ozone.om.snapshot.TestOmSnapshotObjectStore
[WARNING] Tests run: 42, Failures: 0, Errors: 0, Skipped: 5, Time elapsed: 170.2 s -- in org.apache.hadoop.ozone.om.snapshot.TestOmSnapshotObjectStore
[INFO] Running org.apache.hadoop.ozone.om.snapshot.TestOmSnapshotFsoWithNativeLib
[INFO] Tests run: 42, Failures: 0, Errors: 0, Skipped: 0, Time elapsed: 187.4 s -- in org.apache.hadoop.ozone.om.snapshot.TestOmSnapshotFsoWithNativeLib
[INFO] Running org.apache.hadoop.ozone.om.snapshot.TestOzoneSnapshotRestore
[INFO] Tests run: 8, Failures: 0, Errors: 0, Skipped: 0, Time elapsed: 59.24 s -- in org.apache.hadoop.ozone.om.snapshot.TestOzoneSnapshotRestore
[INFO] Running org.apache.hadoop.ozone.om.TestOmMetrics
[INFO] Tests run: 6, Failures: 0, Errors: 0, Skipped: 0, Time elapsed: 80.61 s -- in org.apache.hadoop.ozone.om.TestOmMetrics
[INFO] Running org.apache.hadoop.ozone.om.TestOMDbCheckpointServlet
[INFO] Tests run: 11, Failures: 0, Errors: 0, Skipped: 0, Time elapsed: 184.9 s -- in org.apache.hadoop.ozone.om.TestOMDbCheckpointServlet
[INFO] Running org.apache.hadoop.ozone.om.TestObjectStore
[INFO] Tests run: 4, Failures: 0, Errors: 0, Skipped: 0, Time elapsed: 23.86 s -- in org.apache.hadoop.ozone.om.TestObjectStore
[INFO] Running org.apache.hadoop.ozone.om.TestListStatus
[INFO] Tests run: 1, Failures: 0, Errors: 0, Skipped: 0, Time elapsed: 23.62 s -- in org.apache.hadoop.ozone.om.TestListStatus
[INFO] Running org.apache.hadoop.ozone.om.TestOzoneManagerHAWithAllRunning
[INFO] Tests run: 27, Failures: 0, Errors: 0, Skipped: 0, Time elapsed: 69.03 s -- in org.apache.hadoop.ozone.om.TestOzoneManagerHAWithAllRunning
[INFO] Running org.apache.hadoop.ozone.om.TestOMRatisSnapshots
[ERROR] Tests run: 7, Failures: 0, Errors: 1, Skipped: 0, Time elapsed: 2081 s <<< FAILURE! -- in org.apache.hadoop.ozone.om.TestOMRatisSnapshots
[ERROR] org.apache.hadoop.ozone.om.TestOMRatisSnapshots.testInstallSnapshotWithClientWrite -- Time elapsed: 1839 s <<< ERROR!
KEY_NOT_FOUND org.apache.hadoop.ozone.om.exceptions.OMException: Failed to commit key, as /volume72061/bucket64927/key58449/111539412210943122entry is not found in the OpenKey table
	at org.apache.hadoop.ozone.om.protocolPB.OzoneManagerProtocolClientSideTranslatorPB.handleError(OzoneManagerProtocolClientSideTranslatorPB.java:737)
	at org.apache.hadoop.ozone.om.protocolPB.OzoneManagerProtocolClientSideTranslatorPB.updateKey(OzoneManagerProtocolClientSideTranslatorPB.java:829)
	at org.apache.hadoop.ozone.om.protocolPB.OzoneManagerProtocolClientSideTranslatorPB.commitKey(OzoneManagerProtocolClientSideTranslatorPB.java:786)
	at org.apache.hadoop.ozone.client.io.BlockOutputStreamEntryPool.commitKey(BlockOutputStreamEntryPool.java:345)
	at org.apache.hadoop.ozone.client.io.KeyOutputStream.close(KeyOutputStream.java:574)
	at org.apache.hadoop.ozone.client.io.OzoneOutputStream.close(OzoneOutputStream.java:105)
	at org.apache.hadoop.ozone.om.TestOzoneManagerHA.createKey(TestOzoneManagerHA.java:224)
	at org.apache.hadoop.ozone.om.TestOMRatisSnapshots.writeKeysToIncreaseLogIndex(TestOMRatisSnapshots.java:1074)
	at org.apache.hadoop.ozone.om.TestOMRatisSnapshots.testInstallSnapshotWithClientWrite(TestOMRatisSnapshots.java:761)
	at sun.reflect.NativeMethodAccessorImpl.invoke0(Native Method)
	at sun.reflect.NativeMethodAccessorImpl.invoke(NativeMethodAccessorImpl.java:62)
	at sun.reflect.DelegatingMethodAccessorImpl.invoke(DelegatingMethodAccessorImpl.java:43)
	at java.lang.reflect.Method.invoke(Method.java:498)
	at org.junit.platform.commons.util.ReflectionUtils.invokeMethod(ReflectionUtils.java:725)
	at org.junit.jupiter.engine.execution.MethodInvocation.proceed(MethodInvocation.java:60)
	at org.junit.jupiter.engine.execution.InvocationInterceptorChain$ValidatingInvocation.proceed(InvocationInterceptorChain.java:131)
	at org.junit.jupiter.engine.extension.TimeoutInvocation.proceed(TimeoutInvocation.java:46)
	at org.junit.jupiter.engine.extension.TimeoutExtension.intercept(TimeoutExtension.java:149)
	at org.junit.jupiter.engine.extension.TimeoutExtension.interceptTestableMethod(TimeoutExtension.java:140)
	at org.junit.jupiter.engine.extension.TimeoutExtension.interceptTestMethod(TimeoutExtension.java:84)
	at org.junit.jupiter.engine.execution.ExecutableInvoker$ReflectiveInterceptorCall.lambda$ofVoidMethod$0(ExecutableInvoker.java:115)
	at org.junit.jupiter.engine.execution.ExecutableInvoker.lambda$invoke$0(ExecutableInvoker.java:105)
	at org.junit.jupiter.engine.execution.InvocationInterceptorChain$InterceptedInvocation.proceed(InvocationInterceptorChain.java:106)
	at org.junit.jupiter.engine.execution.InvocationInterceptorChain.proceed(InvocationInterceptorChain.java:64)
	at org.junit.jupiter.engine.execution.InvocationInterceptorChain.chainAndInvoke(InvocationInterceptorChain.java:45)
	at org.junit.jupiter.engine.execution.InvocationInterceptorChain.invoke(InvocationInterceptorChain.java:37)
	at org.junit.jupiter.engine.execution.ExecutableInvoker.invoke(ExecutableInvoker.java:104)
	at org.junit.jupiter.engine.execution.ExecutableInvoker.invoke(ExecutableInvoker.java:98)
	at org.junit.jupiter.engine.descriptor.TestMethodTestDescriptor.lambda$invokeTestMethod$7(TestMethodTestDescriptor.java:214)
	at org.junit.platform.engine.support.hierarchical.ThrowableCollector.execute(ThrowableCollector.java:73)
	at org.junit.jupiter.engine.descriptor.TestMethodTestDescriptor.invokeTestMethod(TestMethodTestDescriptor.java:210)
	at org.junit.jupiter.engine.descriptor.TestMethodTestDescriptor.execute(TestMethodTestDescriptor.java:135)
	at org.junit.jupiter.engine.descriptor.TestMethodTestDescriptor.execute(TestMethodTestDescriptor.java:66)
	at org.junit.platform.engine.support.hierarchical.NodeTestTask.lambda$executeRecursively$6(NodeTestTask.java:151)
	at org.junit.platform.engine.support.hierarchical.ThrowableCollector.execute(ThrowableCollector.java:73)
	at org.junit.platform.engine.support.hierarchical.NodeTestTask.lambda$executeRecursively$8(NodeTestTask.java:141)
	at org.junit.platform.engine.support.hierarchical.Node.around(Node.java:137)
	at org.junit.platform.engine.support.hierarchical.NodeTestTask.lambda$executeRecursively$9(NodeTestTask.java:139)
	at org.junit.platform.engine.support.hierarchical.ThrowableCollector.execute(ThrowableCollector.java:73)
	at org.junit.platform.engine.support.hierarchical.NodeTestTask.executeRecursively(NodeTestTask.java:138)
	at org.junit.platform.engine.support.hierarchical.NodeTestTask.execute(NodeTestTask.java:95)
	at java.util.ArrayList.forEach(ArrayList.java:1259)
	at org.junit.platform.engine.support.hierarchical.SameThreadHierarchicalTestExecutorService.invokeAll(SameThreadHierarchicalTestExecutorService.java:41)
	at org.junit.platform.engine.support.hierarchical.NodeTestTask.lambda$executeRecursively$6(NodeTestTask.java:155)
	at org.junit.platform.engine.support.hierarchical.ThrowableCollector.execute(ThrowableCollector.java:73)
	at org.junit.platform.engine.support.hierarchical.NodeTestTask.lambda$executeRecursively$8(NodeTestTask.java:141)
	at org.junit.platform.engine.support.hierarchical.Node.around(Node.java:137)
	at org.junit.platform.engine.support.hierarchical.NodeTestTask.lambda$executeRecursively$9(NodeTestTask.java:139)
	at org.junit.platform.engine.support.hierarchical.ThrowableCollector.execute(ThrowableCollector.java:73)
	at org.junit.platform.engine.support.hierarchical.NodeTestTask.executeRecursively(NodeTestTask.java:138)
	at org.junit.platform.engine.support.hierarchical.NodeTestTask.execute(NodeTestTask.java:95)
	at java.util.ArrayList.forEach(ArrayList.java:1259)
	at org.junit.platform.engine.support.hierarchical.SameThreadHierarchicalTestExecutorService.invokeAll(SameThreadHierarchicalTestExecutorService.java:41)
	at org.junit.platform.engine.support.hierarchical.NodeTestTask.lambda$executeRecursively$6(NodeTestTask.java:155)
	at org.junit.platform.engine.support.hierarchical.ThrowableCollector.execute(ThrowableCollector.java:73)
	at org.junit.platform.engine.support.hierarchical.NodeTestTask.lambda$executeRecursively$8(NodeTestTask.java:141)
	at org.junit.platform.engine.support.hierarchical.Node.around(Node.java:137)
	at org.junit.platform.engine.support.hierarchical.NodeTestTask.lambda$executeRecursively$9(NodeTestTask.java:139)
	at org.junit.platform.engine.support.hierarchical.ThrowableCollector.execute(ThrowableCollector.java:73)
	at org.junit.platform.engine.support.hierarchical.NodeTestTask.executeRecursively(NodeTestTask.java:138)
	at org.junit.platform.engine.support.hierarchical.NodeTestTask.execute(NodeTestTask.java:95)
	at org.junit.platform.engine.support.hierarchical.SameThreadHierarchicalTestExecutorService.submit(SameThreadHierarchicalTestExecutorService.java:35)
	at org.junit.platform.engine.support.hierarchical.HierarchicalTestExecutor.execute(HierarchicalTestExecutor.java:57)
	at org.junit.platform.engine.support.hierarchical.HierarchicalTestEngine.execute(HierarchicalTestEngine.java:54)
	at org.junit.platform.launcher.core.EngineExecutionOrchestrator.execute(EngineExecutionOrchestrator.java:107)
	at org.junit.platform.launcher.core.EngineExecutionOrchestrator.execute(EngineExecutionOrchestrator.java:88)
	at org.junit.platform.launcher.core.EngineExecutionOrchestrator.lambda$execute$0(EngineExecutionOrchestrator.java:54)
	at org.junit.platform.launcher.core.EngineExecutionOrchestrator.withInterceptedStreams(EngineExecutionOrchestrator.java:67)
	at org.junit.platform.launcher.core.EngineExecutionOrchestrator.execute(EngineExecutionOrchestrator.java:52)
	at org.junit.platform.launcher.core.DefaultLauncher.execute(DefaultLauncher.java:114)
	at org.junit.platform.launcher.core.DefaultLauncher.execute(DefaultLauncher.java:86)
	at org.junit.platform.launcher.core.DefaultLauncherSession$DelegatingLauncher.execute(DefaultLauncherSession.java:86)
	at org.apache.maven.surefire.junitplatform.LazyLauncher.execute(LazyLauncher.java:56)
	at org.apache.maven.surefire.junitplatform.JUnitPlatformProvider.execute(JUnitPlatformProvider.java:184)
	at org.apache.maven.surefire.junitplatform.JUnitPlatformProvider.invokeAllTests(JUnitPlatformProvider.java:148)
	at org.apache.maven.surefire.junitplatform.JUnitPlatformProvider.invoke(JUnitPlatformProvider.java:120)
	at org.apache.maven.surefire.booter.ForkedBooter.runSuitesInProcess(ForkedBooter.java:385)
	at org.apache.maven.surefire.booter.ForkedBooter.execute(ForkedBooter.java:162)
	at org.apache.maven.surefire.booter.ForkedBooter.run(ForkedBooter.java:507)
	at org.apache.maven.surefire.booter.ForkedBooter.main(ForkedBooter.java:495)

[INFO] 
[INFO] Results:
[INFO] 
[ERROR] Errors: 
[ERROR]   TestOMRatisSnapshots.testInstallSnapshotWithClientWrite:761->writeKeysToIncreaseLogIndex:1074 » OM Failed to commit key, as /volume72061/bucket64927/key58449/111539412210943122entry is not found in the OpenKey table
[INFO] 
[ERROR] Tests run: 455, Failures: 0, Errors: 1, Skipped: 10
[INFO] 
[INFO] 
[INFO] ------------------------------------------------------------------------
[INFO] Skipping Apache Ozone Mini Ozone Chaos Tests
[INFO] This project has been banned from the build due to previous failures.
[INFO] ------------------------------------------------------------------------
[INFO] ------------------------------------------------------------------------
[INFO] Reactor Summary for Apache Ozone Integration Tests 1.4.0-SNAPSHOT:
[INFO] 
[INFO] Apache Ozone Integration Tests ..................... FAILURE [  01:18 h]
[INFO] Apache Ozone Mini Ozone Chaos Tests ................ SKIPPED
[INFO] ------------------------------------------------------------------------
[INFO] BUILD FAILURE
[INFO] ------------------------------------------------------------------------
[INFO] Total time:  01:18 h
[INFO] Finished at: 2023-12-07T14:10:34Z
[INFO] ------------------------------------------------------------------------
[INFO] 11 goals, 11 executed
[INFO] 
[INFO] Publishing build scan...
[INFO] https://ge.apache.org/s/6rjsmfgqcan3i
[INFO] 
[ERROR] Failed to execute goal org.apache.maven.plugins:maven-surefire-plugin:3.2.2:test (default-test) on project ozone-integration-test: There was a timeout in the fork -> [Help 1]
[ERROR] 
[ERROR] To see the full stack trace of the errors, re-run Maven with the -e switch.
[ERROR] Re-run Maven using the -X switch to enable full debug logging.
[ERROR] 
[ERROR] For more information about the errors and possible solutions, please read the following articles:
[ERROR] [Help 1] http://cwiki.apache.org/confluence/display/MAVEN/MojoFailureException
