[INFO] Scanning for projects...
[INFO] ------------------------------------------------------------------------
[INFO] Detecting the operating system and CPU architecture
[INFO] ------------------------------------------------------------------------
[INFO] os.detected.name: linux
[INFO] os.detected.arch: x86_64
[INFO] os.detected.version: 5.15
[INFO] os.detected.version.major: 5
[INFO] os.detected.version.minor: 15
[INFO] os.detected.release: ubuntu
[INFO] os.detected.release.version: 20.04
[INFO] os.detected.release.like.ubuntu: true
[INFO] os.detected.release.like.debian: true
[INFO] os.detected.classifier: linux-x86_64
[INFO] ------------------------------------------------------------------------
[INFO] Reactor Build Order:
[INFO] 
[INFO] Apache Ozone Integration Tests                                     [jar]
[INFO] Apache Ozone Mini Ozone Chaos Tests                                [jar]
[INFO] 
[INFO] --------------< org.apache.ozone:ozone-integration-test >---------------
[INFO] Building Apache Ozone Integration Tests 1.4.0-SNAPSHOT             [1/2]
[INFO]   from pom.xml
[INFO] --------------------------------[ jar ]---------------------------------
[INFO] 
[INFO] --- maven-antrun-plugin:3.1.0:run (create-testdirs) @ ozone-integration-test ---
[INFO] Executing tasks
[INFO] Executed tasks
[INFO] 
[INFO] --- maven-enforcer-plugin:3.2.1:enforce (depcheck) @ ozone-integration-test ---
[INFO] Rule 0: org.apache.maven.enforcer.rules.dependency.DependencyConvergence passed
[INFO] Rule 1: org.apache.maven.enforcer.rules.version.RequireMavenVersion passed
[INFO] Rule 2: org.apache.maven.enforcer.rules.version.RequireJavaVersion passed
[INFO] 
[INFO] --- jacoco-maven-plugin:0.8.5:prepare-agent (default-prepare-agent) @ ozone-integration-test ---
[INFO] argLine set to -javaagent:/home/runner/.m2/repository/org/jacoco/org.jacoco.agent/0.8.5/org.jacoco.agent-0.8.5-runtime.jar=destfile=/home/runner/work/ozone/ozone/hadoop-ozone/integration-test/target/jacoco.exec,includes=org.apache.hadoop.hdds.*:org.apache.hadoop.ozone.*:org.apache.hadoop.fs.ozone.*
[INFO] 
[INFO] --- maven-enforcer-plugin:3.2.1:enforce (banned-rocksdb-imports) @ ozone-integration-test ---
[INFO] Rule 0: org.apache.maven.plugins.enforcer.RestrictImports passed
[INFO] Rule 1: org.apache.maven.plugins.enforcer.RestrictImports passed
[INFO] Rule 2: org.apache.maven.plugins.enforcer.RestrictImports passed
[INFO] 
[INFO] --- maven-remote-resources-plugin:1.5:process (default) @ ozone-integration-test ---
[INFO] 
[INFO] --- maven-resources-plugin:3.1.0:resources (default-resources) @ ozone-integration-test ---
[INFO] Using 'UTF-8' encoding to copy filtered resources.
[INFO] skip non existing resourceDirectory /home/runner/work/ozone/ozone/hadoop-ozone/integration-test/src/main/resources
[INFO] Copying 2 resources
[INFO] 
[INFO] --- maven-compiler-plugin:3.1:compile (default-compile) @ ozone-integration-test ---
[INFO] No sources to compile
[INFO] 
[INFO] --- maven-resources-plugin:3.1.0:testResources (default-testResources) @ ozone-integration-test ---
[INFO] Using 'UTF-8' encoding to copy filtered resources.
[INFO] Copying 22 resources
[INFO] Copying 2 resources
[INFO] 
[INFO] --- maven-compiler-plugin:3.1:testCompile (default-testCompile) @ ozone-integration-test ---
[INFO] Compiling 17 source files to /home/runner/work/ozone/ozone/hadoop-ozone/integration-test/target/test-classes
[INFO] 
[INFO] --- maven-surefire-plugin:3.0.0-M5:test (default-test) @ ozone-integration-test ---
[INFO] 
[INFO] -------------------------------------------------------
[INFO]  T E S T S
[INFO] -------------------------------------------------------
[INFO] Running org.apache.hadoop.ozone.client.rpc.TestOzoneRpcClientWithKeyLatestVersion
[INFO] Tests run: 2, Failures: 0, Errors: 0, Skipped: 0, Time elapsed: 29.813 s - in org.apache.hadoop.ozone.client.rpc.TestOzoneRpcClientWithKeyLatestVersion
[INFO] Running org.apache.hadoop.ozone.client.rpc.TestECKeyOutputStream
[INFO] Tests run: 13, Failures: 0, Errors: 0, Skipped: 0, Time elapsed: 84.937 s - in org.apache.hadoop.ozone.client.rpc.TestECKeyOutputStream
[INFO] Running org.apache.hadoop.ozone.client.rpc.TestBlockOutputStreamWithFailures
[INFO] Tests run: 5, Failures: 0, Errors: 0, Skipped: 0, Time elapsed: 274.847 s - in org.apache.hadoop.ozone.client.rpc.TestBlockOutputStreamWithFailures
[INFO] Running org.apache.hadoop.ozone.client.rpc.TestOzoneRpcClient
[INFO] Tests run: 120, Failures: 0, Errors: 0, Skipped: 0, Time elapsed: 89.991 s - in org.apache.hadoop.ozone.client.rpc.TestOzoneRpcClient
[INFO] Running org.apache.hadoop.ozone.client.rpc.TestContainerStateMachine
[INFO] Tests run: 2, Failures: 0, Errors: 0, Skipped: 0, Time elapsed: 79.714 s - in org.apache.hadoop.ozone.client.rpc.TestContainerStateMachine
[INFO] Running org.apache.hadoop.ozone.client.rpc.TestOzoneClientRetriesOnExceptions
[INFO] Tests run: 2, Failures: 0, Errors: 0, Skipped: 0, Time elapsed: 76.689 s - in org.apache.hadoop.ozone.client.rpc.TestOzoneClientRetriesOnExceptions
[INFO] Running org.apache.hadoop.ozone.client.rpc.TestBlockDataStreamOutput
[INFO] Tests run: 7, Failures: 0, Errors: 0, Skipped: 0, Time elapsed: 46.889 s - in org.apache.hadoop.ozone.client.rpc.TestBlockDataStreamOutput
[INFO] Running org.apache.hadoop.ozone.client.rpc.TestContainerStateMachineStream
[INFO] Tests run: 2, Failures: 0, Errors: 0, Skipped: 0, Time elapsed: 47.436 s - in org.apache.hadoop.ozone.client.rpc.TestContainerStateMachineStream
[INFO] Running org.apache.hadoop.ozone.client.rpc.Test2WayCommitInRatis
[INFO] Tests run: 1, Failures: 0, Errors: 0, Skipped: 0, Time elapsed: 40.578 s - in org.apache.hadoop.ozone.client.rpc.Test2WayCommitInRatis
[INFO] Running org.apache.hadoop.ozone.client.rpc.TestContainerReplicationEndToEnd
[INFO] Tests run: 1, Failures: 0, Errors: 0, Skipped: 0, Time elapsed: 84.074 s - in org.apache.hadoop.ozone.client.rpc.TestContainerReplicationEndToEnd
[INFO] Running org.apache.hadoop.ozone.client.rpc.TestBCSID
[INFO] Tests run: 1, Failures: 0, Errors: 0, Skipped: 0, Time elapsed: 42.065 s - in org.apache.hadoop.ozone.client.rpc.TestBCSID
[INFO] Running org.apache.hadoop.ozone.client.rpc.TestSecureOzoneRpcClient
[INFO] Tests run: 123, Failures: 0, Errors: 0, Skipped: 0, Time elapsed: 88.204 s - in org.apache.hadoop.ozone.client.rpc.TestSecureOzoneRpcClient
[INFO] Running org.apache.hadoop.ozone.client.rpc.TestValidateBCSIDOnRestart
[INFO] Tests run: 1, Failures: 0, Errors: 0, Skipped: 0, Time elapsed: 51.83 s - in org.apache.hadoop.ozone.client.rpc.TestValidateBCSIDOnRestart
[INFO] Running org.apache.hadoop.ozone.client.rpc.TestContainerStateMachineFailureOnRead
[INFO] Tests run: 1, Failures: 0, Errors: 0, Skipped: 0, Time elapsed: 43.543 s - in org.apache.hadoop.ozone.client.rpc.TestContainerStateMachineFailureOnRead
[INFO] Running org.apache.hadoop.ozone.client.rpc.TestOzoneClientMultipartUploadWithFSO
[INFO] Tests run: 24, Failures: 0, Errors: 0, Skipped: 0, Time elapsed: 32.674 s - in org.apache.hadoop.ozone.client.rpc.TestOzoneClientMultipartUploadWithFSO
[INFO] Running org.apache.hadoop.ozone.client.rpc.TestContainerStateMachineFlushDelay
[INFO] Tests run: 1, Failures: 0, Errors: 0, Skipped: 0, Time elapsed: 49.914 s - in org.apache.hadoop.ozone.client.rpc.TestContainerStateMachineFlushDelay
[INFO] Running org.apache.hadoop.ozone.client.rpc.TestDeleteWithInAdequateDN
[INFO] Tests run: 1, Failures: 0, Errors: 0, Skipped: 0, Time elapsed: 54.615 s - in org.apache.hadoop.ozone.client.rpc.TestDeleteWithInAdequateDN
[INFO] Running org.apache.hadoop.ozone.client.rpc.TestBlockOutputStreamWithFailuresFlushDelay
[INFO] Tests run: 3, Failures: 0, Errors: 0, Skipped: 0, Time elapsed: 185.794 s - in org.apache.hadoop.ozone.client.rpc.TestBlockOutputStreamWithFailuresFlushDelay
[INFO] Running org.apache.hadoop.ozone.client.rpc.TestOzoneRpcClientWithRatis
[INFO] Tests run: 123, Failures: 0, Errors: 0, Skipped: 0, Time elapsed: 93.533 s - in org.apache.hadoop.ozone.client.rpc.TestOzoneRpcClientWithRatis
[INFO] Running org.apache.hadoop.ozone.client.rpc.TestFailureHandlingByClientFlushDelay
[INFO] Tests run: 1, Failures: 0, Errors: 0, Skipped: 0, Time elapsed: 66.818 s - in org.apache.hadoop.ozone.client.rpc.TestFailureHandlingByClientFlushDelay
[INFO] Running org.apache.hadoop.ozone.client.rpc.TestBlockOutputStream
[INFO] Tests run: 3, Failures: 0, Errors: 0, Skipped: 0, Time elapsed: 30.26 s - in org.apache.hadoop.ozone.client.rpc.TestBlockOutputStream
[INFO] Running org.apache.hadoop.ozone.client.rpc.TestReadRetries
[INFO] Tests run: 2, Failures: 0, Errors: 0, Skipped: 0, Time elapsed: 58.942 s - in org.apache.hadoop.ozone.client.rpc.TestReadRetries
[INFO] Running org.apache.hadoop.ozone.client.rpc.TestOzoneAtRestEncryption
[ERROR] Tests run: 22, Failures: 0, Errors: 1, Skipped: 0, Time elapsed: 66.549 s <<< FAILURE! - in org.apache.hadoop.ozone.client.rpc.TestOzoneAtRestEncryption
[ERROR] org.apache.hadoop.ozone.client.rpc.TestOzoneAtRestEncryption.testPutKeyWithEncryption(BucketLayout)[1]  Time elapsed: 2.697 s  <<< ERROR!
org.apache.hadoop.hdds.scm.container.common.helpers.StorageContainerException: Unable to find the block with bcsID 3 .Container 2 bcsId is 1.
	at org.apache.hadoop.hdds.scm.storage.ContainerProtocolCalls.validateContainerResponse(ContainerProtocolCalls.java:674)
	at org.apache.hadoop.hdds.scm.storage.ContainerProtocolCalls.lambda$createValidators$4(ContainerProtocolCalls.java:685)
	at org.apache.hadoop.hdds.scm.XceiverClientGrpc.sendCommandWithRetry(XceiverClientGrpc.java:407)
	at org.apache.hadoop.hdds.scm.XceiverClientGrpc.lambda$sendCommandWithTraceIDAndRetry$0(XceiverClientGrpc.java:347)
	at org.apache.hadoop.hdds.tracing.TracingUtil.executeInSpan(TracingUtil.java:169)
	at org.apache.hadoop.hdds.tracing.TracingUtil.executeInNewSpan(TracingUtil.java:149)
	at org.apache.hadoop.hdds.scm.XceiverClientGrpc.sendCommandWithTraceIDAndRetry(XceiverClientGrpc.java:342)
	at org.apache.hadoop.hdds.scm.XceiverClientGrpc.sendCommand(XceiverClientGrpc.java:323)
	at org.apache.hadoop.hdds.scm.storage.ContainerProtocolCalls.getBlock(ContainerProtocolCalls.java:208)
	at org.apache.hadoop.hdds.scm.storage.ContainerProtocolCalls.lambda$getBlock$0(ContainerProtocolCalls.java:186)
	at org.apache.hadoop.hdds.scm.storage.ContainerProtocolCalls.tryEachDatanode(ContainerProtocolCalls.java:146)
	at org.apache.hadoop.hdds.scm.storage.ContainerProtocolCalls.getBlock(ContainerProtocolCalls.java:185)
	at org.apache.hadoop.hdds.scm.storage.BlockInputStream.getChunkInfos(BlockInputStream.java:255)
	at org.apache.hadoop.hdds.scm.storage.BlockInputStream.initialize(BlockInputStream.java:146)
	at org.apache.hadoop.hdds.scm.storage.BlockInputStream.readWithStrategy(BlockInputStream.java:308)
	at org.apache.hadoop.hdds.scm.storage.ExtendedInputStream.read(ExtendedInputStream.java:66)
	at org.apache.hadoop.hdds.scm.storage.ByteBufferReader.readFromBlock(ByteBufferReader.java:56)
	at org.apache.hadoop.hdds.scm.storage.MultipartInputStream.readWithStrategy(MultipartInputStream.java:96)
	at org.apache.hadoop.hdds.scm.storage.ExtendedInputStream.read(ExtendedInputStream.java:66)
	at org.apache.hadoop.crypto.CryptoInputStream.read(CryptoInputStream.java:189)
	at org.apache.hadoop.ozone.client.io.OzoneInputStream.read(OzoneInputStream.java:56)
	at java.io.InputStream.read(InputStream.java:101)
	at org.apache.hadoop.ozone.client.rpc.TestOzoneAtRestEncryption.verifyKeyData(TestOzoneAtRestEncryption.java:269)
	at org.apache.hadoop.ozone.client.rpc.TestOzoneAtRestEncryption.createAndVerifyStreamKeyData(TestOzoneAtRestEncryption.java:238)
	at org.apache.hadoop.ozone.client.rpc.TestOzoneAtRestEncryption.testPutKeyWithEncryption(TestOzoneAtRestEncryption.java:205)
	at sun.reflect.NativeMethodAccessorImpl.invoke0(Native Method)
	at sun.reflect.NativeMethodAccessorImpl.invoke(NativeMethodAccessorImpl.java:62)
	at sun.reflect.DelegatingMethodAccessorImpl.invoke(DelegatingMethodAccessorImpl.java:43)
	at java.lang.reflect.Method.invoke(Method.java:498)
	at org.junit.platform.commons.util.ReflectionUtils.invokeMethod(ReflectionUtils.java:725)
	at org.junit.jupiter.engine.execution.MethodInvocation.proceed(MethodInvocation.java:60)
	at org.junit.jupiter.engine.execution.InvocationInterceptorChain$ValidatingInvocation.proceed(InvocationInterceptorChain.java:131)
	at org.junit.jupiter.engine.extension.TimeoutExtension.intercept(TimeoutExtension.java:149)
	at org.junit.jupiter.engine.extension.TimeoutExtension.interceptTestableMethod(TimeoutExtension.java:140)
	at org.junit.jupiter.engine.extension.TimeoutExtension.interceptTestTemplateMethod(TimeoutExtension.java:92)
	at org.junit.jupiter.engine.execution.ExecutableInvoker$ReflectiveInterceptorCall.lambda$ofVoidMethod$0(ExecutableInvoker.java:115)
	at org.junit.jupiter.engine.execution.ExecutableInvoker.lambda$invoke$0(ExecutableInvoker.java:105)
	at org.junit.jupiter.engine.execution.InvocationInterceptorChain$InterceptedInvocation.proceed(InvocationInterceptorChain.java:106)
	at org.junit.jupiter.engine.execution.InvocationInterceptorChain.proceed(InvocationInterceptorChain.java:64)
	at org.junit.jupiter.engine.execution.InvocationInterceptorChain.chainAndInvoke(InvocationInterceptorChain.java:45)
	at org.junit.jupiter.engine.execution.InvocationInterceptorChain.invoke(InvocationInterceptorChain.java:37)
	at org.junit.jupiter.engine.execution.ExecutableInvoker.invoke(ExecutableInvoker.java:104)
	at org.junit.jupiter.engine.execution.ExecutableInvoker.invoke(ExecutableInvoker.java:98)
	at org.junit.jupiter.engine.descriptor.TestMethodTestDescriptor.lambda$invokeTestMethod$7(TestMethodTestDescriptor.java:214)
	at org.junit.platform.engine.support.hierarchical.ThrowableCollector.execute(ThrowableCollector.java:73)
	at org.junit.jupiter.engine.descriptor.TestMethodTestDescriptor.invokeTestMethod(TestMethodTestDescriptor.java:210)
	at org.junit.jupiter.engine.descriptor.TestMethodTestDescriptor.execute(TestMethodTestDescriptor.java:135)
	at org.junit.jupiter.engine.descriptor.TestMethodTestDescriptor.execute(TestMethodTestDescriptor.java:66)
	at org.junit.platform.engine.support.hierarchical.NodeTestTask.lambda$executeRecursively$6(NodeTestTask.java:151)
	at org.junit.platform.engine.support.hierarchical.ThrowableCollector.execute(ThrowableCollector.java:73)
	at org.junit.platform.engine.support.hierarchical.NodeTestTask.lambda$executeRecursively$8(NodeTestTask.java:141)
	at org.junit.platform.engine.support.hierarchical.Node.around(Node.java:137)
	at org.junit.platform.engine.support.hierarchical.NodeTestTask.lambda$executeRecursively$9(NodeTestTask.java:139)
	at org.junit.platform.engine.support.hierarchical.ThrowableCollector.execute(ThrowableCollector.java:73)
	at org.junit.platform.engine.support.hierarchical.NodeTestTask.executeRecursively(NodeTestTask.java:138)
	at org.junit.platform.engine.support.hierarchical.NodeTestTask.execute(NodeTestTask.java:95)
	at org.junit.platform.engine.support.hierarchical.SameThreadHierarchicalTestExecutorService.submit(SameThreadHierarchicalTestExecutorService.java:35)
	at org.junit.platform.engine.support.hierarchical.NodeTestTask$DefaultDynamicTestExecutor.execute(NodeTestTask.java:226)
	at org.junit.platform.engine.support.hierarchical.NodeTestTask$DefaultDynamicTestExecutor.execute(NodeTestTask.java:204)
	at org.junit.jupiter.engine.descriptor.TestTemplateTestDescriptor.execute(TestTemplateTestDescriptor.java:139)
	at org.junit.jupiter.engine.descriptor.TestTemplateTestDescriptor.lambda$execute$2(TestTemplateTestDescriptor.java:107)
	at java.util.stream.ForEachOps$ForEachOp$OfRef.accept(ForEachOps.java:183)
	at java.util.stream.ReferencePipeline$3$1.accept(ReferencePipeline.java:193)
	at java.util.stream.ReferencePipeline$2$1.accept(ReferencePipeline.java:175)
	at java.util.stream.ReferencePipeline$3$1.accept(ReferencePipeline.java:193)
	at java.util.stream.ForEachOps$ForEachOp$OfRef.accept(ForEachOps.java:183)
	at java.util.stream.ReferencePipeline$3$1.accept(ReferencePipeline.java:193)
	at java.util.stream.ReferencePipeline$3$1.accept(ReferencePipeline.java:193)
	at java.util.stream.ReferencePipeline$3$1.accept(ReferencePipeline.java:193)
	at java.util.stream.ForEachOps$ForEachOp$OfRef.accept(ForEachOps.java:183)
	at java.util.stream.ReferencePipeline$3$1.accept(ReferencePipeline.java:193)
	at java.util.Iterator.forEachRemaining(Iterator.java:116)
	at java.util.Spliterators$IteratorSpliterator.forEachRemaining(Spliterators.java:1801)
	at java.util.stream.AbstractPipeline.copyInto(AbstractPipeline.java:482)
	at java.util.stream.AbstractPipeline.wrapAndCopyInto(AbstractPipeline.java:472)
	at java.util.stream.ForEachOps$ForEachOp.evaluateSequential(ForEachOps.java:150)
	at java.util.stream.ForEachOps$ForEachOp$OfRef.evaluateSequential(ForEachOps.java:173)
	at java.util.stream.AbstractPipeline.evaluate(AbstractPipeline.java:234)
	at java.util.stream.ReferencePipeline.forEach(ReferencePipeline.java:485)
	at java.util.stream.ReferencePipeline$7$1.accept(ReferencePipeline.java:272)
	at java.util.stream.ReferencePipeline$3$1.accept(ReferencePipeline.java:193)
	at java.util.stream.ReferencePipeline$3$1.accept(ReferencePipeline.java:193)
	at java.util.stream.ReferencePipeline$3$1.accept(ReferencePipeline.java:193)
	at java.util.ArrayList$ArrayListSpliterator.forEachRemaining(ArrayList.java:1384)
	at java.util.stream.AbstractPipeline.copyInto(AbstractPipeline.java:482)
	at java.util.stream.AbstractPipeline.wrapAndCopyInto(AbstractPipeline.java:472)
	at java.util.stream.ForEachOps$ForEachOp.evaluateSequential(ForEachOps.java:150)
	at java.util.stream.ForEachOps$ForEachOp$OfRef.evaluateSequential(ForEachOps.java:173)
	at java.util.stream.AbstractPipeline.evaluate(AbstractPipeline.java:234)
	at java.util.stream.ReferencePipeline.forEach(ReferencePipeline.java:485)
	at java.util.stream.ReferencePipeline$7$1.accept(ReferencePipeline.java:272)
	at java.util.ArrayList$ArrayListSpliterator.forEachRemaining(ArrayList.java:1384)
	at java.util.stream.AbstractPipeline.copyInto(AbstractPipeline.java:482)
	at java.util.stream.AbstractPipeline.wrapAndCopyInto(AbstractPipeline.java:472)
	at java.util.stream.ForEachOps$ForEachOp.evaluateSequential(ForEachOps.java:150)
	at java.util.stream.ForEachOps$ForEachOp$OfRef.evaluateSequential(ForEachOps.java:173)
	at java.util.stream.AbstractPipeline.evaluate(AbstractPipeline.java:234)
	at java.util.stream.ReferencePipeline.forEach(ReferencePipeline.java:485)
	at org.junit.jupiter.engine.descriptor.TestTemplateTestDescriptor.execute(TestTemplateTestDescriptor.java:107)
	at org.junit.jupiter.engine.descriptor.TestTemplateTestDescriptor.execute(TestTemplateTestDescriptor.java:42)
	at org.junit.platform.engine.support.hierarchical.NodeTestTask.lambda$executeRecursively$6(NodeTestTask.java:151)
	at org.junit.platform.engine.support.hierarchical.ThrowableCollector.execute(ThrowableCollector.java:73)
	at org.junit.platform.engine.support.hierarchical.NodeTestTask.lambda$executeRecursively$8(NodeTestTask.java:141)
	at org.junit.platform.engine.support.hierarchical.Node.around(Node.java:137)
	at org.junit.platform.engine.support.hierarchical.NodeTestTask.lambda$executeRecursively$9(NodeTestTask.java:139)
	at org.junit.platform.engine.support.hierarchical.ThrowableCollector.execute(ThrowableCollector.java:73)
	at org.junit.platform.engine.support.hierarchical.NodeTestTask.executeRecursively(NodeTestTask.java:138)
	at org.junit.platform.engine.support.hierarchical.NodeTestTask.execute(NodeTestTask.java:95)
	at java.util.ArrayList.forEach(ArrayList.java:1259)
	at org.junit.platform.engine.support.hierarchical.SameThreadHierarchicalTestExecutorService.invokeAll(SameThreadHierarchicalTestExecutorService.java:41)
	at org.junit.platform.engine.support.hierarchical.NodeTestTask.lambda$executeRecursively$6(NodeTestTask.java:155)
	at org.junit.platform.engine.support.hierarchical.ThrowableCollector.execute(ThrowableCollector.java:73)
	at org.junit.platform.engine.support.hierarchical.NodeTestTask.lambda$executeRecursively$8(NodeTestTask.java:141)
	at org.junit.platform.engine.support.hierarchical.Node.around(Node.java:137)
	at org.junit.platform.engine.support.hierarchical.NodeTestTask.lambda$executeRecursively$9(NodeTestTask.java:139)
	at org.junit.platform.engine.support.hierarchical.ThrowableCollector.execute(ThrowableCollector.java:73)
	at org.junit.platform.engine.support.hierarchical.NodeTestTask.executeRecursively(NodeTestTask.java:138)
	at org.junit.platform.engine.support.hierarchical.NodeTestTask.execute(NodeTestTask.java:95)
	at java.util.ArrayList.forEach(ArrayList.java:1259)
	at org.junit.platform.engine.support.hierarchical.SameThreadHierarchicalTestExecutorService.invokeAll(SameThreadHierarchicalTestExecutorService.java:41)
	at org.junit.platform.engine.support.hierarchical.NodeTestTask.lambda$executeRecursively$6(NodeTestTask.java:155)
	at org.junit.platform.engine.support.hierarchical.ThrowableCollector.execute(ThrowableCollector.java:73)
	at org.junit.platform.engine.support.hierarchical.NodeTestTask.lambda$executeRecursively$8(NodeTestTask.java:141)
	at org.junit.platform.engine.support.hierarchical.Node.around(Node.java:137)
	at org.junit.platform.engine.support.hierarchical.NodeTestTask.lambda$executeRecursively$9(NodeTestTask.java:139)
	at org.junit.platform.engine.support.hierarchical.ThrowableCollector.execute(ThrowableCollector.java:73)
	at org.junit.platform.engine.support.hierarchical.NodeTestTask.executeRecursively(NodeTestTask.java:138)
	at org.junit.platform.engine.support.hierarchical.NodeTestTask.execute(NodeTestTask.java:95)
	at org.junit.platform.engine.support.hierarchical.SameThreadHierarchicalTestExecutorService.submit(SameThreadHierarchicalTestExecutorService.java:35)
	at org.junit.platform.engine.support.hierarchical.HierarchicalTestExecutor.execute(HierarchicalTestExecutor.java:57)
	at org.junit.platform.engine.support.hierarchical.HierarchicalTestEngine.execute(HierarchicalTestEngine.java:54)
	at org.junit.platform.launcher.core.EngineExecutionOrchestrator.execute(EngineExecutionOrchestrator.java:107)
	at org.junit.platform.launcher.core.EngineExecutionOrchestrator.execute(EngineExecutionOrchestrator.java:88)
	at org.junit.platform.launcher.core.EngineExecutionOrchestrator.lambda$execute$0(EngineExecutionOrchestrator.java:54)
	at org.junit.platform.launcher.core.EngineExecutionOrchestrator.withInterceptedStreams(EngineExecutionOrchestrator.java:67)
	at org.junit.platform.launcher.core.EngineExecutionOrchestrator.execute(EngineExecutionOrchestrator.java:52)
	at org.junit.platform.launcher.core.DefaultLauncher.execute(DefaultLauncher.java:114)
	at org.junit.platform.launcher.core.DefaultLauncher.execute(DefaultLauncher.java:86)
	at org.junit.platform.launcher.core.DefaultLauncherSession$DelegatingLauncher.execute(DefaultLauncherSession.java:86)
	at org.junit.platform.launcher.core.SessionPerRequestLauncher.execute(SessionPerRequestLauncher.java:53)
	at org.apache.maven.surefire.junitplatform.JUnitPlatformProvider.execute(JUnitPlatformProvider.java:188)
	at org.apache.maven.surefire.junitplatform.JUnitPlatformProvider.invokeAllTests(JUnitPlatformProvider.java:154)
	at org.apache.maven.surefire.junitplatform.JUnitPlatformProvider.invoke(JUnitPlatformProvider.java:124)
	at org.apache.maven.surefire.booter.ForkedBooter.runSuitesInProcess(ForkedBooter.java:428)
	at org.apache.maven.surefire.booter.ForkedBooter.execute(ForkedBooter.java:162)
	at org.apache.maven.surefire.booter.ForkedBooter.run(ForkedBooter.java:562)
	at org.apache.maven.surefire.booter.ForkedBooter.main(ForkedBooter.java:548)

[INFO] Running org.apache.hadoop.ozone.client.rpc.TestFailureHandlingByClient
[INFO] Tests run: 5, Failures: 0, Errors: 0, Skipped: 0, Time elapsed: 296.734 s - in org.apache.hadoop.ozone.client.rpc.TestFailureHandlingByClient
[INFO] Running org.apache.hadoop.ozone.client.rpc.TestCloseContainerHandlingByClient
[INFO] Tests run: 7, Failures: 0, Errors: 0, Skipped: 0, Time elapsed: 60.31 s - in org.apache.hadoop.ozone.client.rpc.TestCloseContainerHandlingByClient
[INFO] Running org.apache.hadoop.ozone.client.rpc.TestHybridPipelineOnDatanode
[INFO] Tests run: 1, Failures: 0, Errors: 0, Skipped: 0, Time elapsed: 29.498 s - in org.apache.hadoop.ozone.client.rpc.TestHybridPipelineOnDatanode
[INFO] Running org.apache.hadoop.ozone.client.rpc.TestOzoneClientRetriesOnExceptionFlushDelay
[INFO] Tests run: 1, Failures: 0, Errors: 0, Skipped: 0, Time elapsed: 38.037 s - in org.apache.hadoop.ozone.client.rpc.TestOzoneClientRetriesOnExceptionFlushDelay
[INFO] Running org.apache.hadoop.ozone.client.rpc.TestDiscardPreallocatedBlocks
[INFO] Tests run: 1, Failures: 0, Errors: 0, Skipped: 0, Time elapsed: 33.738 s - in org.apache.hadoop.ozone.client.rpc.TestDiscardPreallocatedBlocks
[INFO] Running org.apache.hadoop.ozone.client.rpc.read.TestChunkInputStream
[INFO] Tests run: 2, Failures: 0, Errors: 0, Skipped: 0, Time elapsed: 51.13 s - in org.apache.hadoop.ozone.client.rpc.read.TestChunkInputStream
[INFO] Running org.apache.hadoop.ozone.client.rpc.read.TestKeyInputStream
[INFO] Tests run: 6, Failures: 0, Errors: 0, Skipped: 0, Time elapsed: 237.478 s - in org.apache.hadoop.ozone.client.rpc.read.TestKeyInputStream
[INFO] Running org.apache.hadoop.ozone.client.rpc.TestBlockOutputStreamFlushDelay
[INFO] Tests run: 3, Failures: 0, Errors: 0, Skipped: 0, Time elapsed: 30.333 s - in org.apache.hadoop.ozone.client.rpc.TestBlockOutputStreamFlushDelay
[INFO] Running org.apache.hadoop.ozone.client.rpc.TestMultiBlockWritesWithDnFailures
[INFO] Tests run: 2, Failures: 0, Errors: 0, Skipped: 0, Time elapsed: 177.279 s - in org.apache.hadoop.ozone.client.rpc.TestMultiBlockWritesWithDnFailures
[INFO] Running org.apache.hadoop.ozone.client.rpc.TestContainerStateMachineFailures
[INFO] Tests run: 6, Failures: 0, Errors: 0, Skipped: 0, Time elapsed: 103.348 s - in org.apache.hadoop.ozone.client.rpc.TestContainerStateMachineFailures
[INFO] Running org.apache.hadoop.ozone.client.TestOzoneClientFactory
[INFO] Tests run: 1, Failures: 0, Errors: 0, Skipped: 0, Time elapsed: 10.621 s - in org.apache.hadoop.ozone.client.TestOzoneClientFactory
[INFO] 
[INFO] Results:
[INFO] 
[ERROR] Errors: 
[ERROR]   TestOzoneAtRestEncryption.testPutKeyWithEncryption:205->createAndVerifyStreamKeyData:238->verifyKeyData:269 » StorageContainer
[INFO] 
[ERROR] Tests run: 496, Failures: 0, Errors: 1, Skipped: 0
[INFO] 
[INFO] 
[INFO] ------------------------------------------------------------------------
[INFO] Skipping Apache Ozone Mini Ozone Chaos Tests
[INFO] This project has been banned from the build due to previous failures.
[INFO] ------------------------------------------------------------------------
[INFO] ------------------------------------------------------------------------
[INFO] Reactor Summary for Apache Ozone Integration Tests 1.4.0-SNAPSHOT:
[INFO] 
[INFO] Apache Ozone Integration Tests ..................... FAILURE [47:29 min]
[INFO] Apache Ozone Mini Ozone Chaos Tests ................ SKIPPED
[INFO] ------------------------------------------------------------------------
[INFO] BUILD FAILURE
[INFO] ------------------------------------------------------------------------
[INFO] Total time:  47:30 min
[INFO] Finished at: 2023-10-17T19:13:27Z
[INFO] ------------------------------------------------------------------------
[ERROR] Failed to execute goal org.apache.maven.plugins:maven-surefire-plugin:3.0.0-M5:test (default-test) on project ozone-integration-test: There are test failures.
[ERROR] 
[ERROR] Please refer to /home/runner/work/ozone/ozone/hadoop-ozone/integration-test/target/surefire-reports for the individual test results.
[ERROR] Please refer to dump files (if any exist) [date].dump, [date]-jvmRun[N].dump and [date].dumpstream.
[ERROR] -> [Help 1]
[ERROR] 
[ERROR] To see the full stack trace of the errors, re-run Maven with the -e switch.
[ERROR] Re-run Maven using the -X switch to enable full debug logging.
[ERROR] 
[ERROR] For more information about the errors and possible solutions, please read the following articles:
[ERROR] [Help 1] http://cwiki.apache.org/confluence/display/MAVEN/MojoFailureException
