[INFO] Scanning for projects...
[INFO] ------------------------------------------------------------------------
[INFO] Detecting the operating system and CPU architecture
[INFO] ------------------------------------------------------------------------
[INFO] os.detected.name: linux
[INFO] os.detected.arch: x86_64
[INFO] os.detected.version: 5.15
[INFO] os.detected.version.major: 5
[INFO] os.detected.version.minor: 15
[INFO] os.detected.release: ubuntu
[INFO] os.detected.release.version: 20.04
[INFO] os.detected.release.like.ubuntu: true
[INFO] os.detected.release.like.debian: true
[INFO] os.detected.classifier: linux-x86_64
[INFO] ------------------------------------------------------------------------
[INFO] Reactor Build Order:
[INFO] 
[INFO] Apache Ozone Integration Tests                                     [jar]
[INFO] Apache Ozone Mini Ozone Chaos Tests                                [jar]
[INFO] 
[INFO] --------------< org.apache.ozone:ozone-integration-test >---------------
[INFO] Building Apache Ozone Integration Tests 1.4.0-SNAPSHOT             [1/2]
[INFO]   from pom.xml
[INFO] --------------------------------[ jar ]---------------------------------
[INFO] 
[INFO] --- maven-antrun-plugin:3.1.0:run (create-testdirs) @ ozone-integration-test ---
[INFO] Executing tasks
[INFO]     [mkdir] Created dir: /home/runner/work/ozone/ozone/hadoop-ozone/integration-test/target/test-dir
[INFO] Executed tasks
[INFO] 
[INFO] --- maven-enforcer-plugin:3.2.1:enforce (depcheck) @ ozone-integration-test ---
[INFO] Rule 0: org.apache.maven.enforcer.rules.dependency.DependencyConvergence passed
[INFO] Rule 1: org.apache.maven.enforcer.rules.version.RequireMavenVersion passed
[INFO] Rule 2: org.apache.maven.enforcer.rules.version.RequireJavaVersion passed
[INFO] 
[INFO] --- jacoco-maven-plugin:0.8.5:prepare-agent (default-prepare-agent) @ ozone-integration-test ---
[INFO] argLine set to -javaagent:/home/runner/.m2/repository/org/jacoco/org.jacoco.agent/0.8.5/org.jacoco.agent-0.8.5-runtime.jar=destfile=/home/runner/work/ozone/ozone/hadoop-ozone/integration-test/target/jacoco.exec,includes=org.apache.hadoop.hdds.*:org.apache.hadoop.ozone.*:org.apache.hadoop.fs.ozone.*
[INFO] 
[INFO] --- maven-enforcer-plugin:3.2.1:enforce (banned-rocksdb-imports) @ ozone-integration-test ---
[INFO] Rule 0: org.apache.maven.plugins.enforcer.RestrictImports passed
[INFO] Rule 1: org.apache.maven.plugins.enforcer.RestrictImports passed
[INFO] Rule 2: org.apache.maven.plugins.enforcer.RestrictImports passed
[INFO] 
[INFO] --- maven-enforcer-plugin:3.2.1:enforce (ban-junit4-imports) @ ozone-integration-test ---
[INFO] Skipping Rule Enforcement.
[INFO] 
[INFO] --- maven-remote-resources-plugin:1.5:process (default) @ ozone-integration-test ---
[INFO] 
[INFO] --- maven-resources-plugin:3.1.0:resources (default-resources) @ ozone-integration-test ---
[INFO] Using 'UTF-8' encoding to copy filtered resources.
[INFO] skip non existing resourceDirectory /home/runner/work/ozone/ozone/hadoop-ozone/integration-test/src/main/resources
[INFO] Copying 2 resources
[INFO] 
[INFO] --- maven-compiler-plugin:3.1:compile (default-compile) @ ozone-integration-test ---
[INFO] No sources to compile
[INFO] 
[INFO] --- maven-resources-plugin:3.1.0:testResources (default-testResources) @ ozone-integration-test ---
[INFO] Using 'UTF-8' encoding to copy filtered resources.
[INFO] Copying 22 resources
[INFO] Copying 2 resources
[INFO] 
[INFO] --- maven-compiler-plugin:3.1:testCompile (default-testCompile) @ ozone-integration-test ---
[INFO] Compiling 292 source files to /home/runner/work/ozone/ozone/hadoop-ozone/integration-test/target/test-classes
[WARNING] /home/runner/work/ozone/ozone/hadoop-ozone/integration-test/src/test/java/org/apache/hadoop/ozone/TestBlockTokens.java: Some input files use or override a deprecated API.
[WARNING] /home/runner/work/ozone/ozone/hadoop-ozone/integration-test/src/test/java/org/apache/hadoop/ozone/TestBlockTokens.java: Recompile with -Xlint:deprecation for details.
[WARNING] /home/runner/work/ozone/ozone/hadoop-ozone/integration-test/src/test/java/org/apache/hadoop/ozone/om/ratis/TestOzoneManagerRatisRequest.java: Some input files use unchecked or unsafe operations.
[WARNING] /home/runner/work/ozone/ozone/hadoop-ozone/integration-test/src/test/java/org/apache/hadoop/ozone/om/ratis/TestOzoneManagerRatisRequest.java: Recompile with -Xlint:unchecked for details.
[INFO] 
[INFO] --- maven-surefire-plugin:3.2.2:test (default-test) @ ozone-integration-test ---
[INFO] Using auto detected provider org.apache.maven.surefire.junitplatform.JUnitPlatformProvider
[INFO] Using auto detected provider org.apache.maven.surefire.junitplatform.JUnitPlatformProvider
[INFO] 
[INFO] -------------------------------------------------------
[INFO]  T E S T S
[INFO] -------------------------------------------------------
[INFO] Running org.apache.hadoop.fs.ozone.TestOzoneFsHAURLs
[INFO] Tests run: 3, Failures: 0, Errors: 0, Skipped: 0, Time elapsed: 29.81 s -- in org.apache.hadoop.fs.ozone.TestOzoneFsHAURLs
[INFO] Running org.apache.hadoop.fs.ozone.TestOzoneFileSystemMissingParent
[INFO] Tests run: 2, Failures: 0, Errors: 0, Skipped: 0, Time elapsed: 23.12 s -- in org.apache.hadoop.fs.ozone.TestOzoneFileSystemMissingParent
[INFO] Running org.apache.hadoop.fs.ozone.TestSafeMode
[INFO] Tests run: 2, Failures: 0, Errors: 0, Skipped: 0, Time elapsed: 44.71 s -- in org.apache.hadoop.fs.ozone.TestSafeMode
[INFO] Running org.apache.hadoop.fs.ozone.TestRootedDDSWithFSO
[INFO] Tests run: 1, Failures: 0, Errors: 0, Skipped: 0, Time elapsed: 25.37 s -- in org.apache.hadoop.fs.ozone.TestRootedDDSWithFSO
[INFO] Running org.apache.hadoop.fs.ozone.TestRootedOzoneFileSystem
[WARNING] Tests run: 350, Failures: 0, Errors: 0, Skipped: 12, Time elapsed: 255.5 s -- in org.apache.hadoop.fs.ozone.TestRootedOzoneFileSystem
[INFO] Running org.apache.hadoop.fs.ozone.TestOzoneFileInterfaces
[INFO] Tests run: 20, Failures: 0, Errors: 0, Skipped: 0, Time elapsed: 45.32 s -- in org.apache.hadoop.fs.ozone.TestOzoneFileInterfaces
[INFO] Running org.apache.hadoop.fs.ozone.TestOzoneFileSystemWithFSO
[WARNING] Tests run: 108, Failures: 0, Errors: 0, Skipped: 10, Time elapsed: 58.15 s -- in org.apache.hadoop.fs.ozone.TestOzoneFileSystemWithFSO
[INFO] Running org.apache.hadoop.fs.ozone.TestOzoneFileInterfacesWithFSO
[WARNING] Tests run: 20, Failures: 0, Errors: 0, Skipped: 10, Time elapsed: 44.07 s -- in org.apache.hadoop.fs.ozone.TestOzoneFileInterfacesWithFSO
[INFO] Running org.apache.hadoop.fs.ozone.TestOzoneFsSnapshot
[INFO] Tests run: 18, Failures: 0, Errors: 0, Skipped: 0, Time elapsed: 27.87 s -- in org.apache.hadoop.fs.ozone.TestOzoneFsSnapshot
[INFO] Running org.apache.hadoop.fs.ozone.TestOzoneFileSystemWithStreaming
[INFO] Tests run: 2, Failures: 0, Errors: 0, Skipped: 0, Time elapsed: 31.41 s -- in org.apache.hadoop.fs.ozone.TestOzoneFileSystemWithStreaming
[INFO] Running org.apache.hadoop.fs.ozone.TestOzoneFSBucketLayout
[INFO] Tests run: 5, Failures: 0, Errors: 0, Skipped: 0, Time elapsed: 23.61 s -- in org.apache.hadoop.fs.ozone.TestOzoneFSBucketLayout
[INFO] Running org.apache.hadoop.fs.ozone.TestOzoneFileSystemMetrics
[INFO] Tests run: 3, Failures: 0, Errors: 0, Skipped: 0, Time elapsed: 27.64 s -- in org.apache.hadoop.fs.ozone.TestOzoneFileSystemMetrics
[INFO] Running org.apache.hadoop.fs.ozone.TestOzoneFileSystemPrefixParser
[INFO] Tests run: 1, Failures: 0, Errors: 0, Skipped: 0, Time elapsed: 23.85 s -- in org.apache.hadoop.fs.ozone.TestOzoneFileSystemPrefixParser
[INFO] Running org.apache.hadoop.fs.ozone.TestOzoneFileSystem
[INFO] Tests run: 184, Failures: 0, Errors: 0, Skipped: 0, Time elapsed: 132.1 s -- in org.apache.hadoop.fs.ozone.TestOzoneFileSystem
[INFO] Running org.apache.hadoop.fs.ozone.TestOzoneFSWithObjectStoreCreate
[INFO] Tests run: 6, Failures: 0, Errors: 0, Skipped: 0, Time elapsed: 25.34 s -- in org.apache.hadoop.fs.ozone.TestOzoneFSWithObjectStoreCreate
[INFO] Running org.apache.hadoop.fs.ozone.TestHSync
[ERROR] Tests run: 9, Failures: 0, Errors: 1, Skipped: 0, Time elapsed: 141.0 s <<< FAILURE! -- in org.apache.hadoop.fs.ozone.TestHSync
[ERROR] org.apache.hadoop.fs.ozone.TestHSync.testO3fsHSync -- Time elapsed: 3.279 s <<< ERROR!
java.io.IOException: Inconsistent read for blockID=conID: 1 locID: 111677748019200065 bcsId: 0 length=68707 position=35939 numBytesToRead=4096 numBytesRead=-1
	at org.apache.hadoop.ozone.client.io.KeyInputStream.checkPartBytesRead(KeyInputStream.java:183)
	at org.apache.hadoop.hdds.scm.storage.MultipartInputStream.readWithStrategy(MultipartInputStream.java:97)
	at org.apache.hadoop.hdds.scm.storage.ExtendedInputStream.read(ExtendedInputStream.java:56)
	at org.apache.hadoop.fs.ozone.OzoneFSInputStream.read(OzoneFSInputStream.java:64)
	at java.io.DataInputStream.read(DataInputStream.java:149)
	at org.apache.hadoop.fs.ozone.TestHSync.runTestHSync(TestHSync.java:338)
	at org.apache.hadoop.fs.ozone.TestHSync.runTestHSync(TestHSync.java:291)
	at org.apache.hadoop.fs.ozone.TestHSync.testO3fsHSync(TestHSync.java:207)
	at sun.reflect.NativeMethodAccessorImpl.invoke0(Native Method)
	at sun.reflect.NativeMethodAccessorImpl.invoke(NativeMethodAccessorImpl.java:62)
	at sun.reflect.DelegatingMethodAccessorImpl.invoke(DelegatingMethodAccessorImpl.java:43)
	at java.lang.reflect.Method.invoke(Method.java:498)
	at org.junit.platform.commons.util.ReflectionUtils.invokeMethod(ReflectionUtils.java:725)
	at org.junit.jupiter.engine.execution.MethodInvocation.proceed(MethodInvocation.java:60)
	at org.junit.jupiter.engine.execution.InvocationInterceptorChain$ValidatingInvocation.proceed(InvocationInterceptorChain.java:131)
	at org.junit.jupiter.engine.extension.TimeoutInvocation.proceed(TimeoutInvocation.java:46)
	at org.junit.jupiter.engine.extension.TimeoutExtension.intercept(TimeoutExtension.java:149)
	at org.junit.jupiter.engine.extension.TimeoutExtension.interceptTestableMethod(TimeoutExtension.java:140)
	at org.junit.jupiter.engine.extension.TimeoutExtension.interceptTestMethod(TimeoutExtension.java:84)
	at org.junit.jupiter.engine.execution.ExecutableInvoker$ReflectiveInterceptorCall.lambda$ofVoidMethod$0(ExecutableInvoker.java:115)
	at org.junit.jupiter.engine.execution.ExecutableInvoker.lambda$invoke$0(ExecutableInvoker.java:105)
	at org.junit.jupiter.engine.execution.InvocationInterceptorChain$InterceptedInvocation.proceed(InvocationInterceptorChain.java:106)
	at org.junit.jupiter.engine.execution.InvocationInterceptorChain.proceed(InvocationInterceptorChain.java:64)
	at org.junit.jupiter.engine.execution.InvocationInterceptorChain.chainAndInvoke(InvocationInterceptorChain.java:45)
	at org.junit.jupiter.engine.execution.InvocationInterceptorChain.invoke(InvocationInterceptorChain.java:37)
	at org.junit.jupiter.engine.execution.ExecutableInvoker.invoke(ExecutableInvoker.java:104)
	at org.junit.jupiter.engine.execution.ExecutableInvoker.invoke(ExecutableInvoker.java:98)
	at org.junit.jupiter.engine.descriptor.TestMethodTestDescriptor.lambda$invokeTestMethod$7(TestMethodTestDescriptor.java:214)
	at org.junit.platform.engine.support.hierarchical.ThrowableCollector.execute(ThrowableCollector.java:73)
	at org.junit.jupiter.engine.descriptor.TestMethodTestDescriptor.invokeTestMethod(TestMethodTestDescriptor.java:210)
	at org.junit.jupiter.engine.descriptor.TestMethodTestDescriptor.execute(TestMethodTestDescriptor.java:135)
	at org.junit.jupiter.engine.descriptor.TestMethodTestDescriptor.execute(TestMethodTestDescriptor.java:66)
	at org.junit.platform.engine.support.hierarchical.NodeTestTask.lambda$executeRecursively$6(NodeTestTask.java:151)
	at org.junit.platform.engine.support.hierarchical.ThrowableCollector.execute(ThrowableCollector.java:73)
	at org.junit.platform.engine.support.hierarchical.NodeTestTask.lambda$executeRecursively$8(NodeTestTask.java:141)
	at org.junit.platform.engine.support.hierarchical.Node.around(Node.java:137)
	at org.junit.platform.engine.support.hierarchical.NodeTestTask.lambda$executeRecursively$9(NodeTestTask.java:139)
	at org.junit.platform.engine.support.hierarchical.ThrowableCollector.execute(ThrowableCollector.java:73)
	at org.junit.platform.engine.support.hierarchical.NodeTestTask.executeRecursively(NodeTestTask.java:138)
	at org.junit.platform.engine.support.hierarchical.NodeTestTask.execute(NodeTestTask.java:95)
	at java.util.ArrayList.forEach(ArrayList.java:1259)
	at org.junit.platform.engine.support.hierarchical.SameThreadHierarchicalTestExecutorService.invokeAll(SameThreadHierarchicalTestExecutorService.java:41)
	at org.junit.platform.engine.support.hierarchical.NodeTestTask.lambda$executeRecursively$6(NodeTestTask.java:155)
	at org.junit.platform.engine.support.hierarchical.ThrowableCollector.execute(ThrowableCollector.java:73)
	at org.junit.platform.engine.support.hierarchical.NodeTestTask.lambda$executeRecursively$8(NodeTestTask.java:141)
	at org.junit.platform.engine.support.hierarchical.Node.around(Node.java:137)
	at org.junit.platform.engine.support.hierarchical.NodeTestTask.lambda$executeRecursively$9(NodeTestTask.java:139)
	at org.junit.platform.engine.support.hierarchical.ThrowableCollector.execute(ThrowableCollector.java:73)
	at org.junit.platform.engine.support.hierarchical.NodeTestTask.executeRecursively(NodeTestTask.java:138)
	at org.junit.platform.engine.support.hierarchical.NodeTestTask.execute(NodeTestTask.java:95)
	at java.util.ArrayList.forEach(ArrayList.java:1259)
	at org.junit.platform.engine.support.hierarchical.SameThreadHierarchicalTestExecutorService.invokeAll(SameThreadHierarchicalTestExecutorService.java:41)
	at org.junit.platform.engine.support.hierarchical.NodeTestTask.lambda$executeRecursively$6(NodeTestTask.java:155)
	at org.junit.platform.engine.support.hierarchical.ThrowableCollector.execute(ThrowableCollector.java:73)
	at org.junit.platform.engine.support.hierarchical.NodeTestTask.lambda$executeRecursively$8(NodeTestTask.java:141)
	at org.junit.platform.engine.support.hierarchical.Node.around(Node.java:137)
	at org.junit.platform.engine.support.hierarchical.NodeTestTask.lambda$executeRecursively$9(NodeTestTask.java:139)
	at org.junit.platform.engine.support.hierarchical.ThrowableCollector.execute(ThrowableCollector.java:73)
	at org.junit.platform.engine.support.hierarchical.NodeTestTask.executeRecursively(NodeTestTask.java:138)
	at org.junit.platform.engine.support.hierarchical.NodeTestTask.execute(NodeTestTask.java:95)
	at org.junit.platform.engine.support.hierarchical.SameThreadHierarchicalTestExecutorService.submit(SameThreadHierarchicalTestExecutorService.java:35)
	at org.junit.platform.engine.support.hierarchical.HierarchicalTestExecutor.execute(HierarchicalTestExecutor.java:57)
	at org.junit.platform.engine.support.hierarchical.HierarchicalTestEngine.execute(HierarchicalTestEngine.java:54)
	at org.junit.platform.launcher.core.EngineExecutionOrchestrator.execute(EngineExecutionOrchestrator.java:107)
	at org.junit.platform.launcher.core.EngineExecutionOrchestrator.execute(EngineExecutionOrchestrator.java:88)
	at org.junit.platform.launcher.core.EngineExecutionOrchestrator.lambda$execute$0(EngineExecutionOrchestrator.java:54)
	at org.junit.platform.launcher.core.EngineExecutionOrchestrator.withInterceptedStreams(EngineExecutionOrchestrator.java:67)
	at org.junit.platform.launcher.core.EngineExecutionOrchestrator.execute(EngineExecutionOrchestrator.java:52)
	at org.junit.platform.launcher.core.DefaultLauncher.execute(DefaultLauncher.java:114)
	at org.junit.platform.launcher.core.DefaultLauncher.execute(DefaultLauncher.java:86)
	at org.junit.platform.launcher.core.DefaultLauncherSession$DelegatingLauncher.execute(DefaultLauncherSession.java:86)
	at org.apache.maven.surefire.junitplatform.LazyLauncher.execute(LazyLauncher.java:56)
	at org.apache.maven.surefire.junitplatform.JUnitPlatformProvider.execute(JUnitPlatformProvider.java:184)
	at org.apache.maven.surefire.junitplatform.JUnitPlatformProvider.invokeAllTests(JUnitPlatformProvider.java:148)
	at org.apache.maven.surefire.junitplatform.JUnitPlatformProvider.invoke(JUnitPlatformProvider.java:120)
	at org.apache.maven.surefire.booter.ForkedBooter.runSuitesInProcess(ForkedBooter.java:385)
	at org.apache.maven.surefire.booter.ForkedBooter.execute(ForkedBooter.java:162)
	at org.apache.maven.surefire.booter.ForkedBooter.run(ForkedBooter.java:507)
	at org.apache.maven.surefire.booter.ForkedBooter.main(ForkedBooter.java:495)

[INFO] Running org.apache.hadoop.fs.ozone.TestLeaseRecovery
[INFO] Tests run: 2, Failures: 0, Errors: 0, Skipped: 0, Time elapsed: 41.33 s -- in org.apache.hadoop.fs.ozone.TestLeaseRecovery
[INFO] Running org.apache.hadoop.fs.ozone.TestRootedOzoneFileSystemWithFSO
[WARNING] Tests run: 216, Failures: 0, Errors: 0, Skipped: 36, Time elapsed: 156.9 s -- in org.apache.hadoop.fs.ozone.TestRootedOzoneFileSystemWithFSO
[INFO] Running org.apache.hadoop.fs.ozone.TestDirectoryDeletingServiceWithFSO
[INFO] Tests run: 5, Failures: 0, Errors: 0, Skipped: 0, Time elapsed: 49.80 s -- in org.apache.hadoop.fs.ozone.TestDirectoryDeletingServiceWithFSO
[INFO] Running org.apache.hadoop.fs.ozone.TestOzoneFSInputStream
[INFO] Tests run: 5, Failures: 0, Errors: 0, Skipped: 0, Time elapsed: 32.40 s -- in org.apache.hadoop.fs.ozone.TestOzoneFSInputStream
[INFO] Running org.apache.hadoop.fs.ozone.TestOzoneFileChecksum
[INFO] Tests run: 6, Failures: 0, Errors: 0, Skipped: 0, Time elapsed: 155.4 s -- in org.apache.hadoop.fs.ozone.TestOzoneFileChecksum
[INFO] 
[INFO] Results:
[INFO] 
[ERROR] Errors: 
[ERROR]   TestHSync.testO3fsHSync:207->runTestHSync:291->runTestHSync:338 » IO Inconsistent read for blockID=conID: 1 locID: 111677748019200065 bcsId: 0 length=68707 position=35939 numBytesToRead=4096 numBytesRead=-1
[INFO] 
[ERROR] Tests run: 968, Failures: 0, Errors: 1, Skipped: 68
[INFO] 
[INFO] 
[INFO] ------------------------------------------------------------------------
[INFO] Skipping Apache Ozone Mini Ozone Chaos Tests
[INFO] This project has been banned from the build due to previous failures.
[INFO] ------------------------------------------------------------------------
[INFO] ------------------------------------------------------------------------
[INFO] Reactor Summary for Apache Ozone Integration Tests 1.4.0-SNAPSHOT:
[INFO] 
[INFO] Apache Ozone Integration Tests ..................... FAILURE [24:11 min]
[INFO] Apache Ozone Mini Ozone Chaos Tests ................ SKIPPED
[INFO] ------------------------------------------------------------------------
[INFO] BUILD FAILURE
[INFO] ------------------------------------------------------------------------
[INFO] Total time:  24:11 min
[INFO] Finished at: 2023-12-06T22:24:13Z
[INFO] ------------------------------------------------------------------------
[INFO] 11 goals, 11 executed
[INFO] 
[INFO] Publishing build scan...
[INFO] https://ge.apache.org/s/sjxyq6km5kj7c
[INFO] 
[ERROR] Failed to execute goal org.apache.maven.plugins:maven-surefire-plugin:3.2.2:test (default-test) on project ozone-integration-test: 
[ERROR] 
[ERROR] Please refer to /home/runner/work/ozone/ozone/hadoop-ozone/integration-test/target/surefire-reports for the individual test results.
[ERROR] Please refer to dump files (if any exist) [date].dump, [date]-jvmRun[N].dump and [date].dumpstream.
[ERROR] -> [Help 1]
[ERROR] 
[ERROR] To see the full stack trace of the errors, re-run Maven with the -e switch.
[ERROR] Re-run Maven using the -X switch to enable full debug logging.
[ERROR] 
[ERROR] For more information about the errors and possible solutions, please read the following articles:
[ERROR] [Help 1] http://cwiki.apache.org/confluence/display/MAVEN/MojoFailureException
