[INFO] Scanning for projects...
[INFO] ------------------------------------------------------------------------
[INFO] Detecting the operating system and CPU architecture
[INFO] ------------------------------------------------------------------------
[INFO] os.detected.name: linux
[INFO] os.detected.arch: x86_64
[INFO] os.detected.version: 5.15
[INFO] os.detected.version.major: 5
[INFO] os.detected.version.minor: 15
[INFO] os.detected.release: ubuntu
[INFO] os.detected.release.version: 20.04
[INFO] os.detected.release.like.ubuntu: true
[INFO] os.detected.release.like.debian: true
[INFO] os.detected.classifier: linux-x86_64
[INFO] ------------------------------------------------------------------------
[INFO] Reactor Build Order:
[INFO] 
[INFO] Apache Ozone Integration Tests                                     [jar]
[INFO] Apache Ozone Mini Ozone Chaos Tests                                [jar]
[INFO] 
[INFO] --------------< org.apache.ozone:ozone-integration-test >---------------
[INFO] Building Apache Ozone Integration Tests 1.3.0-SNAPSHOT             [1/2]
[INFO] --------------------------------[ jar ]---------------------------------
[INFO] 
[INFO] --- maven-antrun-plugin:1.3:run (create-testdirs) @ ozone-integration-test ---
[INFO] Executing tasks
[INFO] Executed tasks
[INFO] 
[INFO] --- jacoco-maven-plugin:0.8.5:prepare-agent (default-prepare-agent) @ ozone-integration-test ---
[INFO] argLine set to -javaagent:/home/runner/.m2/repository/org/jacoco/org.jacoco.agent/0.8.5/org.jacoco.agent-0.8.5-runtime.jar=destfile=/home/runner/work/ozone/ozone/hadoop-ozone/integration-test/target/jacoco.exec,includes=org.apache.hadoop.hdds.*:org.apache.hadoop.ozone.*:org.apache.hadoop.fs.ozone.*
[INFO] 
[INFO] --- maven-enforcer-plugin:3.0.0-M1:enforce (banned-rocksdb-imports) @ ozone-integration-test ---
[INFO] 
[INFO] --- maven-remote-resources-plugin:1.5:process (default) @ ozone-integration-test ---
[INFO] 
[INFO] --- maven-resources-plugin:3.1.0:resources (default-resources) @ ozone-integration-test ---
[INFO] Using 'UTF-8' encoding to copy filtered resources.
[INFO] skip non existing resourceDirectory /home/runner/work/ozone/ozone/hadoop-ozone/integration-test/src/main/resources
[INFO] Copying 2 resources
[INFO] 
[INFO] --- maven-compiler-plugin:3.1:compile (default-compile) @ ozone-integration-test ---
[INFO] No sources to compile
[INFO] 
[INFO] --- maven-resources-plugin:3.1.0:testResources (default-testResources) @ ozone-integration-test ---
[INFO] Using 'UTF-8' encoding to copy filtered resources.
[INFO] Copying 22 resources
[INFO] Copying 2 resources
[INFO] 
[INFO] --- maven-compiler-plugin:3.1:testCompile (default-testCompile) @ ozone-integration-test ---
[INFO] Compiling 12 source files to /home/runner/work/ozone/ozone/hadoop-ozone/integration-test/target/test-classes
[INFO] 
[INFO] --- maven-surefire-plugin:3.0.0-M5:test (default-test) @ ozone-integration-test ---
[INFO] 
[INFO] -------------------------------------------------------
[INFO]  T E S T S
[INFO] -------------------------------------------------------
[INFO] Running org.apache.hadoop.ozone.om.TestOzoneManagerRocksDBLogging
[INFO] Tests run: 1, Failures: 0, Errors: 0, Skipped: 0, Time elapsed: 43.832 s - in org.apache.hadoop.ozone.om.TestOzoneManagerRocksDBLogging
[INFO] Running org.apache.hadoop.ozone.om.TestContainerReportWithKeys
[INFO] Tests run: 1, Failures: 0, Errors: 0, Skipped: 0, Time elapsed: 25.847 s - in org.apache.hadoop.ozone.om.TestContainerReportWithKeys
[INFO] Running org.apache.hadoop.ozone.om.TestLDBCli
[INFO] Tests run: 3, Failures: 0, Errors: 0, Skipped: 0, Time elapsed: 1.333 s - in org.apache.hadoop.ozone.om.TestLDBCli
[INFO] Running org.apache.hadoop.ozone.om.TestOMRatisSnapshots
[INFO] Tests run: 4, Failures: 0, Errors: 0, Skipped: 0, Time elapsed: 143.411 s - in org.apache.hadoop.ozone.om.TestOMRatisSnapshots
[INFO] Running org.apache.hadoop.ozone.om.TestOMUpgradeFinalization
[INFO] Tests run: 2, Failures: 0, Errors: 0, Skipped: 0, Time elapsed: 100.924 s - in org.apache.hadoop.ozone.om.TestOMUpgradeFinalization
[INFO] Running org.apache.hadoop.ozone.om.TestKeyManagerImpl
[INFO] Tests run: 22, Failures: 0, Errors: 0, Skipped: 0, Time elapsed: 16.857 s - in org.apache.hadoop.ozone.om.TestKeyManagerImpl
[INFO] Running org.apache.hadoop.ozone.om.TestOzoneManagerHAWithFailover
[INFO] Tests run: 1, Failures: 0, Errors: 0, Skipped: 0, Time elapsed: 38.634 s - in org.apache.hadoop.ozone.om.TestOzoneManagerHAWithFailover
[INFO] Running org.apache.hadoop.ozone.om.TestRecursiveAclWithFSO
[INFO] Tests run: 1, Failures: 0, Errors: 0, Skipped: 0, Time elapsed: 36.524 s - in org.apache.hadoop.ozone.om.TestRecursiveAclWithFSO
[INFO] Running org.apache.hadoop.ozone.om.TestObjectStoreWithLegacyFS
[INFO] Tests run: 2, Failures: 0, Errors: 0, Skipped: 0, Time elapsed: 30.223 s - in org.apache.hadoop.ozone.om.TestObjectStoreWithLegacyFS
[INFO] Running org.apache.hadoop.ozone.om.TestOmBlockVersioning
[INFO] Tests run: 2, Failures: 0, Errors: 0, Skipped: 0, Time elapsed: 25.669 s - in org.apache.hadoop.ozone.om.TestOmBlockVersioning
[INFO] Running org.apache.hadoop.ozone.om.TestOzoneManagerHAMetadataOnly
[INFO] Tests run: 8, Failures: 0, Errors: 0, Skipped: 0, Time elapsed: 97.444 s - in org.apache.hadoop.ozone.om.TestOzoneManagerHAMetadataOnly
[INFO] Running org.apache.hadoop.ozone.om.TestObjectStore
[INFO] Tests run: 4, Failures: 0, Errors: 0, Skipped: 0, Time elapsed: 24.42 s - in org.apache.hadoop.ozone.om.TestObjectStore
[INFO] Running org.apache.hadoop.ozone.om.snapshot.TestOzoneManagerSnapshotProvider
[INFO] Tests run: 1, Failures: 0, Errors: 0, Skipped: 0, Time elapsed: 42.198 s - in org.apache.hadoop.ozone.om.snapshot.TestOzoneManagerSnapshotProvider
[INFO] Running org.apache.hadoop.ozone.om.TestOzoneManagerListVolumes
[INFO] Tests run: 6, Failures: 0, Errors: 0, Skipped: 0, Time elapsed: 24.645 s - in org.apache.hadoop.ozone.om.TestOzoneManagerListVolumes
[INFO] Running org.apache.hadoop.ozone.om.TestOzoneManagerRestart
[INFO] Tests run: 3, Failures: 0, Errors: 0, Skipped: 0, Time elapsed: 42.774 s - in org.apache.hadoop.ozone.om.TestOzoneManagerRestart
[INFO] Running org.apache.hadoop.ozone.om.TestAddRemoveOzoneManager
[ERROR] Tests run: 3, Failures: 0, Errors: 1, Skipped: 0, Time elapsed: 126.392 s <<< FAILURE! - in org.apache.hadoop.ozone.om.TestAddRemoveOzoneManager
[ERROR] org.apache.hadoop.ozone.om.TestAddRemoveOzoneManager.testBootstrap  Time elapsed: 35.403 s  <<< ERROR!
java.io.IOException: Failed init RocksDB, db path : /home/runner/work/ozone/ozone/hadoop-ozone/integration-test/target/test-dir/MiniOzoneClusterImpl-e8789b07-7928-40b5-ad88-551b1740a89b/omNode-bootstrap-2/om.db, exception :org.rocksdb.RocksDBException lock hold by current process, acquire time 1671704101 acquiring thread 140300937279232: /home/runner/work/ozone/ozone/hadoop-ozone/integration-test/target/test-dir/MiniOzoneClusterImpl-e8789b07-7928-40b5-ad88-551b1740a89b/omNode-bootstrap-2/om.db/LOCK: No locks available
	at org.apache.hadoop.hdds.utils.db.RDBStore.<init>(RDBStore.java:123)
	at org.apache.hadoop.hdds.utils.db.DBStoreBuilder.build(DBStoreBuilder.java:191)
	at org.apache.hadoop.ozone.om.OmMetadataManagerImpl.loadDB(OmMetadataManagerImpl.java:425)
	at org.apache.hadoop.ozone.om.OmMetadataManagerImpl.loadDB(OmMetadataManagerImpl.java:415)
	at org.apache.hadoop.ozone.om.OmMetadataManagerImpl.start(OmMetadataManagerImpl.java:407)
	at org.apache.hadoop.ozone.om.OmMetadataManagerImpl.<init>(OmMetadataManagerImpl.java:275)
	at org.apache.hadoop.ozone.om.OzoneManager.instantiateServices(OzoneManager.java:716)
	at org.apache.hadoop.ozone.om.OzoneManager.<init>(OzoneManager.java:596)
	at org.apache.hadoop.ozone.om.OzoneManager.createOm(OzoneManager.java:687)
	at org.apache.hadoop.ozone.MiniOzoneHAClusterImpl.bootstrapNewOM(MiniOzoneHAClusterImpl.java:864)
	at org.apache.hadoop.ozone.MiniOzoneHAClusterImpl.bootstrapOzoneManager(MiniOzoneHAClusterImpl.java:780)
	at org.apache.hadoop.ozone.MiniOzoneHAClusterImpl.bootstrapOzoneManager(MiniOzoneHAClusterImpl.java:746)
	at org.apache.hadoop.ozone.om.TestAddRemoveOzoneManager.testBootstrapOMs(TestAddRemoveOzoneManager.java:159)
	at org.apache.hadoop.ozone.om.TestAddRemoveOzoneManager.testBootstrap(TestAddRemoveOzoneManager.java:177)
	at sun.reflect.NativeMethodAccessorImpl.invoke0(Native Method)
	at sun.reflect.NativeMethodAccessorImpl.invoke(NativeMethodAccessorImpl.java:62)
	at sun.reflect.DelegatingMethodAccessorImpl.invoke(DelegatingMethodAccessorImpl.java:43)
	at java.lang.reflect.Method.invoke(Method.java:498)
	at org.junit.platform.commons.util.ReflectionUtils.invokeMethod(ReflectionUtils.java:725)
	at org.junit.jupiter.engine.execution.MethodInvocation.proceed(MethodInvocation.java:60)
	at org.junit.jupiter.engine.execution.InvocationInterceptorChain$ValidatingInvocation.proceed(InvocationInterceptorChain.java:131)
	at org.junit.jupiter.engine.extension.TimeoutInvocation.proceed(TimeoutInvocation.java:46)
	at org.junit.jupiter.engine.extension.TimeoutExtension.intercept(TimeoutExtension.java:149)
	at org.junit.jupiter.engine.extension.TimeoutExtension.interceptTestableMethod(TimeoutExtension.java:140)
	at org.junit.jupiter.engine.extension.TimeoutExtension.interceptTestMethod(TimeoutExtension.java:84)
	at org.junit.jupiter.engine.execution.ExecutableInvoker$ReflectiveInterceptorCall.lambda$ofVoidMethod$0(ExecutableInvoker.java:115)
	at org.junit.jupiter.engine.execution.ExecutableInvoker.lambda$invoke$0(ExecutableInvoker.java:105)
	at org.junit.jupiter.engine.execution.InvocationInterceptorChain$InterceptedInvocation.proceed(InvocationInterceptorChain.java:106)
	at org.junit.jupiter.engine.execution.InvocationInterceptorChain.proceed(InvocationInterceptorChain.java:64)
	at org.junit.jupiter.engine.execution.InvocationInterceptorChain.chainAndInvoke(InvocationInterceptorChain.java:45)
	at org.junit.jupiter.engine.execution.InvocationInterceptorChain.invoke(InvocationInterceptorChain.java:37)
	at org.junit.jupiter.engine.execution.ExecutableInvoker.invoke(ExecutableInvoker.java:104)
	at org.junit.jupiter.engine.execution.ExecutableInvoker.invoke(ExecutableInvoker.java:98)
	at org.junit.jupiter.engine.descriptor.TestMethodTestDescriptor.lambda$invokeTestMethod$7(TestMethodTestDescriptor.java:214)
	at org.junit.platform.engine.support.hierarchical.ThrowableCollector.execute(ThrowableCollector.java:73)
	at org.junit.jupiter.engine.descriptor.TestMethodTestDescriptor.invokeTestMethod(TestMethodTestDescriptor.java:210)
	at org.junit.jupiter.engine.descriptor.TestMethodTestDescriptor.execute(TestMethodTestDescriptor.java:135)
	at org.junit.jupiter.engine.descriptor.TestMethodTestDescriptor.execute(TestMethodTestDescriptor.java:66)
	at org.junit.platform.engine.support.hierarchical.NodeTestTask.lambda$executeRecursively$6(NodeTestTask.java:151)
	at org.junit.platform.engine.support.hierarchical.ThrowableCollector.execute(ThrowableCollector.java:73)
	at org.junit.platform.engine.support.hierarchical.NodeTestTask.lambda$executeRecursively$8(NodeTestTask.java:141)
	at org.junit.platform.engine.support.hierarchical.Node.around(Node.java:137)
	at org.junit.platform.engine.support.hierarchical.NodeTestTask.lambda$executeRecursively$9(NodeTestTask.java:139)
	at org.junit.platform.engine.support.hierarchical.ThrowableCollector.execute(ThrowableCollector.java:73)
	at org.junit.platform.engine.support.hierarchical.NodeTestTask.executeRecursively(NodeTestTask.java:138)
	at org.junit.platform.engine.support.hierarchical.NodeTestTask.execute(NodeTestTask.java:95)
	at java.util.ArrayList.forEach(ArrayList.java:1259)
	at org.junit.platform.engine.support.hierarchical.SameThreadHierarchicalTestExecutorService.invokeAll(SameThreadHierarchicalTestExecutorService.java:41)
	at org.junit.platform.engine.support.hierarchical.NodeTestTask.lambda$executeRecursively$6(NodeTestTask.java:155)
	at org.junit.platform.engine.support.hierarchical.ThrowableCollector.execute(ThrowableCollector.java:73)
	at org.junit.platform.engine.support.hierarchical.NodeTestTask.lambda$executeRecursively$8(NodeTestTask.java:141)
	at org.junit.platform.engine.support.hierarchical.Node.around(Node.java:137)
	at org.junit.platform.engine.support.hierarchical.NodeTestTask.lambda$executeRecursively$9(NodeTestTask.java:139)
	at org.junit.platform.engine.support.hierarchical.ThrowableCollector.execute(ThrowableCollector.java:73)
	at org.junit.platform.engine.support.hierarchical.NodeTestTask.executeRecursively(NodeTestTask.java:138)
	at org.junit.platform.engine.support.hierarchical.NodeTestTask.execute(NodeTestTask.java:95)
	at java.util.ArrayList.forEach(ArrayList.java:1259)
	at org.junit.platform.engine.support.hierarchical.SameThreadHierarchicalTestExecutorService.invokeAll(SameThreadHierarchicalTestExecutorService.java:41)
	at org.junit.platform.engine.support.hierarchical.NodeTestTask.lambda$executeRecursively$6(NodeTestTask.java:155)
	at org.junit.platform.engine.support.hierarchical.ThrowableCollector.execute(ThrowableCollector.java:73)
	at org.junit.platform.engine.support.hierarchical.NodeTestTask.lambda$executeRecursively$8(NodeTestTask.java:141)
	at org.junit.platform.engine.support.hierarchical.Node.around(Node.java:137)
	at org.junit.platform.engine.support.hierarchical.NodeTestTask.lambda$executeRecursively$9(NodeTestTask.java:139)
	at org.junit.platform.engine.support.hierarchical.ThrowableCollector.execute(ThrowableCollector.java:73)
	at org.junit.platform.engine.support.hierarchical.NodeTestTask.executeRecursively(NodeTestTask.java:138)
	at org.junit.platform.engine.support.hierarchical.NodeTestTask.execute(NodeTestTask.java:95)
	at org.junit.platform.engine.support.hierarchical.SameThreadHierarchicalTestExecutorService.submit(SameThreadHierarchicalTestExecutorService.java:35)
	at org.junit.platform.engine.support.hierarchical.HierarchicalTestExecutor.execute(HierarchicalTestExecutor.java:57)
	at org.junit.platform.engine.support.hierarchical.HierarchicalTestEngine.execute(HierarchicalTestEngine.java:54)
	at org.junit.platform.launcher.core.EngineExecutionOrchestrator.execute(EngineExecutionOrchestrator.java:107)
	at org.junit.platform.launcher.core.EngineExecutionOrchestrator.execute(EngineExecutionOrchestrator.java:88)
	at org.junit.platform.launcher.core.EngineExecutionOrchestrator.lambda$execute$0(EngineExecutionOrchestrator.java:54)
	at org.junit.platform.launcher.core.EngineExecutionOrchestrator.withInterceptedStreams(EngineExecutionOrchestrator.java:67)
	at org.junit.platform.launcher.core.EngineExecutionOrchestrator.execute(EngineExecutionOrchestrator.java:52)
	at org.junit.platform.launcher.core.DefaultLauncher.execute(DefaultLauncher.java:114)
	at org.junit.platform.launcher.core.DefaultLauncher.execute(DefaultLauncher.java:86)
	at org.junit.platform.launcher.core.DefaultLauncherSession$DelegatingLauncher.execute(DefaultLauncherSession.java:86)
	at org.junit.platform.launcher.core.SessionPerRequestLauncher.execute(SessionPerRequestLauncher.java:53)
	at org.apache.maven.surefire.junitplatform.JUnitPlatformProvider.execute(JUnitPlatformProvider.java:188)
	at org.apache.maven.surefire.junitplatform.JUnitPlatformProvider.invokeAllTests(JUnitPlatformProvider.java:154)
	at org.apache.maven.surefire.junitplatform.JUnitPlatformProvider.invoke(JUnitPlatformProvider.java:124)
	at org.apache.maven.surefire.booter.ForkedBooter.runSuitesInProcess(ForkedBooter.java:428)
	at org.apache.maven.surefire.booter.ForkedBooter.execute(ForkedBooter.java:162)
	at org.apache.maven.surefire.booter.ForkedBooter.run(ForkedBooter.java:562)
	at org.apache.maven.surefire.booter.ForkedBooter.main(ForkedBooter.java:548)
Caused by: java.io.IOException: class org.apache.hadoop.hdds.utils.db.RocksDatabase: Failed to open /home/runner/work/ozone/ozone/hadoop-ozone/integration-test/target/test-dir/MiniOzoneClusterImpl-e8789b07-7928-40b5-ad88-551b1740a89b/omNode-bootstrap-2/om.db; status : IOError; message : lock hold by current process, acquire time 1671704101 acquiring thread 140300937279232: /home/runner/work/ozone/ozone/hadoop-ozone/integration-test/target/test-dir/MiniOzoneClusterImpl-e8789b07-7928-40b5-ad88-551b1740a89b/omNode-bootstrap-2/om.db/LOCK: No locks available
	at org.apache.hadoop.hdds.utils.HddsServerUtil.toIOException(HddsServerUtil.java:586)
	at org.apache.hadoop.hdds.utils.db.RocksDatabase.toIOException(RocksDatabase.java:75)
	at org.apache.hadoop.hdds.utils.db.RocksDatabase.open(RocksDatabase.java:151)
	at org.apache.hadoop.hdds.utils.db.RDBStore.<init>(RDBStore.java:83)
	... 84 more
Caused by: org.rocksdb.RocksDBException: lock hold by current process, acquire time 1671704101 acquiring thread 140300937279232: /home/runner/work/ozone/ozone/hadoop-ozone/integration-test/target/test-dir/MiniOzoneClusterImpl-e8789b07-7928-40b5-ad88-551b1740a89b/omNode-bootstrap-2/om.db/LOCK: No locks available
	at org.rocksdb.RocksDB.open(Native Method)
	at org.rocksdb.RocksDB.open(RocksDB.java:307)
	at org.apache.hadoop.hdds.utils.db.managed.ManagedRocksDB.open(ManagedRocksDB.java:66)
	at org.apache.hadoop.hdds.utils.db.RocksDatabase.open(RocksDatabase.java:138)
	... 85 more

[INFO] Running org.apache.hadoop.ozone.om.TestSecureOzoneManager
[INFO] Tests run: 2, Failures: 0, Errors: 0, Skipped: 0, Time elapsed: 2.345 s - in org.apache.hadoop.ozone.om.TestSecureOzoneManager
[INFO] Running org.apache.hadoop.ozone.om.TestOmMetrics
[INFO] Tests run: 5, Failures: 0, Errors: 0, Skipped: 0, Time elapsed: 69.948 s - in org.apache.hadoop.ozone.om.TestOmMetrics
[INFO] Running org.apache.hadoop.ozone.om.TestListStatus
[INFO] Tests run: 1, Failures: 0, Errors: 0, Skipped: 0, Time elapsed: 29.709 s - in org.apache.hadoop.ozone.om.TestListStatus
[INFO] Running org.apache.hadoop.ozone.om.ratis.TestOzoneManagerRatisRequest
[INFO] Tests run: 1, Failures: 0, Errors: 0, Skipped: 0, Time elapsed: 3.126 s - in org.apache.hadoop.ozone.om.ratis.TestOzoneManagerRatisRequest
[INFO] Running org.apache.hadoop.ozone.om.TestListKeysWithFSO
[INFO] Tests run: 3, Failures: 0, Errors: 0, Skipped: 0, Time elapsed: 28.724 s - in org.apache.hadoop.ozone.om.TestListKeysWithFSO
[INFO] Running org.apache.hadoop.ozone.om.TestOmInit
[INFO] Tests run: 1, Failures: 0, Errors: 0, Skipped: 0, Time elapsed: 24.057 s - in org.apache.hadoop.ozone.om.TestOmInit
[INFO] Running org.apache.hadoop.ozone.om.multitenant.TestMultiTenantVolume
[INFO] Tests run: 4, Failures: 0, Errors: 0, Skipped: 0, Time elapsed: 9.016 s - in org.apache.hadoop.ozone.om.multitenant.TestMultiTenantVolume
[INFO] Running org.apache.hadoop.ozone.om.TestOzoneManagerHAWithACL
[INFO] Tests run: 1, Failures: 0, Errors: 0, Skipped: 0, Time elapsed: 35.927 s - in org.apache.hadoop.ozone.om.TestOzoneManagerHAWithACL
[INFO] Running org.apache.hadoop.ozone.om.TestOMEpochForNonRatis
[INFO] Tests run: 2, Failures: 0, Errors: 0, Skipped: 0, Time elapsed: 30.837 s - in org.apache.hadoop.ozone.om.TestOMEpochForNonRatis
[INFO] Running org.apache.hadoop.ozone.om.TestOzoneManagerHAKeyDeletion
[INFO] Tests run: 1, Failures: 0, Errors: 0, Skipped: 0, Time elapsed: 60.712 s - in org.apache.hadoop.ozone.om.TestOzoneManagerHAKeyDeletion
[INFO] Running org.apache.hadoop.ozone.om.TestOMDbCheckpointServlet
[INFO] Tests run: 3, Failures: 0, Errors: 0, Skipped: 0, Time elapsed: 31.342 s - in org.apache.hadoop.ozone.om.TestOMDbCheckpointServlet
[INFO] Running org.apache.hadoop.ozone.om.TestOmContainerLocationCache
[INFO] Tests run: 13, Failures: 0, Errors: 0, Skipped: 0, Time elapsed: 14.623 s - in org.apache.hadoop.ozone.om.TestOmContainerLocationCache
[INFO] Running org.apache.hadoop.ozone.om.TestOMStartupWithBucketLayout
[INFO] Tests run: 2, Failures: 0, Errors: 0, Skipped: 0, Time elapsed: 24.093 s - in org.apache.hadoop.ozone.om.TestOMStartupWithBucketLayout
[INFO] Running org.apache.hadoop.ozone.om.TestOzoneManagerRestInterface
[INFO] Tests run: 1, Failures: 0, Errors: 0, Skipped: 0, Time elapsed: 24.464 s - in org.apache.hadoop.ozone.om.TestOzoneManagerRestInterface
[INFO] Running org.apache.hadoop.ozone.om.TestKeyPurging
[INFO] Tests run: 1, Failures: 0, Errors: 0, Skipped: 0, Time elapsed: 25.824 s - in org.apache.hadoop.ozone.om.TestKeyPurging
[INFO] Running org.apache.hadoop.ozone.om.TestOzoneManagerHAWithData
[INFO] Tests run: 5, Failures: 0, Errors: 0, Skipped: 0, Time elapsed: 129.825 s - in org.apache.hadoop.ozone.om.TestOzoneManagerHAWithData
[INFO] Running org.apache.hadoop.ozone.om.TestOmStartupSlvLessThanMlv
[INFO] Tests run: 1, Failures: 0, Errors: 0, Skipped: 0, Time elapsed: 3.437 s - in org.apache.hadoop.ozone.om.TestOmStartupSlvLessThanMlv
[INFO] Running org.apache.hadoop.ozone.om.TestOzoneManagerConfiguration
[INFO] Tests run: 9, Failures: 0, Errors: 0, Skipped: 0, Time elapsed: 86.58 s - in org.apache.hadoop.ozone.om.TestOzoneManagerConfiguration
[INFO] Running org.apache.hadoop.ozone.om.TestBucketLayoutWithOlderClient
[INFO] Tests run: 1, Failures: 0, Errors: 0, Skipped: 0, Time elapsed: 40.348 s - in org.apache.hadoop.ozone.om.TestBucketLayoutWithOlderClient
[INFO] Running org.apache.hadoop.ozone.om.TestBucketOwner
[INFO] Tests run: 3, Failures: 0, Errors: 0, Skipped: 0, Time elapsed: 31.359 s - in org.apache.hadoop.ozone.om.TestBucketOwner
[INFO] Running org.apache.hadoop.ozone.om.TestObjectStoreWithFSO
[INFO] Tests run: 9, Failures: 0, Errors: 0, Skipped: 0, Time elapsed: 27.377 s - in org.apache.hadoop.ozone.om.TestObjectStoreWithFSO
[INFO] Running org.apache.hadoop.ozone.om.TestOMBucketLayoutUpgrade
[INFO] Tests run: 1, Failures: 0, Errors: 0, Skipped: 0, Time elapsed: 19.922 s - in org.apache.hadoop.ozone.om.TestOMBucketLayoutUpgrade
[INFO] Running org.apache.hadoop.ozone.om.TestOmAcls
[INFO] Tests run: 3, Failures: 0, Errors: 0, Skipped: 0, Time elapsed: 25.614 s - in org.apache.hadoop.ozone.om.TestOmAcls
[INFO] 
[INFO] Results:
[INFO] 
[ERROR] Errors: 
[ERROR]   TestAddRemoveOzoneManager.testBootstrap:177->testBootstrapOMs:159 » IO Failed ...
[INFO] 
[ERROR] Tests run: 137, Failures: 0, Errors: 1, Skipped: 0
[INFO] 
[INFO] 
[INFO] ------------------------------------------------------------------------
[INFO] Skipping Apache Ozone Mini Ozone Chaos Tests
[INFO] This project has been banned from the build due to previous failures.
[INFO] ------------------------------------------------------------------------
[INFO] ------------------------------------------------------------------------
[INFO] Reactor Summary for Apache Ozone Integration Tests 1.3.0-SNAPSHOT:
[INFO] 
[INFO] Apache Ozone Integration Tests ..................... FAILURE [27:39 min]
[INFO] Apache Ozone Mini Ozone Chaos Tests ................ SKIPPED
[INFO] ------------------------------------------------------------------------
[INFO] BUILD FAILURE
[INFO] ------------------------------------------------------------------------
[INFO] Total time:  27:40 min
[INFO] Finished at: 2022-12-22T10:29:14Z
[INFO] ------------------------------------------------------------------------
[ERROR] Failed to execute goal org.apache.maven.plugins:maven-surefire-plugin:3.0.0-M5:test (default-test) on project ozone-integration-test: There are test failures.
[ERROR] 
[ERROR] Please refer to /home/runner/work/ozone/ozone/hadoop-ozone/integration-test/target/surefire-reports for the individual test results.
[ERROR] Please refer to dump files (if any exist) [date].dump, [date]-jvmRun[N].dump and [date].dumpstream.
[ERROR] -> [Help 1]
[ERROR] 
[ERROR] To see the full stack trace of the errors, re-run Maven with the -e switch.
[ERROR] Re-run Maven using the -X switch to enable full debug logging.
[ERROR] 
[ERROR] For more information about the errors and possible solutions, please read the following articles:
[ERROR] [Help 1] http://cwiki.apache.org/confluence/display/MAVEN/MojoFailureException
