[INFO] Scanning for projects...
[INFO] ------------------------------------------------------------------------
[INFO] Detecting the operating system and CPU architecture
[INFO] ------------------------------------------------------------------------
[INFO] os.detected.name: linux
[INFO] os.detected.arch: x86_64
[INFO] os.detected.version: 5.15
[INFO] os.detected.version.major: 5
[INFO] os.detected.version.minor: 15
[INFO] os.detected.release: ubuntu
[INFO] os.detected.release.version: 20.04
[INFO] os.detected.release.like.ubuntu: true
[INFO] os.detected.release.like.debian: true
[INFO] os.detected.classifier: linux-x86_64
[INFO] ------------------------------------------------------------------------
[INFO] Reactor Build Order:
[INFO] 
[INFO] Apache Ozone Integration Tests                                     [jar]
[INFO] Apache Ozone Mini Ozone Chaos Tests                                [jar]
[INFO] 
[INFO] --------------< org.apache.ozone:ozone-integration-test >---------------
[INFO] Building Apache Ozone Integration Tests 1.4.0-SNAPSHOT             [1/2]
[INFO]   from pom.xml
[INFO] --------------------------------[ jar ]---------------------------------
[INFO] 
[INFO] --- maven-antrun-plugin:1.3:run (create-testdirs) @ ozone-integration-test ---
[INFO] Executing tasks
[INFO] Executed tasks
[INFO] 
[INFO] --- maven-enforcer-plugin:3.2.1:enforce (depcheck) @ ozone-integration-test ---
[INFO] Rule 0: org.apache.maven.enforcer.rules.dependency.DependencyConvergence passed
[INFO] Rule 1: org.apache.maven.enforcer.rules.version.RequireMavenVersion passed
[INFO] Rule 2: org.apache.maven.enforcer.rules.version.RequireJavaVersion passed
[INFO] 
[INFO] --- jacoco-maven-plugin:0.8.5:prepare-agent (default-prepare-agent) @ ozone-integration-test ---
[INFO] argLine set to -javaagent:/home/runner/.m2/repository/org/jacoco/org.jacoco.agent/0.8.5/org.jacoco.agent-0.8.5-runtime.jar=destfile=/home/runner/work/ozone/ozone/hadoop-ozone/integration-test/target/jacoco.exec,includes=org.apache.hadoop.hdds.*:org.apache.hadoop.ozone.*:org.apache.hadoop.fs.ozone.*
[INFO] 
[INFO] --- maven-enforcer-plugin:3.2.1:enforce (banned-rocksdb-imports) @ ozone-integration-test ---
[INFO] Rule 0: org.apache.maven.plugins.enforcer.RestrictImports passed
[INFO] Rule 1: org.apache.maven.plugins.enforcer.RestrictImports passed
[INFO] 
[INFO] --- maven-remote-resources-plugin:1.5:process (default) @ ozone-integration-test ---
[INFO] 
[INFO] --- maven-resources-plugin:3.1.0:resources (default-resources) @ ozone-integration-test ---
[INFO] Using 'UTF-8' encoding to copy filtered resources.
[INFO] skip non existing resourceDirectory /home/runner/work/ozone/ozone/hadoop-ozone/integration-test/src/main/resources
[INFO] Copying 2 resources
[INFO] 
[INFO] --- maven-compiler-plugin:3.1:compile (default-compile) @ ozone-integration-test ---
[INFO] No sources to compile
[INFO] 
[INFO] --- maven-resources-plugin:3.1.0:testResources (default-testResources) @ ozone-integration-test ---
[INFO] Using 'UTF-8' encoding to copy filtered resources.
[INFO] Copying 22 resources
[INFO] Copying 2 resources
[INFO] 
[INFO] --- maven-compiler-plugin:3.1:testCompile (default-testCompile) @ ozone-integration-test ---
[INFO] Compiling 17 source files to /home/runner/work/ozone/ozone/hadoop-ozone/integration-test/target/test-classes
[INFO] 
[INFO] --- maven-surefire-plugin:3.0.0-M5:test (default-test) @ ozone-integration-test ---
[INFO] 
[INFO] -------------------------------------------------------
[INFO]  T E S T S
[INFO] -------------------------------------------------------
[INFO] Running org.apache.hadoop.ozone.reconfig.TestOmReconfiguration
[INFO] Tests run: 3, Failures: 0, Errors: 0, Skipped: 0, Time elapsed: 26.749 s - in org.apache.hadoop.ozone.reconfig.TestOmReconfiguration
[INFO] Running org.apache.hadoop.ozone.reconfig.TestDatanodeReconfiguration
[INFO] Tests run: 1, Failures: 0, Errors: 0, Skipped: 0, Time elapsed: 26.742 s - in org.apache.hadoop.ozone.reconfig.TestDatanodeReconfiguration
[INFO] Running org.apache.hadoop.ozone.reconfig.TestScmReconfiguration
[INFO] Tests run: 4, Failures: 0, Errors: 0, Skipped: 0, Time elapsed: 25.418 s - in org.apache.hadoop.ozone.reconfig.TestScmReconfiguration
[INFO] Running org.apache.hadoop.ozone.debug.TestLeaseRecoverer
[INFO] Tests run: 1, Failures: 0, Errors: 0, Skipped: 0, Time elapsed: 28.584 s - in org.apache.hadoop.ozone.debug.TestLeaseRecoverer
[INFO] Running org.apache.hadoop.ozone.TestMiniOzoneCluster
[INFO] Tests run: 3, Failures: 0, Errors: 0, Skipped: 0, Time elapsed: 50.518 s - in org.apache.hadoop.ozone.TestMiniOzoneCluster
[INFO] Running org.apache.hadoop.ozone.TestContainerBalancerOperations
[WARNING] Tests run: 1, Failures: 0, Errors: 0, Skipped: 1, Time elapsed: 0.024 s - in org.apache.hadoop.ozone.TestContainerBalancerOperations
[INFO] Running org.apache.hadoop.ozone.TestContainerStateMachineIdempotency
[INFO] Tests run: 1, Failures: 0, Errors: 0, Skipped: 0, Time elapsed: 33.963 s - in org.apache.hadoop.ozone.TestContainerStateMachineIdempotency
[INFO] Running org.apache.hadoop.ozone.recon.TestReconWithOzoneManagerFSO
[INFO] Tests run: 1, Failures: 0, Errors: 0, Skipped: 0, Time elapsed: 52.533 s - in org.apache.hadoop.ozone.recon.TestReconWithOzoneManagerFSO
[INFO] Running org.apache.hadoop.ozone.recon.TestReconAsPassiveScm
[INFO] Tests run: 2, Failures: 0, Errors: 0, Skipped: 0, Time elapsed: 75.328 s - in org.apache.hadoop.ozone.recon.TestReconAsPassiveScm
[INFO] Running org.apache.hadoop.ozone.recon.TestReconTasks
[INFO] Tests run: 2, Failures: 0, Errors: 0, Skipped: 0, Time elapsed: 118.824 s - in org.apache.hadoop.ozone.recon.TestReconTasks
[INFO] Running org.apache.hadoop.ozone.recon.TestReconWithOzoneManager
[INFO] Tests run: 1, Failures: 0, Errors: 0, Skipped: 0, Time elapsed: 50.641 s - in org.apache.hadoop.ozone.recon.TestReconWithOzoneManager
[INFO] Running org.apache.hadoop.ozone.recon.TestReconScmHASnapshot
[INFO] Tests run: 1, Failures: 0, Errors: 0, Skipped: 0, Time elapsed: 65.425 s - in org.apache.hadoop.ozone.recon.TestReconScmHASnapshot
[INFO] Running org.apache.hadoop.ozone.recon.TestReconScmSnapshot
[INFO] Tests run: 1, Failures: 0, Errors: 0, Skipped: 0, Time elapsed: 55.816 s - in org.apache.hadoop.ozone.recon.TestReconScmSnapshot
[INFO] Running org.apache.hadoop.ozone.recon.TestReconWithOzoneManagerHA
[INFO] Tests run: 1, Failures: 0, Errors: 0, Skipped: 0, Time elapsed: 57.457 s - in org.apache.hadoop.ozone.recon.TestReconWithOzoneManagerHA
[INFO] Running org.apache.hadoop.ozone.fsck.TestContainerMapper
[INFO] Tests run: 1, Failures: 0, Errors: 0, Skipped: 0, Time elapsed: 30.487 s - in org.apache.hadoop.ozone.fsck.TestContainerMapper
[INFO] Running org.apache.hadoop.ozone.container.common.transport.server.ratis.TestCSMMetrics
[INFO] Tests run: 1, Failures: 0, Errors: 0, Skipped: 0, Time elapsed: 14.667 s - in org.apache.hadoop.ozone.container.common.transport.server.ratis.TestCSMMetrics
[INFO] Running org.apache.hadoop.ozone.container.common.statemachine.commandhandler.TestCloseContainerHandler
[INFO] Tests run: 1, Failures: 0, Errors: 0, Skipped: 0, Time elapsed: 34.881 s - in org.apache.hadoop.ozone.container.common.statemachine.commandhandler.TestCloseContainerHandler
[INFO] Running org.apache.hadoop.ozone.container.common.statemachine.commandhandler.TestDeleteContainerHandler
[INFO] Tests run: 6, Failures: 0, Errors: 0, Skipped: 0, Time elapsed: 86.766 s - in org.apache.hadoop.ozone.container.common.statemachine.commandhandler.TestDeleteContainerHandler
[INFO] Running org.apache.hadoop.ozone.container.common.statemachine.commandhandler.TestBlockDeletion
[INFO] Tests run: 5, Failures: 0, Errors: 0, Skipped: 0, Time elapsed: 205.412 s - in org.apache.hadoop.ozone.container.common.statemachine.commandhandler.TestBlockDeletion
[INFO] Running org.apache.hadoop.ozone.container.common.statemachine.commandhandler.TestRefreshVolumeUsageHandler
[INFO] Tests run: 1, Failures: 0, Errors: 0, Skipped: 0, Time elapsed: 33.349 s - in org.apache.hadoop.ozone.container.common.statemachine.commandhandler.TestRefreshVolumeUsageHandler
[INFO] Running org.apache.hadoop.ozone.container.TestContainerReplication
[INFO] Tests run: 6, Failures: 0, Errors: 0, Skipped: 0, Time elapsed: 213.587 s - in org.apache.hadoop.ozone.container.TestContainerReplication
[INFO] Running org.apache.hadoop.ozone.container.server.TestSecureContainerServer
[INFO] Tests run: 2, Failures: 0, Errors: 0, Skipped: 0, Time elapsed: 36.582 s - in org.apache.hadoop.ozone.container.server.TestSecureContainerServer
[INFO] Running org.apache.hadoop.ozone.container.ozoneimpl.TestOzoneContainerWithTLS
[INFO] Tests run: 6, Failures: 0, Errors: 0, Skipped: 0, Time elapsed: 43.822 s - in org.apache.hadoop.ozone.container.ozoneimpl.TestOzoneContainerWithTLS
[INFO] Running org.apache.hadoop.ozone.container.ozoneimpl.TestOzoneContainer
[INFO] Tests run: 7, Failures: 0, Errors: 0, Skipped: 0, Time elapsed: 83.405 s - in org.apache.hadoop.ozone.container.ozoneimpl.TestOzoneContainer
[INFO] Running org.apache.hadoop.ozone.container.ozoneimpl.TestSecureOzoneContainer
[INFO] Tests run: 5, Failures: 0, Errors: 0, Skipped: 0, Time elapsed: 19.121 s - in org.apache.hadoop.ozone.container.ozoneimpl.TestSecureOzoneContainer
[INFO] Running org.apache.hadoop.ozone.container.metrics.TestContainerMetrics
[INFO] Tests run: 1, Failures: 0, Errors: 0, Skipped: 0, Time elapsed: 9.319 s - in org.apache.hadoop.ozone.container.metrics.TestContainerMetrics
[INFO] Running org.apache.hadoop.ozone.container.metrics.TestDatanodeQueueMetrics
[INFO] Tests run: 1, Failures: 0, Errors: 0, Skipped: 0, Time elapsed: 32.501 s - in org.apache.hadoop.ozone.container.metrics.TestDatanodeQueueMetrics
[INFO] Running org.apache.hadoop.ozone.container.replication.TestContainerReplication
[INFO] Tests run: 12, Failures: 0, Errors: 0, Skipped: 0, Time elapsed: 54.473 s - in org.apache.hadoop.ozone.container.replication.TestContainerReplication
[INFO] Running org.apache.hadoop.ozone.container.TestECContainerRecovery
[INFO] Tests run: 2, Failures: 0, Errors: 0, Skipped: 0, Time elapsed: 111.047 s - in org.apache.hadoop.ozone.container.TestECContainerRecovery
[INFO] Running org.apache.hadoop.ozone.TestDelegationToken
[INFO] Tests run: 1, Failures: 0, Errors: 0, Skipped: 0, Time elapsed: 19.562 s - in org.apache.hadoop.ozone.TestDelegationToken
[INFO] Running org.apache.hadoop.ozone.shell.TestReconfigShell
[INFO] Tests run: 4, Failures: 0, Errors: 0, Skipped: 0, Time elapsed: 135.204 s - in org.apache.hadoop.ozone.shell.TestReconfigShell
[INFO] Running org.apache.hadoop.ozone.shell.TestScmAdminHA
[INFO] Tests run: 1, Failures: 0, Errors: 0, Skipped: 0, Time elapsed: 32.648 s - in org.apache.hadoop.ozone.shell.TestScmAdminHA
[INFO] Running org.apache.hadoop.ozone.shell.TestDeletedBlocksTxnShell
[INFO] Tests run: 1, Failures: 0, Errors: 0, Skipped: 0, Time elapsed: 45.946 s - in org.apache.hadoop.ozone.shell.TestDeletedBlocksTxnShell
[INFO] Running org.apache.hadoop.ozone.shell.TestOzoneDebugShell
[INFO] Tests run: 1, Failures: 0, Errors: 0, Skipped: 0, Time elapsed: 33.933 s - in org.apache.hadoop.ozone.shell.TestOzoneDebugShell
[INFO] Running org.apache.hadoop.ozone.shell.TestOzoneShellHA
[ERROR] Tests run: 20, Failures: 0, Errors: 1, Skipped: 0, Time elapsed: 110.542 s <<< FAILURE! - in org.apache.hadoop.ozone.shell.TestOzoneShellHA
[ERROR] org.apache.hadoop.ozone.shell.TestOzoneShellHA.testRecursiveVolumeDelete  Time elapsed: 12.448 s  <<< ERROR!
picocli.CommandLine$ExecutionException: Error while calling command (org.apache.hadoop.ozone.shell.volume.DeleteVolumeHandler@70e6dbf2): VOLUME_NOT_EMPTY org.apache.hadoop.ozone.om.exceptions.OMException: 
	at picocli.CommandLine.executeUserObject(CommandLine.java:1962)
	at picocli.CommandLine.access$1300(CommandLine.java:145)
	at picocli.CommandLine$RunLast.executeUserObjectOfLastSubcommandWithSameParent(CommandLine.java:2352)
	at picocli.CommandLine$RunLast.handle(CommandLine.java:2346)
	at picocli.CommandLine$RunLast.handle(CommandLine.java:2311)
	at picocli.CommandLine$AbstractParseResultHandler.handleParseResult(CommandLine.java:2172)
	at picocli.CommandLine.parseWithHandlers(CommandLine.java:2550)
	at org.apache.hadoop.ozone.shell.TestOzoneShellHA.execute(TestOzoneShellHA.java:234)
	at org.apache.hadoop.ozone.shell.TestOzoneShellHA.testRecursiveVolumeDelete(TestOzoneShellHA.java:1579)
	at sun.reflect.NativeMethodAccessorImpl.invoke0(Native Method)
	at sun.reflect.NativeMethodAccessorImpl.invoke(NativeMethodAccessorImpl.java:62)
	at sun.reflect.DelegatingMethodAccessorImpl.invoke(DelegatingMethodAccessorImpl.java:43)
	at java.lang.reflect.Method.invoke(Method.java:498)
	at org.junit.runners.model.FrameworkMethod$1.runReflectiveCall(FrameworkMethod.java:59)
	at org.junit.internal.runners.model.ReflectiveCallable.run(ReflectiveCallable.java:12)
	at org.junit.runners.model.FrameworkMethod.invokeExplosively(FrameworkMethod.java:56)
	at org.junit.internal.runners.statements.InvokeMethod.evaluate(InvokeMethod.java:17)
	at org.junit.internal.runners.statements.RunBefores.evaluate(RunBefores.java:26)
	at org.junit.internal.runners.statements.RunAfters.evaluate(RunAfters.java:27)
	at org.junit.internal.runners.statements.FailOnTimeout$CallableStatement.call(FailOnTimeout.java:288)
	at org.junit.internal.runners.statements.FailOnTimeout$CallableStatement.call(FailOnTimeout.java:282)
	at java.util.concurrent.FutureTask.run(FutureTask.java:266)
	at java.lang.Thread.run(Thread.java:750)
Caused by: VOLUME_NOT_EMPTY org.apache.hadoop.ozone.om.exceptions.OMException: 
	at org.apache.hadoop.ozone.om.protocolPB.OzoneManagerProtocolClientSideTranslatorPB.handleError(OzoneManagerProtocolClientSideTranslatorPB.java:713)
	at org.apache.hadoop.ozone.om.protocolPB.OzoneManagerProtocolClientSideTranslatorPB.deleteVolume(OzoneManagerProtocolClientSideTranslatorPB.java:447)
	at org.apache.hadoop.ozone.client.rpc.RpcClient.deleteVolume(RpcClient.java:546)
	at org.apache.hadoop.ozone.client.ObjectStore.deleteVolume(ObjectStore.java:389)
	at org.apache.hadoop.ozone.shell.volume.DeleteVolumeHandler.execute(DeleteVolumeHandler.java:130)
	at org.apache.hadoop.ozone.shell.Handler.call(Handler.java:98)
	at org.apache.hadoop.ozone.shell.Handler.call(Handler.java:44)
	at picocli.CommandLine.executeUserObject(CommandLine.java:1953)
	... 22 more

[INFO] Running org.apache.hadoop.ozone.shell.TestTransferLeadershipShell
[INFO] Tests run: 2, Failures: 0, Errors: 0, Skipped: 0, Time elapsed: 119.624 s - in org.apache.hadoop.ozone.shell.TestTransferLeadershipShell
[INFO] Running org.apache.hadoop.ozone.shell.TestOzoneShellHAWithFSO
[INFO] Tests run: 20, Failures: 0, Errors: 0, Skipped: 0, Time elapsed: 113.421 s - in org.apache.hadoop.ozone.shell.TestOzoneShellHAWithFSO
[INFO] Running org.apache.hadoop.ozone.shell.TestOzoneTenantShell
[INFO] Tests run: 6, Failures: 0, Errors: 0, Skipped: 0, Time elapsed: 22.742 s - in org.apache.hadoop.ozone.shell.TestOzoneTenantShell
[INFO] Running org.apache.hadoop.ozone.shell.TestOzoneDatanodeShell
[INFO] Tests run: 2, Failures: 0, Errors: 0, Skipped: 0, Time elapsed: 0.602 s - in org.apache.hadoop.ozone.shell.TestOzoneDatanodeShell
[INFO] Running org.apache.hadoop.ozone.shell.TestNSSummaryAdmin
[INFO] Tests run: 3, Failures: 0, Errors: 0, Skipped: 0, Time elapsed: 28.831 s - in org.apache.hadoop.ozone.shell.TestNSSummaryAdmin
[INFO] Running org.apache.hadoop.ozone.TestSecureOzoneCluster
[WARNING] Tests run: 16, Failures: 0, Errors: 0, Skipped: 2, Time elapsed: 142.383 s - in org.apache.hadoop.ozone.TestSecureOzoneCluster
[INFO] Running org.apache.hadoop.ozone.TestStorageContainerManager
[INFO] Tests run: 13, Failures: 0, Errors: 0, Skipped: 0, Time elapsed: 232.499 s - in org.apache.hadoop.ozone.TestStorageContainerManager
[INFO] Running org.apache.hadoop.ozone.TestOzoneConfigurationFields
[INFO] Tests run: 4, Failures: 0, Errors: 0, Skipped: 0, Time elapsed: 0.423 s - in org.apache.hadoop.ozone.TestOzoneConfigurationFields
[INFO] Running org.apache.hadoop.ozone.TestMiniOzoneOMHACluster
[INFO] Tests run: 1, Failures: 0, Errors: 0, Skipped: 0, Time elapsed: 32.901 s - in org.apache.hadoop.ozone.TestMiniOzoneOMHACluster
[INFO] Running org.apache.hadoop.ozone.TestContainerOperations
[INFO] Tests run: 4, Failures: 0, Errors: 0, Skipped: 0, Time elapsed: 26.144 s - in org.apache.hadoop.ozone.TestContainerOperations
[INFO] Running org.apache.hadoop.ozone.TestCpuMetrics
[INFO] Tests run: 1, Failures: 0, Errors: 0, Skipped: 0, Time elapsed: 17.652 s - in org.apache.hadoop.ozone.TestCpuMetrics
[INFO] Running org.apache.hadoop.ozone.TestBlockTokensCLI
[INFO] Tests run: 1, Failures: 0, Errors: 0, Skipped: 0, Time elapsed: 49.078 s - in org.apache.hadoop.ozone.TestBlockTokensCLI
[INFO] Running org.apache.hadoop.ozone.dn.scanner.TestBackgroundContainerMetadataScannerIntegration
[INFO] Tests run: 6, Failures: 0, Errors: 0, Skipped: 0, Time elapsed: 53.366 s - in org.apache.hadoop.ozone.dn.scanner.TestBackgroundContainerMetadataScannerIntegration
[INFO] Running org.apache.hadoop.ozone.dn.scanner.TestBackgroundContainerDataScannerIntegration
[INFO] Tests run: 9, Failures: 0, Errors: 0, Skipped: 0, Time elapsed: 71.852 s - in org.apache.hadoop.ozone.dn.scanner.TestBackgroundContainerDataScannerIntegration
[INFO] Running org.apache.hadoop.ozone.dn.scanner.TestOnDemandContainerDataScannerIntegration
[INFO] Tests run: 3, Failures: 0, Errors: 0, Skipped: 0, Time elapsed: 44.73 s - in org.apache.hadoop.ozone.dn.scanner.TestOnDemandContainerDataScannerIntegration
[INFO] Running org.apache.hadoop.ozone.dn.ratis.TestDnRatisLogParser
[INFO] Tests run: 1, Failures: 0, Errors: 0, Skipped: 0, Time elapsed: 24.177 s - in org.apache.hadoop.ozone.dn.ratis.TestDnRatisLogParser
[INFO] Running org.apache.hadoop.ozone.dn.volume.TestDatanodeHddsVolumeFailureToleration
[INFO] Tests run: 1, Failures: 0, Errors: 0, Skipped: 0, Time elapsed: 29.173 s - in org.apache.hadoop.ozone.dn.volume.TestDatanodeHddsVolumeFailureToleration
[INFO] Running org.apache.hadoop.ozone.dn.volume.TestDatanodeHddsVolumeFailureDetection
[INFO] Tests run: 6, Failures: 0, Errors: 0, Skipped: 0, Time elapsed: 134.052 s - in org.apache.hadoop.ozone.dn.volume.TestDatanodeHddsVolumeFailureDetection
[INFO] Running org.apache.hadoop.ozone.freon.TestDataValidateWithSafeByteOperations
[INFO] Tests run: 2, Failures: 0, Errors: 0, Skipped: 0, Time elapsed: 44.507 s - in org.apache.hadoop.ozone.freon.TestDataValidateWithSafeByteOperations
[INFO] Running org.apache.hadoop.ozone.freon.TestHadoopDirTreeGeneratorWithFSO
[INFO] Tests run: 1, Failures: 0, Errors: 0, Skipped: 0, Time elapsed: 52.924 s - in org.apache.hadoop.ozone.freon.TestHadoopDirTreeGeneratorWithFSO
[INFO] Running org.apache.hadoop.ozone.freon.TestDataValidateWithUnsafeByteOperations
[INFO] Tests run: 2, Failures: 0, Errors: 0, Skipped: 0, Time elapsed: 43.372 s - in org.apache.hadoop.ozone.freon.TestDataValidateWithUnsafeByteOperations
[INFO] Running org.apache.hadoop.ozone.freon.TestFreonWithDatanodeFastRestart
[WARNING] Tests run: 1, Failures: 0, Errors: 0, Skipped: 1, Time elapsed: 0.017 s - in org.apache.hadoop.ozone.freon.TestFreonWithDatanodeFastRestart
[INFO] Running org.apache.hadoop.ozone.freon.TestOMSnapshotDAG
[INFO] Tests run: 2, Failures: 0, Errors: 0, Skipped: 0, Time elapsed: 70.571 s - in org.apache.hadoop.ozone.freon.TestOMSnapshotDAG
[INFO] Running org.apache.hadoop.ozone.freon.TestFreonWithPipelineDestroy
[INFO] Tests run: 1, Failures: 0, Errors: 0, Skipped: 0, Time elapsed: 41.662 s - in org.apache.hadoop.ozone.freon.TestFreonWithPipelineDestroy
[INFO] Running org.apache.hadoop.ozone.freon.TestOmBucketReadWriteFileOps
[INFO] Tests run: 1, Failures: 0, Errors: 0, Skipped: 0, Time elapsed: 41.364 s - in org.apache.hadoop.ozone.freon.TestOmBucketReadWriteFileOps
[INFO] Running org.apache.hadoop.ozone.freon.TestOmBucketReadWriteKeyOps
[INFO] Tests run: 1, Failures: 0, Errors: 0, Skipped: 0, Time elapsed: 40.385 s - in org.apache.hadoop.ozone.freon.TestOmBucketReadWriteKeyOps
[INFO] Running org.apache.hadoop.ozone.freon.TestDataValidateWithDummyContainers
[INFO] Tests run: 2, Failures: 0, Errors: 0, Skipped: 0, Time elapsed: 33.017 s - in org.apache.hadoop.ozone.freon.TestDataValidateWithDummyContainers
[INFO] Running org.apache.hadoop.ozone.freon.TestRandomKeyGenerator
[INFO] Tests run: 8, Failures: 0, Errors: 0, Skipped: 0, Time elapsed: 210.071 s - in org.apache.hadoop.ozone.freon.TestRandomKeyGenerator
[INFO] Running org.apache.hadoop.ozone.freon.TestHadoopDirTreeGenerator
[INFO] Tests run: 1, Failures: 0, Errors: 0, Skipped: 0, Time elapsed: 53.745 s - in org.apache.hadoop.ozone.freon.TestHadoopDirTreeGenerator
[INFO] Running org.apache.hadoop.ozone.freon.TestHadoopNestedDirGenerator
[INFO] Tests run: 1, Failures: 0, Errors: 0, Skipped: 0, Time elapsed: 34.394 s - in org.apache.hadoop.ozone.freon.TestHadoopNestedDirGenerator
[INFO] Running org.apache.hadoop.ozone.TestSecretKeysApi
[INFO] Tests run: 5, Failures: 0, Errors: 0, Skipped: 0, Time elapsed: 234.749 s - in org.apache.hadoop.ozone.TestSecretKeysApi
[INFO] Running org.apache.hadoop.ozone.TestBlockTokens
[INFO] Tests run: 5, Failures: 0, Errors: 0, Skipped: 0, Time elapsed: 92.95 s - in org.apache.hadoop.ozone.TestBlockTokens
[INFO] 
[INFO] Results:
[INFO] 
[ERROR] Errors: 
[ERROR]   TestOzoneShellHA.testRecursiveVolumeDelete:1579->execute:234 » Execution Error...
[INFO] 
[ERROR] Tests run: 240, Failures: 0, Errors: 1, Skipped: 4
[INFO] 
[INFO] 
[INFO] ------------------------------------------------------------------------
[INFO] Skipping Apache Ozone Mini Ozone Chaos Tests
[INFO] This project has been banned from the build due to previous failures.
[INFO] ------------------------------------------------------------------------
[INFO] ------------------------------------------------------------------------
[INFO] Reactor Summary for Apache Ozone Integration Tests 1.4.0-SNAPSHOT:
[INFO] 
[INFO] Apache Ozone Integration Tests ..................... FAILURE [  01:11 h]
[INFO] Apache Ozone Mini Ozone Chaos Tests ................ SKIPPED
[INFO] ------------------------------------------------------------------------
[INFO] BUILD FAILURE
[INFO] ------------------------------------------------------------------------
[INFO] Total time:  01:11 h
[INFO] Finished at: 2023-06-28T21:56:32Z
[INFO] ------------------------------------------------------------------------
[ERROR] Failed to execute goal org.apache.maven.plugins:maven-surefire-plugin:3.0.0-M5:test (default-test) on project ozone-integration-test: There are test failures.
[ERROR] 
[ERROR] Please refer to /home/runner/work/ozone/ozone/hadoop-ozone/integration-test/target/surefire-reports for the individual test results.
[ERROR] Please refer to dump files (if any exist) [date].dump, [date]-jvmRun[N].dump and [date].dumpstream.
[ERROR] -> [Help 1]
[ERROR] 
[ERROR] To see the full stack trace of the errors, re-run Maven with the -e switch.
[ERROR] Re-run Maven using the -X switch to enable full debug logging.
[ERROR] 
[ERROR] For more information about the errors and possible solutions, please read the following articles:
[ERROR] [Help 1] http://cwiki.apache.org/confluence/display/MAVEN/MojoFailureException
