[INFO] Scanning for projects...
[INFO] ------------------------------------------------------------------------
[INFO] Detecting the operating system and CPU architecture
[INFO] ------------------------------------------------------------------------
[INFO] os.detected.name: linux
[INFO] os.detected.arch: x86_64
[INFO] os.detected.version: 5.15
[INFO] os.detected.version.major: 5
[INFO] os.detected.version.minor: 15
[INFO] os.detected.release: ubuntu
[INFO] os.detected.release.version: 20.04
[INFO] os.detected.release.like.ubuntu: true
[INFO] os.detected.release.like.debian: true
[INFO] os.detected.classifier: linux-x86_64
[INFO] ------------------------------------------------------------------------
[INFO] Reactor Build Order:
[INFO] 
[INFO] Apache Ozone Integration Tests                                     [jar]
[INFO] Apache Ozone Mini Ozone Chaos Tests                                [jar]
[INFO] 
[INFO] --------------< org.apache.ozone:ozone-integration-test >---------------
[INFO] Building Apache Ozone Integration Tests 1.4.0-SNAPSHOT             [1/2]
[INFO]   from pom.xml
[INFO] --------------------------------[ jar ]---------------------------------
[INFO] 
[INFO] --- maven-antrun-plugin:3.1.0:run (create-testdirs) @ ozone-integration-test ---
[INFO] Executing tasks
[INFO]     [mkdir] Created dir: /home/runner/work/ozone/ozone/hadoop-ozone/integration-test/target/test-dir
[INFO] Executed tasks
[INFO] 
[INFO] --- maven-enforcer-plugin:3.2.1:enforce (depcheck) @ ozone-integration-test ---
[INFO] Rule 0: org.apache.maven.enforcer.rules.dependency.DependencyConvergence passed
[INFO] Rule 1: org.apache.maven.enforcer.rules.version.RequireMavenVersion passed
[INFO] Rule 2: org.apache.maven.enforcer.rules.version.RequireJavaVersion passed
[INFO] 
[INFO] --- jacoco-maven-plugin:0.8.5:prepare-agent (default-prepare-agent) @ ozone-integration-test ---
[INFO] argLine set to -javaagent:/home/runner/.m2/repository/org/jacoco/org.jacoco.agent/0.8.5/org.jacoco.agent-0.8.5-runtime.jar=destfile=/home/runner/work/ozone/ozone/hadoop-ozone/integration-test/target/jacoco.exec,includes=org.apache.hadoop.hdds.*:org.apache.hadoop.ozone.*:org.apache.hadoop.fs.ozone.*
[INFO] 
[INFO] --- maven-enforcer-plugin:3.2.1:enforce (banned-rocksdb-imports) @ ozone-integration-test ---
[INFO] Rule 0: org.apache.maven.plugins.enforcer.RestrictImports passed
[INFO] Rule 1: org.apache.maven.plugins.enforcer.RestrictImports passed
[INFO] Rule 2: org.apache.maven.plugins.enforcer.RestrictImports passed
[INFO] 
[INFO] --- maven-enforcer-plugin:3.2.1:enforce (ban-junit4-imports) @ ozone-integration-test ---
[INFO] Skipping Rule Enforcement.
[INFO] 
[INFO] --- maven-remote-resources-plugin:1.5:process (default) @ ozone-integration-test ---
[INFO] 
[INFO] --- maven-resources-plugin:3.1.0:resources (default-resources) @ ozone-integration-test ---
[INFO] Using 'UTF-8' encoding to copy filtered resources.
[INFO] skip non existing resourceDirectory /home/runner/work/ozone/ozone/hadoop-ozone/integration-test/src/main/resources
[INFO] Copying 2 resources
[INFO] 
[INFO] --- maven-compiler-plugin:3.1:compile (default-compile) @ ozone-integration-test ---
[INFO] No sources to compile
[INFO] 
[INFO] --- maven-resources-plugin:3.1.0:testResources (default-testResources) @ ozone-integration-test ---
[INFO] Using 'UTF-8' encoding to copy filtered resources.
[INFO] Copying 22 resources
[INFO] Copying 2 resources
[INFO] 
[INFO] --- maven-compiler-plugin:3.1:testCompile (default-testCompile) @ ozone-integration-test ---
[INFO] Compiling 282 source files to /home/runner/work/ozone/ozone/hadoop-ozone/integration-test/target/test-classes
[WARNING] /home/runner/work/ozone/ozone/hadoop-ozone/integration-test/src/test/java/org/apache/hadoop/ozone/TestBlockTokens.java: Some input files use or override a deprecated API.
[WARNING] /home/runner/work/ozone/ozone/hadoop-ozone/integration-test/src/test/java/org/apache/hadoop/ozone/TestBlockTokens.java: Recompile with -Xlint:deprecation for details.
[WARNING] /home/runner/work/ozone/ozone/hadoop-ozone/integration-test/src/test/java/org/apache/hadoop/ozone/om/ratis/TestOzoneManagerRatisRequest.java: Some input files use unchecked or unsafe operations.
[WARNING] /home/runner/work/ozone/ozone/hadoop-ozone/integration-test/src/test/java/org/apache/hadoop/ozone/om/ratis/TestOzoneManagerRatisRequest.java: Recompile with -Xlint:unchecked for details.
[INFO] 
[INFO] --- maven-surefire-plugin:3.0.0-M5:test (default-test) @ ozone-integration-test ---
[INFO] 
[INFO] -------------------------------------------------------
[INFO]  T E S T S
[INFO] -------------------------------------------------------
[INFO] Running org.apache.hadoop.ozone.TestContainerStateMachineIdempotency
[INFO] Tests run: 1, Failures: 0, Errors: 0, Skipped: 0, Time elapsed: 27.435 s - in org.apache.hadoop.ozone.TestContainerStateMachineIdempotency
[INFO] Running org.apache.hadoop.ozone.TestOzoneConfigurationFields
[INFO] Tests run: 4, Failures: 0, Errors: 0, Skipped: 0, Time elapsed: 0.689 s - in org.apache.hadoop.ozone.TestOzoneConfigurationFields
[INFO] Running org.apache.hadoop.ozone.TestCpuMetrics
[INFO] Tests run: 1, Failures: 0, Errors: 0, Skipped: 0, Time elapsed: 17.855 s - in org.apache.hadoop.ozone.TestCpuMetrics
[INFO] Running org.apache.hadoop.ozone.reconfig.TestDatanodeReconfiguration
[INFO] Tests run: 6, Failures: 0, Errors: 0, Skipped: 0, Time elapsed: 25.734 s - in org.apache.hadoop.ozone.reconfig.TestDatanodeReconfiguration
[INFO] Running org.apache.hadoop.ozone.reconfig.TestOmReconfiguration
[INFO] Tests run: 4, Failures: 0, Errors: 0, Skipped: 0, Time elapsed: 26.401 s - in org.apache.hadoop.ozone.reconfig.TestOmReconfiguration
[INFO] Running org.apache.hadoop.ozone.reconfig.TestScmReconfiguration
[INFO] Tests run: 5, Failures: 0, Errors: 0, Skipped: 0, Time elapsed: 26.314 s - in org.apache.hadoop.ozone.reconfig.TestScmReconfiguration
[INFO] Running org.apache.hadoop.ozone.TestMiniOzoneCluster
[INFO] Tests run: 5, Failures: 0, Errors: 0, Skipped: 0, Time elapsed: 114.172 s - in org.apache.hadoop.ozone.TestMiniOzoneCluster
[INFO] Running org.apache.hadoop.ozone.fsck.TestContainerMapper
[INFO] Tests run: 1, Failures: 0, Errors: 0, Skipped: 0, Time elapsed: 29.463 s - in org.apache.hadoop.ozone.fsck.TestContainerMapper
[INFO] Running org.apache.hadoop.ozone.TestBlockTokensCLI
[INFO] Tests run: 3, Failures: 0, Errors: 0, Skipped: 0, Time elapsed: 58.847 s - in org.apache.hadoop.ozone.TestBlockTokensCLI
[INFO] Running org.apache.hadoop.ozone.container.ozoneimpl.TestSecureOzoneContainer
[INFO] Tests run: 5, Failures: 0, Errors: 0, Skipped: 0, Time elapsed: 18.952 s - in org.apache.hadoop.ozone.container.ozoneimpl.TestSecureOzoneContainer
[INFO] Running org.apache.hadoop.ozone.container.ozoneimpl.TestOzoneContainer
[INFO] Tests run: 7, Failures: 0, Errors: 0, Skipped: 0, Time elapsed: 82.938 s - in org.apache.hadoop.ozone.container.ozoneimpl.TestOzoneContainer
[INFO] Running org.apache.hadoop.ozone.container.ozoneimpl.TestOzoneContainerWithTLS
[INFO] Tests run: 6, Failures: 0, Errors: 0, Skipped: 0, Time elapsed: 43.821 s - in org.apache.hadoop.ozone.container.ozoneimpl.TestOzoneContainerWithTLS
[INFO] Running org.apache.hadoop.ozone.container.replication.TestContainerReplication
[INFO] Tests run: 12, Failures: 0, Errors: 0, Skipped: 0, Time elapsed: 56.755 s - in org.apache.hadoop.ozone.container.replication.TestContainerReplication
[INFO] Running org.apache.hadoop.ozone.container.TestContainerReplication
[INFO] Tests run: 6, Failures: 0, Errors: 0, Skipped: 0, Time elapsed: 218.542 s - in org.apache.hadoop.ozone.container.TestContainerReplication
[INFO] Running org.apache.hadoop.ozone.container.TestECContainerRecovery
[INFO] Tests run: 2, Failures: 0, Errors: 0, Skipped: 0, Time elapsed: 108.112 s - in org.apache.hadoop.ozone.container.TestECContainerRecovery
[INFO] Running org.apache.hadoop.ozone.container.server.TestSecureContainerServer
[ERROR] Tests run: 2, Failures: 0, Errors: 1, Skipped: 0, Time elapsed: 17.335 s <<< FAILURE! - in org.apache.hadoop.ozone.container.server.TestSecureContainerServer
[ERROR] org.apache.hadoop.ozone.container.server.TestSecureContainerServer.testClientServerRatisGrpc  Time elapsed: 8.959 s  <<< ERROR!
org.apache.ratis.util.ExitUtils$ExitException: Failed to start Grpc server
	at org.apache.ratis.util.ExitUtils.terminate(ExitUtils.java:141)
	at org.apache.ratis.util.ExitUtils.terminate(ExitUtils.java:151)
	at org.apache.ratis.grpc.server.GrpcService.startImpl(GrpcService.java:300)
	at org.apache.ratis.util.LifeCycle.startAndTransition(LifeCycle.java:270)
	at org.apache.ratis.server.RaftServerRpcWithProxy.start(RaftServerRpcWithProxy.java:72)
	at org.apache.ratis.server.impl.RaftServerProxy.startImpl(RaftServerProxy.java:401)
	at org.apache.ratis.util.LifeCycle.startAndTransition(LifeCycle.java:270)
	at org.apache.ratis.server.impl.RaftServerProxy.start(RaftServerProxy.java:394)
	at org.apache.hadoop.ozone.container.common.transport.server.ratis.XceiverServerRatis.start(XceiverServerRatis.java:522)
	at org.apache.hadoop.ozone.container.server.TestSecureContainerServer.runTestClientServer(TestSecureContainerServer.java:249)
	at org.apache.hadoop.ozone.container.server.TestSecureContainerServer.runTestClientServerRatis(TestSecureContainerServer.java:222)
	at org.apache.hadoop.ozone.container.server.TestSecureContainerServer.testClientServerRatisGrpc(TestSecureContainerServer.java:200)
	at sun.reflect.NativeMethodAccessorImpl.invoke0(Native Method)
	at sun.reflect.NativeMethodAccessorImpl.invoke(NativeMethodAccessorImpl.java:62)
	at sun.reflect.DelegatingMethodAccessorImpl.invoke(DelegatingMethodAccessorImpl.java:43)
	at java.lang.reflect.Method.invoke(Method.java:498)
	at org.junit.runners.model.FrameworkMethod$1.runReflectiveCall(FrameworkMethod.java:59)
	at org.junit.internal.runners.model.ReflectiveCallable.run(ReflectiveCallable.java:12)
	at org.junit.runners.model.FrameworkMethod.invokeExplosively(FrameworkMethod.java:56)
	at org.junit.internal.runners.statements.InvokeMethod.evaluate(InvokeMethod.java:17)
	at org.junit.internal.runners.statements.RunAfters.evaluate(RunAfters.java:27)
	at org.junit.runners.ParentRunner$3.evaluate(ParentRunner.java:306)
	at org.junit.runners.BlockJUnit4ClassRunner$1.evaluate(BlockJUnit4ClassRunner.java:100)
	at org.junit.runners.ParentRunner.runLeaf(ParentRunner.java:366)
	at org.junit.runners.BlockJUnit4ClassRunner.runChild(BlockJUnit4ClassRunner.java:103)
	at org.junit.runners.BlockJUnit4ClassRunner.runChild(BlockJUnit4ClassRunner.java:63)
	at org.junit.runners.ParentRunner$4.run(ParentRunner.java:331)
	at org.junit.runners.ParentRunner$1.schedule(ParentRunner.java:79)
	at org.junit.runners.ParentRunner.runChildren(ParentRunner.java:329)
	at org.junit.runners.ParentRunner.access$100(ParentRunner.java:66)
	at org.junit.runners.ParentRunner$2.evaluate(ParentRunner.java:293)
	at org.junit.internal.runners.statements.RunBefores.evaluate(RunBefores.java:26)
	at org.junit.internal.runners.statements.RunAfters.evaluate(RunAfters.java:27)
	at org.junit.runners.ParentRunner$3.evaluate(ParentRunner.java:306)
	at org.junit.runners.ParentRunner.run(ParentRunner.java:413)
	at org.junit.runner.JUnitCore.run(JUnitCore.java:137)
	at org.junit.runner.JUnitCore.run(JUnitCore.java:115)
	at org.junit.vintage.engine.execution.RunnerExecutor.execute(RunnerExecutor.java:42)
	at org.junit.vintage.engine.VintageTestEngine.executeAllChildren(VintageTestEngine.java:80)
	at org.junit.vintage.engine.VintageTestEngine.execute(VintageTestEngine.java:72)
	at org.junit.platform.launcher.core.EngineExecutionOrchestrator.execute(EngineExecutionOrchestrator.java:107)
	at org.junit.platform.launcher.core.EngineExecutionOrchestrator.execute(EngineExecutionOrchestrator.java:88)
	at org.junit.platform.launcher.core.EngineExecutionOrchestrator.lambda$execute$0(EngineExecutionOrchestrator.java:54)
	at org.junit.platform.launcher.core.EngineExecutionOrchestrator.withInterceptedStreams(EngineExecutionOrchestrator.java:67)
	at org.junit.platform.launcher.core.EngineExecutionOrchestrator.execute(EngineExecutionOrchestrator.java:52)
	at org.junit.platform.launcher.core.DefaultLauncher.execute(DefaultLauncher.java:114)
	at org.junit.platform.launcher.core.DefaultLauncher.execute(DefaultLauncher.java:86)
	at org.junit.platform.launcher.core.DefaultLauncherSession$DelegatingLauncher.execute(DefaultLauncherSession.java:86)
	at org.junit.platform.launcher.core.SessionPerRequestLauncher.execute(SessionPerRequestLauncher.java:53)
	at org.apache.maven.surefire.junitplatform.JUnitPlatformProvider.execute(JUnitPlatformProvider.java:188)
	at org.apache.maven.surefire.junitplatform.JUnitPlatformProvider.invokeAllTests(JUnitPlatformProvider.java:154)
	at org.apache.maven.surefire.junitplatform.JUnitPlatformProvider.invoke(JUnitPlatformProvider.java:124)
	at org.apache.maven.surefire.booter.ForkedBooter.runSuitesInProcess(ForkedBooter.java:428)
	at org.apache.maven.surefire.booter.ForkedBooter.execute(ForkedBooter.java:162)
	at org.apache.maven.surefire.booter.ForkedBooter.run(ForkedBooter.java:562)
	at org.apache.maven.surefire.booter.ForkedBooter.main(ForkedBooter.java:548)
Caused by: java.io.IOException: Failed to bind to address 0.0.0.0/0.0.0.0:45227
	at org.apache.ratis.thirdparty.io.grpc.netty.NettyServer.start(NettyServer.java:328)
	at org.apache.ratis.thirdparty.io.grpc.internal.ServerImpl.start(ServerImpl.java:184)
	at org.apache.ratis.thirdparty.io.grpc.internal.ServerImpl.start(ServerImpl.java:93)
	at org.apache.ratis.grpc.server.GrpcService.startImpl(GrpcService.java:298)
	... 53 more
Caused by: org.apache.ratis.thirdparty.io.netty.channel.unix.Errors$NativeIoException: bind(..) failed: Address already in use

[INFO] Running org.apache.hadoop.ozone.container.common.statemachine.commandhandler.TestCloseContainerHandler
[INFO] Tests run: 1, Failures: 0, Errors: 0, Skipped: 0, Time elapsed: 32.274 s - in org.apache.hadoop.ozone.container.common.statemachine.commandhandler.TestCloseContainerHandler
[INFO] Running org.apache.hadoop.ozone.container.common.statemachine.commandhandler.TestDeleteContainerHandler
[INFO] Tests run: 6, Failures: 0, Errors: 0, Skipped: 0, Time elapsed: 86.803 s - in org.apache.hadoop.ozone.container.common.statemachine.commandhandler.TestDeleteContainerHandler
[INFO] Running org.apache.hadoop.ozone.container.common.statemachine.commandhandler.TestRefreshVolumeUsageHandler
[INFO] Tests run: 1, Failures: 0, Errors: 0, Skipped: 0, Time elapsed: 31.108 s - in org.apache.hadoop.ozone.container.common.statemachine.commandhandler.TestRefreshVolumeUsageHandler
[INFO] Running org.apache.hadoop.ozone.container.common.statemachine.commandhandler.TestCloseContainerByPipeline
[INFO] Tests run: 3, Failures: 0, Errors: 0, Skipped: 0, Time elapsed: 42.708 s - in org.apache.hadoop.ozone.container.common.statemachine.commandhandler.TestCloseContainerByPipeline
[INFO] Running org.apache.hadoop.ozone.container.common.statemachine.commandhandler.TestBlockDeletion
[INFO] Tests run: 6, Failures: 0, Errors: 0, Skipped: 0, Time elapsed: 255.348 s - in org.apache.hadoop.ozone.container.common.statemachine.commandhandler.TestBlockDeletion
[INFO] Running org.apache.hadoop.ozone.container.common.transport.server.ratis.TestCSMMetrics
[INFO] Tests run: 1, Failures: 0, Errors: 0, Skipped: 0, Time elapsed: 13.723 s - in org.apache.hadoop.ozone.container.common.transport.server.ratis.TestCSMMetrics
[INFO] Running org.apache.hadoop.ozone.container.metrics.TestContainerMetrics
[INFO] Tests run: 1, Failures: 0, Errors: 0, Skipped: 0, Time elapsed: 9.153 s - in org.apache.hadoop.ozone.container.metrics.TestContainerMetrics
[INFO] Running org.apache.hadoop.ozone.container.metrics.TestDatanodeQueueMetrics
[INFO] Tests run: 1, Failures: 0, Errors: 0, Skipped: 0, Time elapsed: 36.183 s - in org.apache.hadoop.ozone.container.metrics.TestDatanodeQueueMetrics
[INFO] Running org.apache.hadoop.ozone.recon.TestReconInsightsForDeletedDirectories
[INFO] Tests run: 3, Failures: 0, Errors: 0, Skipped: 0, Time elapsed: 56.655 s - in org.apache.hadoop.ozone.recon.TestReconInsightsForDeletedDirectories
[INFO] Running org.apache.hadoop.ozone.recon.TestReconAsPassiveScm
[INFO] Tests run: 2, Failures: 0, Errors: 0, Skipped: 0, Time elapsed: 78.185 s - in org.apache.hadoop.ozone.recon.TestReconAsPassiveScm
[INFO] Running org.apache.hadoop.ozone.recon.TestReconWithOzoneManager
[INFO] Tests run: 1, Failures: 0, Errors: 0, Skipped: 0, Time elapsed: 52.948 s - in org.apache.hadoop.ozone.recon.TestReconWithOzoneManager
[INFO] Running org.apache.hadoop.ozone.recon.TestReconWithOzoneManagerFSO
[INFO] Tests run: 1, Failures: 0, Errors: 0, Skipped: 0, Time elapsed: 50.922 s - in org.apache.hadoop.ozone.recon.TestReconWithOzoneManagerFSO
[INFO] Running org.apache.hadoop.ozone.recon.TestReconWithOzoneManagerHA
[INFO] Tests run: 1, Failures: 0, Errors: 0, Skipped: 0, Time elapsed: 57.235 s - in org.apache.hadoop.ozone.recon.TestReconWithOzoneManagerHA
[INFO] Running org.apache.hadoop.ozone.recon.TestReconScmHASnapshot
[INFO] Tests run: 1, Failures: 0, Errors: 0, Skipped: 0, Time elapsed: 67.68 s - in org.apache.hadoop.ozone.recon.TestReconScmHASnapshot
[INFO] Running org.apache.hadoop.ozone.recon.TestReconTasks
[INFO] Tests run: 2, Failures: 0, Errors: 0, Skipped: 0, Time elapsed: 104.715 s - in org.apache.hadoop.ozone.recon.TestReconTasks
[INFO] Running org.apache.hadoop.ozone.recon.TestReconScmSnapshot
[INFO] Tests run: 1, Failures: 0, Errors: 0, Skipped: 0, Time elapsed: 55.617 s - in org.apache.hadoop.ozone.recon.TestReconScmSnapshot
[INFO] Running org.apache.hadoop.ozone.TestContainerOperations
[INFO] Tests run: 4, Failures: 0, Errors: 0, Skipped: 0, Time elapsed: 25.572 s - in org.apache.hadoop.ozone.TestContainerOperations
[INFO] Running org.apache.hadoop.ozone.TestBlockTokens
[INFO] Tests run: 5, Failures: 0, Errors: 0, Skipped: 0, Time elapsed: 98.557 s - in org.apache.hadoop.ozone.TestBlockTokens
[INFO] Running org.apache.hadoop.ozone.dn.ratis.TestDnRatisLogParser
[INFO] Tests run: 1, Failures: 0, Errors: 0, Skipped: 0, Time elapsed: 25.53 s - in org.apache.hadoop.ozone.dn.ratis.TestDnRatisLogParser
[INFO] Running org.apache.hadoop.ozone.dn.volume.TestDatanodeHddsVolumeFailureToleration
[INFO] Tests run: 1, Failures: 0, Errors: 0, Skipped: 0, Time elapsed: 34.633 s - in org.apache.hadoop.ozone.dn.volume.TestDatanodeHddsVolumeFailureToleration
[INFO] Running org.apache.hadoop.ozone.dn.volume.TestDatanodeHddsVolumeFailureDetection
[INFO] Tests run: 6, Failures: 0, Errors: 0, Skipped: 0, Time elapsed: 132.022 s - in org.apache.hadoop.ozone.dn.volume.TestDatanodeHddsVolumeFailureDetection
[INFO] Running org.apache.hadoop.ozone.dn.scanner.TestBackgroundContainerDataScannerIntegration
[INFO] Tests run: 9, Failures: 0, Errors: 0, Skipped: 0, Time elapsed: 71.799 s - in org.apache.hadoop.ozone.dn.scanner.TestBackgroundContainerDataScannerIntegration
[INFO] Running org.apache.hadoop.ozone.dn.scanner.TestOnDemandContainerDataScannerIntegration
[INFO] Tests run: 3, Failures: 0, Errors: 0, Skipped: 0, Time elapsed: 42.873 s - in org.apache.hadoop.ozone.dn.scanner.TestOnDemandContainerDataScannerIntegration
[INFO] Running org.apache.hadoop.ozone.dn.scanner.TestBackgroundContainerMetadataScannerIntegration
[INFO] Tests run: 6, Failures: 0, Errors: 0, Skipped: 0, Time elapsed: 50.591 s - in org.apache.hadoop.ozone.dn.scanner.TestBackgroundContainerMetadataScannerIntegration
[INFO] Running org.apache.hadoop.ozone.TestDelegationToken
[INFO] Tests run: 2, Failures: 0, Errors: 0, Skipped: 0, Time elapsed: 31.845 s - in org.apache.hadoop.ozone.TestDelegationToken
[INFO] Running org.apache.hadoop.ozone.TestSecureOzoneCluster
[INFO] Tests run: 13, Failures: 0, Errors: 0, Skipped: 0, Time elapsed: 134.644 s - in org.apache.hadoop.ozone.TestSecureOzoneCluster
[INFO] Running org.apache.hadoop.ozone.TestMiniOzoneOMHACluster
[INFO] Tests run: 1, Failures: 0, Errors: 0, Skipped: 0, Time elapsed: 30.623 s - in org.apache.hadoop.ozone.TestMiniOzoneOMHACluster
[INFO] 
[INFO] Results:
[INFO] 
[ERROR] Errors: 
[ERROR]   TestSecureContainerServer.testClientServerRatisGrpc:200->runTestClientServerRatis:222->runTestClientServer:249 » Exit
[INFO] 
[ERROR] Tests run: 153, Failures: 0, Errors: 1, Skipped: 0
[INFO] 
[INFO] 
[INFO] ------------------------------------------------------------------------
[INFO] Skipping Apache Ozone Mini Ozone Chaos Tests
[INFO] This project has been banned from the build due to previous failures.
[INFO] ------------------------------------------------------------------------
[INFO] ------------------------------------------------------------------------
[INFO] Reactor Summary for Apache Ozone Integration Tests 1.4.0-SNAPSHOT:
[INFO] 
[INFO] Apache Ozone Integration Tests ..................... FAILURE [44:51 min]
[INFO] Apache Ozone Mini Ozone Chaos Tests ................ SKIPPED
[INFO] ------------------------------------------------------------------------
[INFO] BUILD FAILURE
[INFO] ------------------------------------------------------------------------
[INFO] Total time:  44:52 min
[INFO] Finished at: 2023-11-15T05:27:36Z
[INFO] ------------------------------------------------------------------------
[INFO] 11 goals, 11 executed
[INFO] 
[INFO] Publishing build scan...
[INFO] https://ge.apache.org/s/rlc66vwf5fnie
[INFO] 
[ERROR] Failed to execute goal org.apache.maven.plugins:maven-surefire-plugin:3.0.0-M5:test (default-test) on project ozone-integration-test: There are test failures.
[ERROR] 
[ERROR] Please refer to /home/runner/work/ozone/ozone/hadoop-ozone/integration-test/target/surefire-reports for the individual test results.
[ERROR] Please refer to dump files (if any exist) [date].dump, [date]-jvmRun[N].dump and [date].dumpstream.
[ERROR] -> [Help 1]
[ERROR] 
[ERROR] To see the full stack trace of the errors, re-run Maven with the -e switch.
[ERROR] Re-run Maven using the -X switch to enable full debug logging.
[ERROR] 
[ERROR] For more information about the errors and possible solutions, please read the following articles:
[ERROR] [Help 1] http://cwiki.apache.org/confluence/display/MAVEN/MojoFailureException
